序號,統一編號,公司名稱,公司所在地,代表人,資本額,核准設立日期,核准解散日期
892,54258884,翔翊全方位開發有限公司,臺中市西屯區上安里台中港路2段122-18號11樓,null,2500000,1020605,1030410
893,54264035,旭頓有限公司,臺中市南屯區南屯里河南路4段708號1樓,null,200000,1020617,1030417
894,54265604,兆奕企業有限公司,彰化縣秀水鄉安東村仁愛路11巷1弄3號,null,2000000,1020619,1030430
895,54273273,馥群事業股份有限公司,新北市中和區福和里中山路2段133號12樓之1,null,20000000,1020529,1030401
896,54275722,贏家企管顧問有限公司,新北市新莊區中平路198巷3號,null,500000,1020607,1030424
897,54278501,捷銨馳汽車有限公司,"新北市新店區寶中路94號,94之1號,94號地下一層",null,500000,1020620,1030415
898,54279071,筑韻國際有限公司,新北市新店區安祥路73巷51號8樓,null,1000000,1020624,1030414
899,54286116,蔡瑞陽茶舖有限公司,新北市坪林區金瓜寮3號之2,null,100000,1020723,1030409
900,54286452,薇美嚴選有限公司,新北市樹林區日新街62號,null,600000,1020724,1030414
901,54287327,圖特設計行銷有限公司,新北市中和區立德街98巷93號(1樓),null,500000,1020729,1030401
902,54290527,龍集富有限公司,新北市板橋區民治街144巷6號,null,30000,1020813,1030430
903,54291949,煒星企業有限公司,新北市板橋區忠誠里陽明街29巷19號3樓,null,1300000,1020820,1030410
904,54292237,長恩實業有限公司,新北市汐止區福德二路71號2樓之2,null,500000,1020820,1030422
905,54292757,星雅商貿有限公司,新北市八里區中山路1段398巷32號8樓,null,300000,1020823,1030403
906,54293215,兆迅有限公司,新北市新莊區雙鳳里中山路3段529號4樓,null,1000000,1020827,1030429
907,54293279,勁奇光電有限公司,新北市永和區保安路73號,null,1000000,1020827,1030411
908,54293469,筌峰工程有限公司,新北市新莊區中原路183號9樓,null,100000,1020827,1030430
909,54294360,創安資通有限公司,新北市板橋區長江路3段17號,null,1000000,1020902,1030410
910,54296418,?鉅精品有限公司,新北市三重區仁政街13號(1樓),null,100000,1020906,1030416
911,54296732,酒尊貿易有限公司,新北市新莊區五權一路9號8樓之2,null,1000000,1020912,1030417
912,54296873,德樺不動產仲介經紀有限公司,新北市板橋區篤行路3段9號,null,1000000,1020913,1030416
913,54298416,可蜂資訊有限公司,新北市板橋區四川路1段23號9樓之1,null,600000,1020923,1030418
914,54299739,七海生技有限公司,新北市永和區國中路33號,null,50000,1020927,1030424
915,54302930,京華國際?草有限公司,新北市淡水區濱海路1段416號7樓,null,500000,1021014,1030403
916,54306056,衣加有限公司,新北市鶯歌區南鶯里國慶街105號(1樓),null,1000000,1021025,1030403
917,54309737,歐士達國際有限公司,新北市汐止區新台五路2段91號8樓之7,null,500000,1021112,1030407
918,54320297,檜樂能量實業有限公司,臺北市內湖區環山路1段136巷18弄13號1樓,null,580000,1020509,1030417
919,54321492,中文美苑有限公司,臺北市大安區光復南路330號,null,700000,1020513,1030410
920,54321970,玩味中國股份有限公司,臺北市中山區復興北路420號7樓,null,800000,1020514,1030410
921,54322226,萬達事業有限公司,臺北市萬華區開封街2段32號2樓,null,6000000,1020515,1030407
922,54328642,七零數位股份有限公司,臺北市大安區仁愛路3段31巷11之10號6樓,null,2100000,1020605,1030402
923,54331013,康沛企業有限公司,臺北市萬華區東園街28巷50號2樓之18,null,500000,1020614,1030411
924,54331251,王府餐飲有限公司,臺北市內湖區成功路2段185號1樓,null,300000,1020614,1030411
925,54334166,富來格有限公司,臺北市信義區光復南路587號,null,2000000,1020626,1030408
926,54335290,卉豐貿易有限公司,臺北市大安區新生南路1段123號12樓,null,1000000,1020628,1030416
927,54335799,百川設計有限公司,臺北市大安區光復南路240巷55號3樓,null,100000,1020701,1030423
928,54337038,達福林有限公司,臺北市大同區民權西路236號2樓,null,100000,1020704,1030423
929,54339198,明靜眼鏡有限公司,臺北市大同區民權西路157號,null,500000,1020711,1030414
930,54340081,橙子設計有限公司,臺北市松山區南京東路4段17號8樓之4,null,500000,1020717,1030403
931,54340126,品誠文化有限公司,臺北市中山區林森北路554號2樓,null,100000,1020716,1030407
932,54345261,翊禾車業有限公司,臺北市內湖區環山路1段90號,null,2500000,1020729,1030410
933,54348540,鼎鑫有限公司,臺北市大安區敦化南路1段225號6樓之10,null,500000,1020807,1030402
934,54350165,台灣大錢幣股份有限公司,臺北市松山區南京東路3段189號8樓,null,250000,1020813,1030407
935,54350897,路意識有限公司,臺北市萬華區環河南路2段168號,null,500000,1020814,1030401
936,54351734,潤德資產管理有限公司,臺北市內湖區瑞光路513巷22弄5號8樓之4,null,1680000,1020819,1030402
937,54354090,台灣中思文化發展有限公司,臺北市大安區基隆路2段164號2樓之5,null,3000000,1020827,1030403
938,54354330,陳柯特曼創作工程式有限公司,臺北市信義區光復南路421號5樓,null,1000000,1020827,1030430
939,54358286,驗專有限公司,臺北市中山區新生北路1段48號8樓,null,200000,1020910,1030408
940,54360092,益聖富養生坊有限公司,臺北市內湖區民權東路6段123巷20弄5號(1樓),null,5000000,1020914,1030410
941,54362009,瑤伸有限公司,臺北市信義區忠孝東路5段1-8號2樓,null,500000,1020924,1030410
942,54362633,東豐鍍膜有限公司,臺北市中山區林森北路95號3樓,null,1000000,1020926,1030414
943,54366624,葳力國際有限公司,臺北市松山區南京東路3段287號9樓,null,1000000,1021009,1030429
944,54366737,愛俞雅有限公司,臺北市文山區羅斯福路5段101號7樓之3,null,1000000,1021009,1030421
945,54399569,鈞智國際股份有限公司,臺中市北屯區平興里梅川東路4段95號6樓之1,null,1000000,1020626,1030429
946,54500586,國際英雄有限公司,新竹市東區長春街77號,null,100000,1020627,1030428
947,54505978,鴻祥企業有限公司,桃園縣中壢市新興里自忠二街282號2樓,null,500000,1020712,1030411
948,54508840,鈦亨科技有限公司,桃園縣楊梅市秀才路55-1號,null,300000,1020723,1030418
949,54511578,康富益多通路行銷有限公司,新竹市東區科園里科學園路42號1樓,null,1000000,1020801,1030408
950,54513739,勃奕不動產經紀有限公司,桃園縣觀音鄉草漯村大觀路二段169之1號,null,1000000,1020808,1030425
951,54513858,前進材料有限公司,桃園縣中壢市中園路二段145之25號,null,2000000,1020809,1030408
952,54514245,番師傅食品有限公司,宜蘭縣五結鄉二結村中正路三段17號1樓,null,1500000,1020812,1030403
953,54514527,今采禮品有限公司,桃園縣蘆竹鄉南崁村南華三街1號1樓,null,1000000,1020812,1030407
954,54516264,緯柏資產管理有限公司,基隆市仁愛區林泉里復興街16巷14號,null,250000,1020816,1030421
955,54522688,明山國際企業有限公司,桃園縣平鎮市平興里延平路二段430巷65號11樓,null,500000,1020912,1030410
956,54531820,台灣救護車事業股份有限公司,基隆市暖暖區八堵路73號(1樓店面及地下樓),null,12000000,1021016,1030403
957,54532031,巴方好朋友有限公司,桃園縣桃園市龍鳳里龍安街88號2樓,null,50000,1021017,1030408
958,54532975,富益康健康管理顧問有限公司,桃園縣桃園市自強里經國路601號16樓之1,null,1000000,1021021,1030430
959,54535109,臻蓁豐富資源貿易有限公司,雲林縣斗六市鎮北里育英北街101-9號1樓,null,500000,1021028,1030402
960,54536000,佑富企業有限公司,雲林縣元長鄉長北村中山路64之1號1樓,null,50000,1021030,1030411
961,54537042,全民生活顧問有限公司,桃園縣楊梅市永美路447號,null,380000,1021104,1030418
962,54546719,波納荷實業有限公司,新竹縣竹北市成功二街99號,null,2200000,1021205,1030421
963,54548934,褔林公寓大廈管理維護股份有限公司,桃園縣中壢市華勛里華仁一街17號,null,10000000,1021213,1030408
964,54550635,惟美有限公司,臺南市永康區文化路309號2樓,null,1000000,1021225,1030411
965,54553719,弘達興業有限公司,臺南市學甲區明宜里宮西路7鄰50之1號1樓,null,200000,1030224,1030425
966,54586937,專裕國際有限公司,臺中市南區長春里正義街33號8號之4,null,1000000,1020808,1030421
967,54590313,星程金屬有限公司,臺中市神岡區神岡路219號1樓,null,200000,1020828,1030414
968,54593281,林駿業工程有限公司,臺中市豐原區西安里西勢路190巷32弄4號1樓,null,200000,1020916,1030424
969,54594795,康德仕股份有限公司,臺中市南區永和里南和一街16巷20號1樓,null,500000,1020926,1030407
970,54595345,天磯菁英顧問有限公司,臺中市東勢區上新里忠孝街69號1樓,null,250000,1020930,1030423
971,54597006,昌恆餐飲有限公司,臺中市沙鹿區北勢東路449號,null,5000000,1021009,1030407
972,54598510,亞洲福匯國際投資有限公司,臺中市西屯區福中里中工二路296號1樓,null,2000000,1021018,1030408
973,54600467,和晟有限公司,臺中市西屯區中康街215巷5號,null,500000,1021031,1030402
974,54601775,長洋企業有限公司,臺中市大里區瑞城里成功路448巷5號1樓,null,600000,1021106,1030414
975,54603696,成森有限公司,臺中市豐原區南陽里保康路66巷15號3樓,null,300000,1021119,1030424
976,54607314,穩厝企業有限公司,臺中市豐原區南村里豐勢路一段24巷11號1樓,null,500000,1021210,1030423
977,54617805,朝煬國際股份有限公司,高雄市三民區汾陽路70號12樓,null,8000000,1030211,1030409
978,54623665,閔響有限公司,高雄市前鎮區鎮邦街20號1樓,null,15000000,1030328,1030407
979,54640432,意坊餐飲顧問有限公司,臺北市信義區忠孝東路5段31巷18弄33號1樓,null,350000,1021022,1030411
980,54642591,安普衛生活科技有限公司,臺北市大安區信義路4段6號6樓,null,300000,1021030,1030416
981,54642950,東風時尚有限公司,臺北市中山區南京東路2段95號11樓,null,100000,1021030,1030408
982,54645056,匠思創意有限公司,臺北市松山區南京東路4段130號2樓之1,null,1000000,1021104,1030417
983,54645289,和妍有限公司,臺北市信義區基隆路1段155號7樓,null,3000000,1021104,1030429
984,54645422,靚達投資有限公司,臺北市中山區松江路111號13樓,null,1000000,1021105,1030430
985,54645696,茗人堂有限公司,臺北市大安區光復南路412號7樓之2,null,1000000,1021105,1030428
986,54646246,茂勝媒體股份有限公司,臺北市信義區信義路4段456號11樓,null,8000000,1021106,1030415
987,54646323,凱捷室內設計有限公司,臺北市中正區重慶南路1段63號11樓之2,null,3000000,1021106,1030418
988,54648315,華衍股份有限公司,臺北市信義區忠孝東路5段291號7樓,null,8880000,1021113,1030430
989,54653219,小花音樂有限公司,臺北市大安區忠孝東路4段221號12樓,null,300000,1021128,1030403
990,54656102,婕瑞創業投資有限公司,臺北市中山區南京東路1段8號4樓,null,1000000,1021206,1030408
991,54656573,耀霆開發有限公司,臺北市內湖區內湖路1段285巷59弄16號,null,100000,1021209,1030416
992,54656588,忠政開發有限公司,臺北市內湖區內湖路1段285巷59弄16號,null,100000,1021209,1030409
993,54656601,濯俊開發有限公司,臺北市內湖區內湖路1段285巷8弄1號2樓之1,null,100000,1021209,1030415
994,54657496,萬隆建材有限公司,臺北市文山區羅斯福路5段87號,null,3000000,1021212,1030410
995,54659065,昆仲有限公司,臺北市中正區信義路2段7號4樓,null,1000000,1021217,1030414
996,54659327,安特鮮果有限公司,臺北市中正區臨沂街26號,null,10000000,1021218,1030403
997,54659348,真愛手工坊有限公司,臺北市信義區忠孝東路5段1之7號9樓,null,250000,1021218,1030429
998,54660422,和達開發股份有限公司,臺北市中山區松江路111號13樓,null,6000000,1021223,1030430
999,54673165,巨門國際股份有限公司,臺北市內湖區民權東路6段15巷34號4樓,null,5000000,1030210,1030401
1000,54674116,薡愷國際貿易有限公司,臺北市中山區民族東路430號1樓,null,10000000,1030213,1030428
1001,54674360,華勇企業有限公司,臺北市松山區南京東路4段50號7樓之3,null,36000,1030213,1030423
1002,54675608,紘誌有限公司,臺北市松山區南京東路4段143號5樓,null,100000,1030219,1030430
1003,54678035,華堂醫療器材有限公司,臺北市松山區南京東路3段275號3樓,null,1000000,1030227,1030423
1004,54680898,昊司物業管理顧問有限公司,臺北市信義區基隆路1段97號3樓,null,100000,1030310,1030424
1005,54685227,麗美有限公司,臺北市松山區慶城街6之1號6樓之2,null,100000,1030321,1030407
1006,54688195,盒子旅店有限公司,臺北市大同區鄭州路3號1-4樓,null,1000000,1030331,1030430
1007,54689188,雅特群創有限公司,新北市土城區永豐路43號(1樓),null,100000,1021227,1030429
1008,54693633,台灣天康有限公司,新北市板橋區實踐路32巷6號5樓,null,100000,1030117,1030417
1009,54697390,聯興鑄造原料有限公司,新北市新店區美潭里長春路19巷22號2樓,null,1000000,1030212,1030416
1010,54699088,威電能源開發有限公司,新北市板橋區中正路100號3樓,null,1000000,1030220,1030414
1011,54705027,兆捷國際有限公司,新北市汐止區福德路52號4樓,null,100000,1030317,1030408
1012,54739384,臣鴻機械有限公司,臺中市大安區龜?里龜?路40之1號,null,1000000,1021220,1030423
1013,54741092,志穎實業有限公司,臺中市南區永興里工學二街109號,null,220000,1021230,1030409
1014,54757777,銘鎬科技有限公司,臺中市豐原區鎌村里鎌村路107巷217號1樓,null,600000,1030328,1030430
1015,54769295,全鈺園藝股份有限公司,彰化縣芬園鄉進芬村彰南路3段1巷22號,null,5000000,1021216,1030411
1016,54771588,歐香香氛企業有限公司,苗栗縣公館鄉中義村4鄰中義79號,null,500000,1021223,1030408
1017,54785942,世峰建設有限公司,桃園縣桃園市中寧里大興西路二段107之1號10樓,null,5000000,1030221,1030417
1018,54787370,藝立方創意有限公司,桃園縣八德市茄明里中華路211號1樓,null,3000000,1030226,1030331
1019,55251493,順天橡膠企業股份有限公司,臺中市豐原區社皮里中正路609號1樓,null,19800000,0571218,1030415
1020,56009003,大甲製粉廠股份有限公司,臺中市大甲區薰風里中山路一段911之1號1樓,null,39027910,0430610,1030429
1021,56675569,亞道工業股份有限公司,臺中市清水區中央路二一號,null,4002000,0700128,1030421
1022,59318209,正陽股份有限公司,彰化縣彰化市台鳳里一心南街326巷56號,null,13000000,0720303,1030410
1023,60286009,員東印刷有限公司,彰化縣員林鎮和平里中山路2段277巷10弄1-7號,null,1000000,0710419,1030409
1024,64243376,和信織造廠股份有限公司,雲林縣虎尾鎮新興里光復路209號,null,6000000,0611005,1030409
1025,70378436,立台儀器有限公司,臺北市松山區南京東路4段197號10樓之4,null,5000000,0880703,1030429
1026,70396820,佾洋有限公司,臺北市信義區松仁路101號1樓Ｂ區,null,2000000,0880831,1030402
1027,70398398,正觀科技有限公司,臺北市信義區永吉路348號2樓之3,null,4400000,0880903,1030414
1028,70413617,丸通企業有限公司,高雄市新興區林森一路126號4樓,null,5000000,0891030,1030428
1029,70422159,長鴻興業股份有限公司,高雄市鼓山區中華一路2111號5樓,null,10000000,0920404,1030423
1030,70424591,圻烽機械工程有限公司,高雄市前金區七賢二路222號,null,5000000,0920430,1030411
1031,70432712,正英科技有限公司,高雄市楠梓區德賢路267巷18號1樓,null,1000000,0920730,1030409
1032,70434444,東風新意食品股份有限公司,高雄市仁武區竹業巷25號2樓,null,18000000,0920820,1030414
1033,70468767,永皓貿易有限公司,新北市新店區下城里青山路168巷14號,null,4000000,0890105,1030425
1034,70510477,川印有限公司,臺中市神岡區大社里大漢街137號,null,700000,0890519,1030407
1035,70585060,泓昊企業有限公司,新北市三重區福德南路47號7樓,null,2000000,0890724,1030416
1036,70611572,昂潤實業有限公司,臺中市大里區立仁里新仁路一段217巷33號8樓,null,18000000,0890729,1030415
1037,70616556,宏聯興實業有限公司,桃園縣中壢市東興里龍生街45號,null,5000000,0890807,1030416
1038,70622234,生合倉儲有限公司,桃園縣楊梅市中山北路一段390巷45弄7號,null,3200000,0880908,1030423
1039,70655261,和成工藝有限公司,新北市土城區中央路3段76巷30號,null,3000000,0881105,1030428
1040,70667581,晟成有限公司,桃園縣楊梅市瑞坪里福羚路２３２巷２０號３樓,null,1000000,0881129,1030421
1041,70670306,安鎰有限公司,高雄市鳥松區?埔里?埔路十四巷二之二號,null,1000000,0881202,1030403
1042,70685883,日日盛石材股份有限公司,雲林縣斗六市虎溪里西平路四五二號,null,2800000,0890103,1030428
1043,70725673,人富公寓大廈管理維護股份有限公司,桃園縣蘆竹鄉新莊村大新路709號1樓,null,10000000,0890320,1030409
1044,70734300,聖通揚實業有限公司,臺中市東區十甲里東英路六七七號一樓,null,500000,0890401,1030410
1045,70735862,豪翔企業管理顧問有限公司,桃園縣桃園市國際路一段1038號1樓,null,1000000,0890406,1030408
1046,70781106,旭發投資股份有限公司,null,null,0,0890728,1030423
1047,70840132,忠鋼興業有限公司,新北市林口區粉寮路2段598號之1,null,5000000,0890830,1030429
1048,72221538,志岱塑膠股份有限公司,臺南市白河區昇安里三間厝315號,null,1000000,0731022,1030409
1049,75971695,允堅企業股份有限公司,高雄市前鎮區公正路172號2樓,null,10000000,0680216,1030414
1050,76363760,唐屋企業有限公司,高雄市三民區大昌1路106巷4號,null,9000000,0691128,1030417
1051,76433436,加基工業股份有限公司,高雄市大寮區大寮里大智街13號,null,5000000,0730210,1030428
1052,79868785,劦盛有限公司,高雄市三民區中庸街76巷31號,null,2000000,0710503,1030410
1053,79877089,趙子廣告攝影有限公司,高雄市新興區黃海街69號1樓,null,5000000,0720503,1030411
1054,79955351,億鑫國際企管顧問股份有限公司,臺北市中山區松江路38巷2號12樓之1,null,1000000,0910508,1030428
1055,79978930,宏曆實業有限公司,臺南市永康區甲頂里中華路903號,null,1000000,0910611,1030408
1056,79981203,連捷科技股份有限公司,新北市土城區中央路3段249巷2號,null,144540000,0910613,1030430
1057,79983363,東弘利有限公司,臺南市新化區北勢里北勢154號,null,1000000,0910618,1030402
1058,79984588,美力堅股份有限公司,新北市新莊區八德街五八巷十八弄三號五樓,null,5000000,0910619,1030410
1059,80005533,億寶机械有限公司,臺中市大里區日新里吉隆路九巷三三號一樓,null,3000000,0920310,1030417
1060,80019403,玉泉水企業有限公司,臺中市大雅區六寶里中清路4段80之1號1樓,null,1000000,0920325,1030422
1061,80041469,成品家具有限公司,新北市中和區景平路一一四號一樓,null,500000,0920402,1030401
1062,80042896,冠松事業股份有限公司,臺中市大肚區大東里仁德路87巷3號1樓,null,15000000,0920403,1030429
1063,80047294,禾翊廣告有限公司,臺北市南港區南深路17號(1樓),null,1000000,0910925,1030418
1064,80059517,瑞鵬有限公司,基隆市仁愛區劉銘傳路四八巷六號之甲,null,500000,0911015,1030410
1065,80068564,中耀漢芳生物科技股份有限公司,桃園縣桃園市大有路511號2樓,null,1000000,0911028,1030416
1066,80071646,東埜工程有限公司,新北市永和區竹林路75巷25弄12號1樓,null,5000000,0911031,1030411
1067,80094922,台灣旺得福人力仲介有限公司,高雄市苓雅區中正二路93號6樓之2,null,7000000,0911206,1030402
1068,80101830,滿庭園藝有限公司,新北市新莊區西盛街一九五號一樓,null,10000000,0911217,1030409
1069,80132806,虹佑企業有限公司,高雄市苓雅區正道里福德一路44之16號,null,3000000,0920130,1030409
1070,80153864,臺灣新光保險經紀人股份有限公司,臺北市中正區忠孝西路1段66號21樓,null,6000000,0920115,1030430
1071,80154033,日僑國際科技有限公司,臺北市中山區新生北路2段119巷14號(1樓),null,5000000,0920116,1030418
1072,80158349,瀧工房股份有限公司,臺北市中山區松江路204巷2號5樓,null,1200000,0920129,1030421
1073,80164861,正山貿易有限公司,臺北市萬華區寶興街68巷21號,null,2000000,0920227,1030429
1074,80173290,裕雅行銷開發有限公司,臺北市南港區重陽路316號2樓之2,null,5000000,0920325,1030401
1075,80184178,世發科技股份有限公司,null,null,0,0920422,1030430
1076,80201492,光合全有限公司,臺北市中山區復興北路430巷38號1樓,null,500000,0920611,1030410
1077,80210909,新嚮貿易有限公司,高雄市鳳山區凱旋路285之7號2樓,null,10000000,0910716,1030410
1078,80234965,康岳企業股份有限公司,臺中市西區忠明南路270號17樓之1,null,20000000,0910819,1030401
1079,80239531,暢鴻塑膠企業有限公司,臺中市西區忠誠里大隆路20號10樓之1,null,2000000,0910826,1030407
1080,80264524,縱橫資通能源股份有限公司,臺北市內湖區瑞光路168號7樓之3,null,110000000,0910809,1030414
1081,80306067,平曜資產顧問有限公司,臺北市內湖區金湖路1號3樓,null,1000000,0911213,1030407
1082,80310908,眼花撩亂國際有限公司,臺中市中區公園里自由路二段七五號一樓,null,1000000,0920415,1030407
1083,80322030,上和融有限公司,臺中市大里區國光里六桂路76號1樓,null,1000000,0920428,1030401
1084,80326253,兆豐國際空間設計有限公司,新北市三重區龍門路228號2樓　,null,1000000,0920501,1030408
1085,80375211,殷奇有限公司,高雄市三民區民族一路13號11樓之7,null,1000000,0930301,1030424
1086,80380002,宏密企業股份有限公司,高雄市路竹區後鄉里順安路295號,null,3000000,0930414,1030416
1087,80385647,富貴角有限公司,高雄市三民區鼎貴路151號1樓,null,500000,0930609,1030403
1088,80388026,現代美妝國際有限公司,高雄市新興區林森一路43巷49之1號,null,500000,0930707,1030415
1089,80395461,誠隆興業有限公司,臺中市北區明新里大雅路337號16樓之3,null,15000000,0920513,1030424
1090,80404052,塑模企業有限公司,臺南市新化區山腳里頂山腳一八六號一樓,null,1500000,0920526,1030418
1091,80419822,學府興業有限公司,臺中市梧棲區大村里30鄰中央路一段623巷14號1樓,null,500000,0920617,1030402
1092,80460618,三合發有限公司,臺中市烏日區三和里中山路3段青仔巷18號1樓,null,1200000,0920811,1030403
1093,80552193,鼎永豐國際有限公司,苗栗縣頭份鎮蘆竹里蘆竹214-2號,null,2998184,0920926,1030407
1094,80558112,鴻鎮工程有限公司,高雄市彌陀區南寮里南寮路五七號一樓,null,1000000,0921003,1030402
1095,80559463,錢龍國際開發有限公司,新北市中和區中正路515號3樓,null,1000000,0921006,1030401
1096,80600097,彼撒國際有限公司,臺南市永康區五王里成功路一七二巷三號一樓,null,500000,0921128,1030421
1097,80600907,壹零零壹服飾有限公司,臺南市中西區公正里中山路130號,null,1000000,0921201,1030410
1098,80608437,華圓實業有限公司,桃園縣桃園市同安里慈文路190巷38弄16之3號,null,2000000,0921210,1030425
1099,80619758,康詮顧問股份有限公司,屏東縣新園鄉興龍村臥龍路一六五號,null,5000000,0921223,1030425
1100,80643639,力益金屬有限公司,彰化縣彰化市竹巷里彰南路四段413巷85號,null,500000,0930202,1030415
1101,80645572,永立華有限公司,南投縣竹山鎮雲林里埔頭街一一三號,null,1000000,0930205,1030407
1102,80662473,艾瑪衛生科技有限公司,新北市永和區中山路1段352巷92弄30號1樓,null,1000000,0930109,1030414
1103,80674098,博鴻能源科技有限公司,臺北市大安區和平東路1段204號11樓,null,10000000,0930220,1030425
1104,80679919,忠孝壹零壹不動產仲介經紀有限公司,臺北市信義區忠孝東路5段362號,null,2500000,0930305,1030430
1105,80706839,松城食品股份有限公司,新北市汐止區忠三街16巷11號1樓,null,37000000,0930220,1030428
1106,80708604,順山有限公司,彰化縣北斗鎮中山路一段二六○巷廿三弄七號二樓,null,500000,0930223,1030408
1107,80710192,照進機械有限公司,新北市中和區圓通路367巷13弄9號2樓,null,1680000,0930225,1030402
1108,80714275,樺壯有限公司,桃園縣桃園市大豐里昆明路一○一巷一三之二號,null,500000,0930301,1030428
1109,80719308,中辰光電股份有限公司,新竹縣竹北市十興里犁頭山下47號,null,10000000,0930305,1030401
1110,80733189,世麥企業有限公司,彰化縣花壇鄉彰員路二段五一三號,null,500000,0930322,1030414
1111,80740576,遠見開發廣告有限公司,臺南市東區中華東路一段86號13樓之3,null,500000,0930330,1030408
1112,81209063,互鈺企業有限公司,高雄市苓雅區尚禮街8號,null,1000000,0711104,1030421
1113,81440393,薪寶食品有限公司,高雄市苓雅區中正一路121巷4弄23號,null,3000000,0700409,1030425
