序號,統一編號,公司名稱,公司所在地,代表人,資本額,核准設立日期,核准解散日期
446,28817829,達獅汽車股份有限公司,桃園縣蘆竹鄉奉化路２８０號２樓,null,12000000,0961029,1030424
447,28818881,均正有限公司,新北市泰山區楓江路18巷12之3號4樓,null,2500000,0961030,1030428
448,28824188,吉森興業有限公司,新北市汐止區民族三街2號2樓,null,500000,0961113,1030422
449,28839871,尚雅國際精品有限公司,臺中市西區大隆路59號1樓,null,5000000,0970114,1030421
450,28854252,僑婕國際有限公司,臺北市中山區長春路348之6號5樓,null,2000000,0970324,1030401
451,28860254,御風娛樂科技股份有限公司,臺北市南港區忠孝東路5段815號6樓,null,3000000,0970415,1030408
452,28864126,台北紡友有限公司,臺北市中山區民權西路20號6樓之6,null,500000,0970428,1030416
453,28870921,伊伯思有限公司,臺中市西屯區逢福里河南路2段203號之2,null,500000,0961101,1030401
454,28881602,大城市創意金屬實業有限公司,新北市三峽區介壽里光明路75巷2號1樓,null,1000000,0961120,1030424
455,28886944,慧山科技有限公司,臺南市中西區民族路3段126號,null,500000,0961128,1030425
456,28894732,鑫昌科技股份有限公司,新北市中和區中正路866之8號13樓,null,10000000,0961212,1030416
457,28898879,泓鈞企業有限公司,新北市中和區興南路1段56巷1弄1之3號,null,10000000,0961219,1030421
458,28914245,國泰運動事業有限公司,桃園縣桃園市國豐五街38號3樓,null,1000000,0970116,1030429
459,28917480,太新國際有限公司,新北市汐止區中興路45號之1 (3樓),null,1000000,0970121,1030416
460,28929401,新晉吉土木包工業股份有限公司,雲林縣二崙鄉庄西村洲子路34號1樓,null,3000000,0970219,1030407
461,28929824,鉑泰科技有限公司,新北市永和區民樂街39巷18弄40號1樓,null,1000000,0970219,1030429
462,28939338,凱鈴科技有限公司,新竹市北區中寮里延平路３段５５６之３號,null,1000000,0970310,1030424
463,28942191,萬豐物業管理顧問股份有限公司,臺中市潭子區中山路2段135號4樓之3,null,1000000,0970313,1030418
464,28943282,松泓數位科技股份有限公司,新北市新莊區福壽街94巷19弄10號,null,10000000,0970317,1030416
465,28952520,天下文教有限公司,雲林縣麥寮鄉新吉村新吉路1鄰39號,null,1000000,0970328,1030417
466,28957356,盈賓企業有限公司,臺南市東區崇學路188巷75號,null,5000000,0970403,1030417
467,28957406,澤塑配管五金股份有限公司,新北市汐止區大同路2段430號5樓,null,10000000,0970403,1030424
468,29018541,良毫建材有限公司,高雄市楠梓區後昌路１１４０巷１２之１號,null,1000000,0980515,1030415
469,29019020,高二信興業有限公司,高雄市鼓山區中華一路2111號5樓,null,5000000,0980522,1030423
470,29025058,林宏五金企業有限公司,高雄市鼓山區大順1路845號,null,500000,0980813,1030410
471,29029358,詠淳機電工程有限公司,高雄市新興區復興1路63號8樓之7,null,300000,0981006,1030417
472,29033727,美因子科技有限公司,臺北市中山區南京東路3段118號7樓之2,null,800000,0970602,1030430
473,29047291,曼香緹國際有限公司,臺北市萬華區昆明街103號3樓,null,250000,0970723,1030415
474,29057585,百工屋設計有限公司,臺北市文山區樟新街15巷9號2樓,null,250000,0970904,1030425
475,29063432,寶利傑國際有限公司,臺北市信義區基隆路1段155號12樓之6,null,1000000,0971002,1030402
476,29065240,兆鑫醫學物理股份有限公司,臺北市萬華區忠孝西路2段24號4樓,null,2000000,0971009,1030407
477,29065987,良品創作股份有限公司,臺北市松山區民生東路5段69巷2弄11號,null,1200000,0980602,1030415
478,29068274,靈機一動科技有限公司,臺北市大安區敦化南路1段205號14樓之3,null,1000000,0980610,1030430
479,29082472,富尼安科技有限公司,新北市三重區五股里光復路1段83巷11號6樓,null,2000000,0970425,1030401
480,29084979,強登房屋仲介有限公司,新北市新莊區復興路2段12號,null,1000000,0970429,1030410
481,29085870,科宏企業有限公司,新北市汐止區義民里中正路213號5樓,null,500000,0970430,1030415
482,29117660,寰龑股份有限公司,桃園縣八德市中華路275巷15號1、2樓,null,1600000,0970624,1030408
483,29122848,龍華興業有限公司,臺中市太平區宜昌里8鄰宜欣路46號7樓,null,250000,0970702,1030415
484,29123184,喜兒有限公司,桃園縣桃園市東山里安東街39巷12號3樓,null,1000000,0970702,1030422
485,29130679,兆鋒國際股份有限公司,新北市淡水區中正東路2段69之3號7樓,null,500000,0990104,1030422
486,29135935,精點科技有限公司,新北市中和區中和路196巷3號1樓,null,3000000,0990203,1030430
487,29139405,天宏興業有限公司,新北市永和區豫溪街95巷10弄18號2樓,null,5000000,0990302,1030409
488,29144028,前趨實業有限公司,新北市板橋區四川路2段239號3樓,null,5000000,0990324,1030415
489,29144809,星旺數位科技有限公司,新北市板橋區莊敬路25巷1號24樓之1,null,100000,0990326,1030422
490,29150908,創世開發有限公司,臺北市中山區松江路3號3樓之5,null,5000000,0990421,1030416
491,29152048,萬達生技股份有限公司,新北市新莊區立廷里立信一街96號11樓,null,1000000,0990427,1030411
492,29153362,立欣皮飾有限公司,新北市三重區重陽里明志街57號,null,1000000,0990430,1030421
493,29155642,正商不動產仲介經紀有限公司,新北市永和區中興里竹林路88號1樓,null,1000000,0990513,1030422
494,29156712,比樂國際有限公司,新竹縣竹北市縣政二路南段81、83號（3樓）,null,1000000,0990517,1030403
495,29159372,聯合航太工業有限公司,新北市樹林區太順里太順街40號3樓,null,1000000,0990528,1030415
496,29167154,昱橙國際股份有限公司,新北市三重區自強路3段76巷23號1樓,null,1500000,0990701,1030408
497,29168983,真旺演藝有限公司,新北市中和區中正路872號15樓,null,5000000,0990712,1030429
498,29172831,樂鑫國際企業有限公司,新北市樹林區三德街51號,null,250000,0990728,1030422
499,29180240,翔隼運動實業有限公司,新北市三重區三和路4段181巷213號,null,500000,0990903,1030402
500,30414870,健隆煤氣有限公司,臺北市大安區復興南路2段150號1樓,null,3000000,0601221,1030410
501,30936370,欣明水電冷氣工程有限公司,臺北市大安區通化街39巷50弄66號1樓,null,2000000,0691220,1030411
502,30966140,其明有限公司,臺北市大安區安和路2段5號4樓之3,null,15000000,0710205,1030401
503,31242643,林士煤氣有限公司,臺中市神岡區岸裡里岸裡2街32號,null,2600000,0640527,1030401
504,33974453,來福文具工業股份有限公司,新北市板橋區縣民大道3段93巷32號,null,7500000,0640903,1030408
505,34181347,進豐美術印刷有限公司,新北市板橋區新民里漢生東路63巷30號,null,5000000,0661202,1030430
506,34235907,力信興業股份有限公司,null,null,0,0671027,1030410
507,34439698,佑仁實業有限公司,新北市永和區永和路二段三○一巷五號四樓,null,1000000,0700124,1030430
508,34575216,昱榮電器有限公司,新北市板橋區四維路二三四號一樓,null,5000000,0720831,1030430
509,35342221,勝源工業有限公司,新北市三重區仁愛街二四五巷二一號,null,7000000,0610207,1030422
510,36206272,上揚工業股份有限公司,新北市板橋區三民路2段37號27樓之3,null,5000000,0721230,1030430
511,36285711,狄疆實業有限公司,新北市三重區中正北路四二八巷四號,null,4600000,0730925,1030418
512,36355949,榮梓實業有限公司,新北市新莊區中華路二段７１巷１４號２樓,null,5000000,0740403,1030414
513,36510132,盡大企業有限公司,臺北市松山區南京東路4段50號11樓,null,5000000,0660610,1030407
514,36546791,中力藥局有限公司,臺北市士林區忠誠路1段173巷10號,null,6000000,0680307,1030422
515,44043317,沛榮實業有限公司,桃園縣桃園市富國路三六號,null,2500000,0730307,1030430
516,44966141,國岡瓦斯有限公司,桃園縣中壢市普義路六號,null,4500000,0660308,1030411
517,50515025,世鉦工業股份有限公司,苗栗縣頭份鎮田寮里蘆竹路309巷12號,null,6000000,0690430,1030331
518,52386130,特立事務儀器股份有限公司,臺中市東區復興路4段21號,null,10000000,0650821,1030414
519,52629565,榮菖貿易有限公司,臺中市北區明德里太原4街11號,null,3000000,0700512,1030415
520,53030475,秀奇實業有限公司,臺中市西屯區福聯里福順路875號,null,1200000,0990423,1030425
521,53041698,蘿森有限公司,臺北市大同區天水路45號7樓之3,null,250000,0990513,1030403
522,53046151,宇泓建設有限公司,桃園縣桃園市三元里民光東路85號3樓,null,20000000,0990524,1030421
523,53048019,富興商業有限公司,彰化縣埔心鄉油車村和平路138巷70號,null,300000,0990525,1030417
524,53051822,光彥有限公司,新竹縣北埔鄉北埔村中山路44號,null,6000000,0990602,1030410
525,53052553,多結果子農產有限公司,臺北市松山區南京東路5段118號5樓之2,null,1000000,0990603,1030402
526,53057810,震撼舞台車有限公司,宜蘭縣頭城鎮竹安里頭濱路1段53巷29號1樓,null,200000,0990614,1030402
527,53063257,三德休閒運動事業有限公司,新竹縣新埔鎮田新里義民路一段33號1樓,null,1000000,0990624,1030424
528,53065298,博飛企業有限公司,桃園縣中壢市復華里自強六路67號11樓,null,1000000,0990630,1030411
529,53067198,知識學習系統股份有限公司,桃園縣桃園市東門里中興街18號7樓之3,null,300000,0990702,1030410
530,53070709,源遠生技有限公司,基隆市暖暖區碇安里源遠路325巷117號1樓,null,1000000,0990709,1030421
531,53071138,愛利森有限公司,雲林縣林內鄉九芎村民族路8-10號1樓,null,1000000,0990712,1030408
532,53076437,女人之心徵信有限公司,桃園縣中壢市忠福里福州二街37號1樓,null,200000,0990722,1030422
533,53081282,緣之誼國際有限公司,臺北市北投區北投路1段7號3樓,null,2000000,0990804,1030407
534,53082732,駿德酒業有限公司,臺北市中山區長安東路2段131號1樓,null,10000000,0990810,1030408
535,53093323,育林興業有限公司,臺北市大安區瑞安街208巷80號,null,3000000,0990917,1030424
536,53098761,鼎旭科技有限公司,臺北市大安區臥龍街195巷17號1樓,null,1500000,0991007,1030425
537,53100112,秀安國際有限公司,臺北市松山區光復北路190巷2號11樓,null,200000,0991013,1030403
538,53100963,寓宏不動產有限公司,臺北市南港區重陽路555號,null,1500000,0991015,1030411
539,53107895,鼎級留遊學有限公司,臺北市大安區羅斯福路3段297之4號3樓,null,300000,0991110,1030417
540,53108233,迪威概念有限公司,臺北市大同區重慶北路3段137巷28號,null,200000,0991112,1030422
541,53115396,華衛生物科技股份有限公司,臺北市內湖區基湖路35巷16號7樓之3,null,5000000,0991208,1030403
542,53116260,怡和精典有限公司,臺北市大安區羅斯福路3段65號3樓之2,null,1000000,0991210,1030415
543,53121094,悅弘運通有限公司,臺北市松山區復興北路57號5樓之4,null,7500000,0991229,1030403
544,53121685,港駒餐飲有限公司,臺北市大安區忠孝東路4段233號4樓之17,null,10000000,0991230,1030418
545,53124347,鴻聯環保科技有限公司,臺北市中山區南京東路2段137號14樓,null,1500000,1000111,1030423
546,53126680,傑連投資股份有限公司,臺北市松山區敦化北路167號2樓,null,500000,1000119,1030411
547,53127267,富春開發國際有限公司,臺北市中山區長春路346號4樓,null,3000000,1000120,1030401
548,53132402,新品木生物科技有限公司,臺中市西區忠明南路16號9樓之2,null,1000000,0990803,1030415
549,53133438,駿陞機械有限公司,臺中市梧棲區南簡里中央路二段371號1樓,null,500000,0990804,1030415
550,53149375,優力網路購物股份有限公司,臺北市信義區松德路65號11樓之2,null,1200000,0990906,1030402
551,53154600,鈦網科技有限公司,彰化縣鹿港鎮永安里中正路179號1樓,null,400000,0990916,1030415
552,53158227,永誠檢驗科技有限公司,臺南市永康區網寮里永春街20巷27號1樓,null,1000000,0990924,1030422
553,53166612,全民生活物資團購股份有限公司,桃園縣中壢市新街里環北路398號16樓之2,null,6000000,0991011,1030418
554,53175582,嘉進五金有限公司,臺南市北區開南街275巷20弄23號1樓,null,5000000,0991028,1030416
555,53187237,順泰食品有限公司,新北市汐止區福德一路86巷27號13樓,null,210000,0991021,1030410
556,53187335,家妤不動產仲介經紀有限公司,新北市樹林區佳園路3段486號1樓,null,1000000,0991021,1030402
557,53191648,德億豪企業有限公司,臺北市中山區建國北路2段226巷32號,null,5000000,0991112,1030417
558,53191719,沅富國際資源有限公司,新北市中和區捷運路8-21號7樓,null,5000000,0991112,1030409
559,53194096,力新整合行銷有限公司,新北市三重區中正南路248號1樓,null,250000,0991124,1030408
560,53197690,本田數位有限公司,新北市永和區永亨路107號,null,1000000,0991209,1030424
561,53201478,信萬達有限公司,新北市新莊區建中街90巷3弄6號3樓,null,1000000,0991229,1030408
562,53203736,辰日實業有限公司,臺北市中山區新生北路3段82之5號,null,10000000,1000110,1030428
563,53211291,汎禹實業有限公司,新北市汐止區樟樹二路110號8樓之1,null,1500000,1000223,1030411
564,53213679,聖迪倫科技有限公司,新北市汐止區新台五路2段176號36樓,null,200000,1000307,1030401
565,53218111,崴靖企業有限公司,新北市板橋區光明街25號,null,1000000,1000325,1030411
566,53218914,京尚世健康事業有限公司,新北市板橋區重慶路240-2號,null,1000000,1000328,1030410
567,53218962,泛學達科技股份有限公司,新北市新店區北新路3段207號13樓,null,16672500,1000329,1030407
568,53223162,元莆企業有限公司,新北市林口區南勢二街160號,null,1000000,1000415,1030422
569,53228526,大間通訊有限公司,新北市蘆洲區民族路156號,null,5000000,1000510,1030424
570,53232459,仲信廣告代銷有限公司,高雄市湖內區中正路二段42號1樓,null,2000000,1000113,1030410
571,53236173,海吉洋有限公司,高雄市三民區民祥街6號21樓之5,null,2000000,1000222,1030417
572,53239241,理維國際管理顧問股份有限公司,高雄市前金區中正四路235號8樓之5,null,1000000,1000318,1030407
573,53243012,和宸貿易有限公司,高雄市鳳山區善志街13號,null,1000000,1000422,1030422
574,53243857,機本生活有機有限公司,高雄市前鎮區沱江街112號1樓,null,2500000,1000428,1030414
575,53243907,金尚鎂海洋企業有限公司,高雄市鼓山區鼓山三路11之11號,null,5000000,1000428,1030428
576,53271641,台灣超導節能科技股份有限公司,臺中市西屯區福林里西屯路三段宏福3巷9號3樓之7,null,1000000,0991202,1030423
577,53273161,雙利有限公司,彰化縣伸港鄉全興村西全路166巷49號1樓,null,500000,0991206,1030407
578,53273839,高鳳不動產有限公司,高雄市鳳山區武慶里武慶二路162號1、2樓,null,600000,0991207,1030414
579,53276081,艾瑞琪國際科技行銷有限公司,新竹市北區台溪里中華路二段736號8樓之6,null,2000000,0991210,1030414
580,53288967,貽升有限公司,宜蘭縣羅東鎮新群里中山路一段280號2樓,null,1000000,1000106,1030410
581,53290387,登茂工程有限公司,桃園縣平鎮市廣達里廣平街76巷5號11樓之1,null,100000,1000110,1030407
582,53299520,合全科技有限公司,新竹市東區立功里光復路2段260號1樓,null,1000000,1000127,1030424
583,53300879,辰億貿易有限公司,新竹市東區關東路23巷21號16樓之2,null,380000,1000128,1030402
584,53307850,景發照明科技股份有限公司,臺中市潭子區栗林里祥和路155號,null,30000000,1000223,1030403
585,53309317,丞品開發有限公司,臺北市中山區松江路182號9樓,null,1000000,1000127,1030428
586,53310124,利灃生物科技有限公司,臺北市士林區福林路201號1樓,null,500000,1000128,1030416
587,53313473,康寶芙有限公司,臺北市松山區南京東路5段286-1號3樓,null,300000,1000222,1030423
588,53318738,利福國際有限公司,臺北市北投區石牌路2段130巷4號1樓,null,200000,1000311,1030422
589,53319223,行列有限公司,臺北市信義區永吉路278巷2弄1號,null,500000,1000314,1030414
590,53319899,圓運生物科技股份有限公司,臺北市松山區八德路3段12巷52弄12號2樓,null,1000000,1000315,1030407
591,53323710,名仟有限公司,臺北市信義區基隆路2段149之49號10樓之14,null,100000,1000325,1030402
592,53330938,永泰興投資股份有限公司,臺北市大安區仁愛路4段71巷36號2樓,null,50000000,1000419,1030422
593,53333576,金輝映畫電影股份有限公司,臺北市內湖區成功路3段89之1號5樓,null,7500000,1000427,1030410
594,53335011,伍陸健康養生股份有限公司,臺北市松山區八德路3段20號1樓,null,20000000,1000502,1030430
595,53335928,喜達多天然貿易有限公司,臺北市士林區大南路325號8樓-14,null,500000,1000504,1030417
596,53336026,晨木股份有限公司,臺北市大安區敦化南路2段152之1號,null,500000,1000505,1030411
597,53336406,櫻萱有限公司,臺北市中山區長安東路1段61-1號1樓,null,500000,1000506,1030415
598,53340838,鴻福開發有限公司,臺北市大安區忠孝東路4段295號3樓,null,3000000,1000523,1030425
599,53343292,昱富投資股份有限公司,臺北市內湖區內湖路1段300號9樓之1,null,5000000,1000531,1030423
600,53350223,茶笑怡有限公司,臺北市內湖區瑞光路513巷28號3樓,null,1000000,1000620,1030403
601,53356866,光合美有限公司,臺北市中山區南京東路1段25號8樓之2,null,200000,1000711,1030411
602,53359110,格列思國際有限公司,臺北市中山區新生北路2段70之1號8樓之2,null,300000,1000718,1030430
603,53365274,育全精密實業有限公司,臺南市安南區海東里同安路145巷17弄6號1樓,null,3000000,1000309,1030429
604,53369497,優鎰不動產仲介經紀有限公司,新竹市東區新莊里關新路57號,null,500000,1000317,1030408
605,53369588,巨合國際有限公司,桃園縣龜山鄉大崗村忠義路二段489巷35號7樓,null,500000,1000317,1030417
606,53372113,牛逼股份有限公司,臺中市豐原區社皮里中正路695巷19號4樓,null,500000,1000323,1030331
607,53384005,弘馳車業有限公司,彰化縣員林鎮三愛里光華街67號1樓,null,100000,1000414,1030429
608,53384954,鉅亨建設有限公司,嘉義市西區車店里蘭州一街159號1樓,null,5000000,1000415,1030421
609,53388380,佶笙國際事業有限公司,臺中市清水區鎮新一街60號1樓,null,1000000,1000421,1030424
610,53398134,吉賀園股份有限公司,臺南市中西區五妃里南門路225-5號,null,6000000,1000510,1030421
611,53400167,秉義禮儀企業有限公司,臺中市中區大墩里三民路二段145號6樓之4,null,1000000,1000513,1030415
612,53401665,訊遊科技有限公司,臺中市西區公館里三民路一段36號9樓之11,null,1000000,1000517,1030417
613,53403571,晴誼有限公司,臺中市中區中華里成功路359-2號7樓之4,null,1000000,1000519,1030402
614,53404327,世驄實業有限公司,臺中市太平區德隆里工業15路19號2樓,null,3000000,1000520,1030417
615,53405156,利創企業股份有限公司,桃園縣桃園市汴洲里鹽庫街65巷1號,null,3000000,1000523,1030403
616,53412585,昶遠有限公司,新北市新莊區頭興街1之3號2樓,null,1000000,1000530,1030414
617,53413732,全益煤氣有限公司,新北市中和區中山路2段526巷24弄5號1樓,null,400000,1000603,1030423
618,53420017,禾芮國際室內裝修有限公司,新北市板橋區中山路2段369之1號5樓,null,1000000,1000701,1030410
619,53421310,裘比資產管理股份有限公司,新北市三重區三民里重陽路2段66號1~2樓,null,10000000,1000711,1030424
620,53423035,永錡企管顧問有限公司,新北市新莊區自立里自強街10之2號3樓,null,1000000,1000715,1030418
621,53424999,南亞不動產經紀股份有限公司,新北市五股區成泰路2段183號,null,5000000,1000722,1030402
622,53425189,虹暉資產管理股份有限公司,新北市板橋區中山路1段293之1號8樓,null,4000000,1000725,1030409
623,53427285,耀維企業股份有限公司,新北市新莊區民安路429巷3號,null,10000000,1000802,1030422
624,53427320,謀思有限公司,新北市永和區永貞路437巷16號5樓,null,250000,1000802,1030417
625,53430900,比利靚廣告行銷有限公司,新北市板橋區英士路53號2樓之1,null,500000,1000818,1030422
626,53430964,佳恩實業有限公司,新北市汐止區中興里中興路152之2號6樓,null,200000,1000818,1030425
627,53457631,弘基服飾有限公司,新北市汐止區大同路2段265號6樓之4,null,1000000,1001108,1030403
628,53457978,科創電子有限公司,新北市林口區菁湖里竹林路157巷10號,null,3000000,1001109,1030407
629,53463704,茶璽生物科技有限公司,新北市鶯歌區育樂街54號,null,6000000,1001209,1030424
630,53469550,益泰豐股份有限公司,屏東縣九如鄉後庄村後庄路253號1樓,null,600000,1000530,1030401
631,53470466,雅喬生物科技有限公司,臺中市北屯區仁美里仁美十巷89-1號,null,500000,1000601,1030425
632,53481822,寶榮科技有限公司,臺中市西屯區上安路101巷5號1樓,null,1000000,1000623,1030424
633,53483758,東昇開發工業有限公司,桃園縣中壢市信義里成都路44號2樓,null,1000000,1000628,1030414
634,53487142,奎閣股份有限公司,桃園縣大園鄉田心村國際路一段193號,null,5000000,1000704,1030425
635,53491960,菁玉豐有限公司,臺中市西屯區福順路476號1樓,null,1000000,1000713,1030428
636,53494501,友象科技有限公司,臺中市沙鹿區斗抵里天池街115號1樓,null,600000,1000718,1030419
637,53502734,大美設計工程有限公司,桃園縣桃園市新埔六街130號5樓,null,3000000,1000802,1030424
638,53504819,吉點行銷管理顧問股份有限公司,桃園縣中壢市光明里義民路二段25巷5號2樓,null,1000000,1000805,1030402
639,53511380,鉅大電實業有限公司,臺中市北屯區平心里文心路四段673號3樓之2,null,2500000,1000819,1030422
640,53513275,富柏國際有限公司,臺中市南屯區向心里豐富路304號,null,300000,1000823,1030422
641,53513958,安心家科技有限公司,彰化縣彰化市西勢里忠誠路21號,null,1000000,1000824,1030428
642,53521985,華鍋餐飲股份有限公司,臺北市中山區林森北路624、626、628號及628號地下室,null,5000000,1000727,1030422
643,53526665,星仲實業股份有限公司,新北市新莊區新泰路6號（1樓）,null,2100000,1000811,1030409
644,53528100,潤聯國際貿易股份有限公司,臺北市信義區基隆路1段159號8樓,null,5000000,1000816,1030409
645,53528495,愛血拚國際購物網有限公司,臺北市中山區松江路192號6樓之1,null,1000000,1000817,1030424
646,53530112,臺灣華升機械工程有限公司,臺北市大安區基隆路2段112號7樓,null,500000,1000823,1030407
647,53531506,昱馻資源回收有限公司,臺北市信義區忠孝東路5段510號8樓之1,null,1000000,1000826,1030418
648,53534356,立友科技有限公司,臺北市北投區開明街23巷13號,null,1000000,1000907,1030411
649,53538825,大彩有限公司,臺北市中山區吉林路461巷25號,null,1000000,1000923,1030411
650,53540131,全球物業有限公司,臺北市大安區安和路2段39號,null,8000000,1000929,1030421
651,53548204,艾芳登有限公司,臺北市大安區敦化南路1段169巷8號,null,220000,1001024,1030401
652,53552311,駿霖科技有限公司,臺北市中正區衡陽路51號10樓之17,null,100000,1001107,1030410
653,53554866,京德資產管理有限公司,臺北市中山區民權東路3段58號11樓之4,null,5000000,1001115,1030417
654,53559757,外灘十八股份有限公司,臺北市士林區中山北路6段265號,null,200000,1001202,1030428
655,53561000,加琦有限公司,新北市三重區三陽路14巷12號(1樓),null,3500000,1001207,1030418
656,53566151,富盟開發建設股份有限公司,臺北市大安區安和路2段82號5樓之1,null,2000000,1001227,1030429
657,53568025,力元創意有限公司,臺北市大安區忠孝東路4段220號13樓,null,100000,1010102,1030418
658,53568952,昇和新企業有限公司,臺北市文山區景豐街52號地下樓之8,null,500000,1010105,1030416
659,53572528,麻吉管理顧問股份有限公司,高雄市鳳山區鳳頂路413巷17號,null,1580000,1001011,1030415
660,53579085,伊?工程有限公司,高雄市大寮區光明路三段243號1樓,null,100000,1001208,1030422
661,53580055,龍葵實業有限公司,高雄市鹽埕區建國四路155號1樓,null,200000,1001219,1030417
662,53580479,森韋企業有限公司,高雄市大寮區萬丹路223之2號,null,1000000,1001222,1030411
663,53583715,鳳統食品有限公司,高雄市鳥松區球場路65號,null,700000,1010131,1030415
664,53593235,功富工程有限公司,高雄市新興區七賢一路428號4樓之2,null,1000000,1010420,1030424
665,53596633,新大利機電有限公司,高雄市前鎮區公正路429號1樓,null,100000,1010518,1030403
666,53598604,友勝實業有限公司,高雄市鳳山區建國路1段534號1樓,null,1000000,1010605,1030402
667,53602430,禹泰資源回收有限公司,彰化縣花壇鄉長沙村中正路76巷10弄5號,null,500000,1000913,1030408
668,53604508,聚拓科技股份有限公司,臺南市東區崇仁街83號,null,1200000,1000916,1030424
