序號,統一編號,公司名稱,公司所在地,代表人,資本額,核准設立日期,核准解散日期
1,04338130,加成鑄造原料有限公司,臺北市大同區迪化街2段242號1樓,null,5000000,0650322,1030407
2,04497164,聯良實業股份有限公司,臺北市大同區長安西路45-1號4樓,null,2000000,0691208,1030417
3,04581182,新立印刷文具有限公司,新北市中和區景平路五二三號一樓,null,3600000,0650304,1030409
4,04607134,泰農實業股份有限公司,臺北市大安區永康街17巷31號,null,5000000,0620530,1030401
5,04675218,一六電線電纜股份有限公司,新北市樹林區味王街32之5號,null,8750000,0670707,1030416
6,04735882,台灣象安有限公司,臺北市大安區光復南路346巷56號1樓,null,5000000,0640925,1030418
7,04807148,協益起重有限公司,臺北市萬華區萬大路534巷31號1樓,null,3000000,0690725,1030418
8,05059325,和光交通企業有限公司,臺北市內湖區五分街5號1樓,null,3000000,0670606,1030408
9,07617162,和鑫裝訂印刷有限公司,臺北市大同區重慶北路2段80巷6號,null,2000000,0670323,1030407
10,07618541,巨豐玻璃有限公司,臺北市松山區敦化南路1段100巷7弄35號1樓,null,5000000,0670420,1030416
11,09413087,藝菱企業有限公司,臺北市大安區金山南路2段2號10樓之2,null,5000000,0720611,1030422
12,09469027,啟暉貿易有限公司,臺北市中正區忠孝西路1段29巷1號4樓,null,5000000,0740212,1030415
13,11136308,中國木業製品股份有限公司,新北市蘆洲區信義路十五巷十七號一樓,null,10000000,0561118,1030422
14,12174244,雙喜興業股份有限公司,臺北市中山區長安東路1段51-4號1樓,null,5000000,0670415,1030409
15,12213485,鈞昇企業有限公司,臺北市大安區仁愛路3段28號7樓之2,null,5000000,0680216,1030428
16,12343656,振夏實業有限公司,臺北市士林區雨聲街8巷18號1樓,null,1000000,0700813,1030429
17,12372770,兩福工業有限公司,新北市新莊區化成路736巷14弄1號,null,5000000,0710324,1030422
18,12374340,鑫徠德企業有限公司,新竹市經國路二段三九二號二樓,null,5000000,0710330,1030414
19,12430835,申家企業有限公司,臺北市松山區復興北路191號15樓之5,null,5000000,0720404,1030418
20,12432263,信泰水工實業有限公司,新北市蘆洲區信義路三七巷一六號五樓,null,1500000,0720411,1030410
21,12629483,遠強投資有限公司,宜蘭縣羅東鎮成功里中正南路一九七號一樓,null,9000000,0891005,1030428
22,12649431,惠森興業有限公司,雲林縣土庫鎮忠正里光明路171號1樓,null,1000000,0891107,1030423
23,12659107,快聯科技股份有限公司,新竹市牛埔東路一五九號,null,10000000,0891026,1030429
24,12661027,創世紀建設股份有限公司,臺北市大安區仁愛路3段94號3樓,null,13300000,0891102,1030422
25,12702287,江翠企業有限公司,新北市板橋區忠翠里10鄰文化路2段一182巷3弄58號11樓,null,5000000,0891113,1030422
26,12713313,永吉立工商開發有限公司,新北市土城區廣明街四一巷二弄九號,null,1000000,0891201,1030422
27,12726773,威鉅登創藝股份有限公司,新北市土城區裕生里中華路1段56巷23號(1樓),null,48000000,0891226,1030403
28,12735490,奎鑫科技有限公司,臺北市信義區忠孝東路5段412號2樓之4,null,2000000,0900111,1030430
29,12737292,禎洋空調企業有限公司,臺中市西區向上路一段461巷3號1樓,null,500000,0900116,1030402
30,12757326,合毅鞋業有限公司,臺中市潭子區潭陽里光陽路一一二號七樓,null,2000000,0900302,1030422
31,12787530,廣騏實業股份有限公司,臺中市大雅區三和段神林南路115巷22號,null,25000000,0900420,1030418
32,12796910,大誠開發設計工程有限公司,臺北市大同區重慶北路3段377號6樓之1,null,2000000,0900507,1030410
33,12805973,捷研科技股份有限公司,新北市中和區中正路816號,null,6000000,0900518,1030407
34,12807661,台灣齊揚能源科技股份有限公司,彰化縣伸港鄉蚵寮村線工北一路12號,null,80000000,0900522,1030409
35,12838398,利天有限公司,新竹縣竹北市大眉里中華路1448巷46號1樓,null,500000,0900718,1030424
36,12864640,昱得國際有限公司,臺北市萬華區萬大路458號1樓,null,1000000,0900517,1030421
37,12885223,鈺正生技有限公司,臺北市文山區興隆路2段196號2樓之1,null,5000000,0900817,1030422
38,12896143,華一貿易有限公司,臺南市中西區文賢里和真街76、78號1樓,null,10000000,0900906,1030401
39,12919032,徽濱實業有限公司,臺中市豐原區豐勢路一段534號,null,1000000,0901029,1030425
40,12919912,秉竑企業有限公司,新北市鶯歌區建國路512巷7號,null,10000000,0901030,1030417
41,12923970,奧燊國際有限公司,新北市新莊區天泉二街19之1號,null,1000000,0901107,1030409
42,12963944,好珮興業有限公司,新北市板橋區三民路二段一八六巷二八號二樓,null,3000000,0901204,1030423
43,12983673,通材建材有限公司,新北市樹林區中山路一段三五八號一樓,null,5000000,0901128,1030430
44,13008321,金冠霖科技有限公司,桃園縣楊梅市中山北路2段82巷15號11樓,null,1000000,0910111,1030428
45,13010430,彰旺塑膠股份有限公司,臺中市龍井區忠和里海尾路278巷37號1樓,null,1000000,0910115,1030401
46,13033031,芙麗雅生化科技有限公司,新北市鶯歌區尖山路二五九巷十四號,null,500000,0910226,1030407
47,13040080,捷騰商務科技顧問有限公司,臺中市南區忠孝路147巷7號1樓,null,2000000,0910311,1030402
48,13048077,新潮流事業股份有限公司,嘉義縣水上鄉國姓村三界埔四四三號　,null,6000000,0910321,1030418
49,13056955,綠金園藝事業有限公司,臺中市南區南門里國光路389巷2號1樓,null,15000000,0910402,1030401
50,13085494,姿美飯店企業股份有限公司,臺北市中山區新生北路2段25號1樓至6樓,null,2000000,0910206,1030408
51,13112106,苙景有限公司,臺北市文山區羅斯福路4段200號7樓之9,null,5000000,0910501,1030430
52,13126333,奈仕科技有限公司,新北市板橋區民安里民權路202巷1弄9號,null,500000,0910610,1030410
53,13162392,云軒科技股份有限公司,高雄市苓雅區城西里興中二路69號6樓之2,null,1000000,0910102,1030409
54,13177682,天地人國際有限公司,高雄市三民區自立一路198號,null,500000,0910624,1030428
55,13177775,鼎毅鑫有限公司,高雄市新興區六合一路20號5樓之1,null,500000,0910624,1030416
56,13179160,通捷物流有限公司,屏東縣潮州鎮蓬萊里杭州街113號1樓,null,2000000,0910710,1030407
57,13179464,建億祥海洋企業股份有限公司,高雄市鼓山區鼓山三路１１之１１號,null,5000000,0910712,1030425
58,13193389,馥邦資訊有限公司,高雄市前金區長生街23號,null,2000000,0911216,1030411
59,15357610,華旗企業有限公司,臺北市萬華區西藏路336號1樓,null,12000000,0600922,1030429
60,15473646,億奇有限公司,臺北市中正區新生南路1段170巷17號2樓,null,600000,0600209,1030423
61,15853250,嘉禾電器有限公司,臺北市萬華區內江街164號1樓,null,1000000,0680412,1030401
62,16016231,皇幸企業有限公司,宜蘭縣五結鄉季新村季水路三四之九號,null,500000,0860527,1030414
63,16025506,好年華有限公司,屏東縣屏東市豐源里民學路東段五六號一樓,null,1000000,0860605,1030401
64,16027461,福豐汽車有限公司,嘉義市西區西平里永春一街30號1樓,null,10000000,0860606,1030409
65,16048774,詒新股份有限公司,臺中市東勢區詒福里東關路503-1號,null,11000000,0860627,1030409
66,16049520,睦友機電有限公司,新北市金山區忠孝一路五二號一樓,null,10000000,0860627,1030418
67,16050639,萬烽實業股份有限公司,桃園縣楊梅市紅梅里中山路236號3樓,null,29000000,0860630,1030407
68,16166809,高穩投資股份有限公司,臺北市大安區臥龍街269號5樓,null,12000000,0861013,1030417
69,16179754,大企國際有限公司,臺北市信義區永吉路122號8樓,null,6400000,0861119,1030402
70,16185691,富比利實業股份有限公司,臺中市大雅區科雅路41號2樓,null,70000000,0860802,1030429
71,16211207,新利國際股份有限公司,雲林縣斗六市信義里民生路156號7樓之2,null,5000000,0860901,1030401
72,16211895,營洲企業有限公司,宜蘭縣冬山鄉永美村永安路23巷5弄7號1樓,null,3000000,0860902,1030416
73,16241461,新哥事業有限公司,桃園縣龜山鄉文興路213號3樓之1,null,5000000,0861013,1030418
74,16284756,貫訊科技有限公司,臺北市文山區忠順街2段63號1樓,null,1000000,0861201,1030401
75,16304471,博軒顧問有限公司,臺北市中正區延平南路21號4樓,null,500000,0870212,1030424
76,16347458,家喻國際股份有限公司,雲林縣莿桐鄉大美村大美1-15號,null,10000000,0861219,1030403
77,16356081,雍明貿易有限公司,臺中市東區大智路４２０號１樓,null,5000000,0861231,1030424
78,16423862,百利新金屬有限公司,新北市三重區正義北路三三巷四八號︵四樓︶,null,500000,0870410,1030407
79,16522737,拜歐生活有限公司,新北市鶯歌區中山路１３８巷３號之５，１樓,null,3000000,0870609,1030401
80,16527872,大新營造有限公司,臺南市新化區太平街一五○巷六九之一號一樓,null,3000000,0870616,1030409
81,16527901,台聯開發顧問股份有限公司,桃園縣中壢市嘉興街63號,null,9000000,0870616,1030409
82,16531980,亨泰建材有限公司,苗栗縣後龍鎮埔頂里9鄰中心路91-1號,null,1000000,0870622,1030429
83,16549969,那魯灣企業有限公司,花蓮縣花蓮市主工里信義街六六號,null,3000000,0870716,1030428
84,16676660,三澤建設股份有限公司,新北市土城區中正路1號9樓之7,null,25000000,0871015,1030402
85,16678463,東會戶外用品有限公司,臺中市北屯區平安里文心路4段696號25樓,null,5000000,0871019,1030407
86,16685443,百奕來電子有限公司,臺中市大雅區中清路一段一五二號,null,6000000,0871029,1030428
87,16695104,富德康國際股份有限公司,臺中市龍井區忠和里中央路三段一三六巷五號,null,5000000,0871113,1030331
88,16710999,恆多有限公司,新北市土城區永寧里中央路3段244巷1號,null,1000000,0871210,1030402
89,16734129,興竹東汽車旅館有限公司,新竹縣竹東鎮榮華里北興路二段265、267、269、271、273、275、277、279號,null,6000000,0880120,1030411
90,16745575,優智旺光源股份有限公司,新竹縣竹北市泰和路82號,null,13000000,0871013,1030409
91,16777490,名爰企業股份有限公司,臺北市中山區中山北路2段45巷23號3樓之1,null,12600000,0880108,1030430
92,16798707,世佑數位科技股份有限公司,臺北市中正區漢口街1段132號3樓之5,null,32000000,0880403,1030408
93,16812617,江帆股份有限公司,高雄市苓雅區中華四路100號19樓,null,29000000,0880830,1030409
94,16865091,聲遠國際有限公司,新北市板橋區中山路2段465巷37號,null,1000000,0880302,1030408
95,16865578,信元金屬有限公司,臺南市北區中華北路二段221之3號,null,20000000,0880303,1030422
96,16890937,東振工程有限公司,新北市三重區頂崁街一四五號一樓,null,5000000,0880413,1030416
97,16943006,信竑電子有限公司,桃園縣平鎮市東勢里太平西路３７巷９弄７號１樓,null,30000000,0880617,1030421
98,16951687,昀大精密工業股份有限公司,臺中市大雅區四德里中山八路八五號,null,20000000,0880701,1030414
99,16988615,古物金農有限公司,新竹市光復路1段285巷4弄3號,null,500000,0880823,1030410
100,16993407,家鄰國際包裝有限公司,臺中市南區工學二街151巷25號1樓,null,1000000,0880830,1030403
101,20776297,嵩誠企業有限公司,臺北市信義區延壽街99號,null,1000000,0670124,1030422
102,20777009,蜜露有限公司,臺北市大安區臥龍街250號1樓,null,1500000,0670204,1030423
103,20826590,巴利貿易有限公司,臺北市信義區松山路541巷14弄3號1樓,null,5000000,0680703,1030428
104,20847722,升郁實業有限公司,臺北市松山區光復南路46巷16號1樓,null,3000000,null,1030430
105,21208364,合昇電機工業有限公司,臺北市松山區長安東路2段294號4樓之1,null,6000000,0730211,1030411
106,22073300,忠鋼企業經營顧問有限公司,臺中市北區大雅路313號,null,2000000,0750225,1030414
107,22150100,豪美骨科器材有限公司,臺北市內湖區洲子街65號5樓,null,8000000,0750522,1030409
108,22175279,豪廣企業有限公司,臺北市中山區松江路170巷34號2樓,null,5000000,0750726,1030401
109,22211248,鄔金企業股份有限公司,桃園縣桃園市忠義里大業路一段8號1樓之2,null,7200000,0750623,1030402
110,22226523,承倫工業有限公司,臺中市太平區中山路四段一二巷二八之四之二號,null,5000000,0750718,1030415
111,22347717,佳鋼工業股份有限公司,臺北市大同區長安西路45之1號4樓,null,10000000,0740807,1030417
112,22408811,千能企業有限公司,新北市永和區永寧街62巷5號3樓,null,3000000,0760318,1030429
113,22412414,勝偉有限公司,新北市三重區錦通街14號3樓,null,5000000,0760325,1030409
114,22415088,合雅實業股份有限公司,臺南市麻豆區麻口里1鄰麻豆口1之6號,null,8000000,0760328,1030418
115,22457116,明灣企業有限公司,臺北市大安區安和路2段5號4樓之3,null,5000000,0760522,1030401
116,22496357,光英汽車修護有限公司,新北市中和區永和路337之1號1樓,null,1000000,0760509,1030401
117,22563762,華陞企業有限公司,新北市新店區寶興路60巷42號,null,1000000,0760715,1030416
118,22566509,津宏企業有限公司,新北市中和區景新街六四巷一四號,null,1000000,0760721,1030402
119,22586370,金文發塑膠實業有限公司,臺南市北區大公里佑民街四二巷四五號,null,5000000,0760824,1030416
120,22609182,禾貿實業有限公司,臺北市大安區羅斯福路3段75號10樓,null,5000000,0760709,1030417
121,22610218,保捷航空貨運承攬股份有限公司,臺中市大雅區六寶里中清路4段629號,null,5000000,0760711,1030414
122,22611722,葉富國際有限公司,新北市板橋區三民路二段二四五巷六九弄一九號一樓,null,5000000,0760706,1030409
123,22671122,瑞明網版有限公司,桃園縣桃園市國強二街二○三號三樓,null,5000000,0761020,1030415
124,22845989,勇發企業有限公司,高雄市左營區後昌路599巷18號,null,5000000,0780106,1030402
125,22870614,采英企業股份有限公司,臺北市中山區民權東路2段26號8樓之8,null,10000000,0770420,1030415
126,22924196,瑩銘精密工業股份有限公司,新北市板橋區南雅南路1段55號7樓之9,null,5000000,0770518,1030430
127,22926201,萬多富事業有限公司,臺中市西屯區長安路二段一○九號一樓,null,1200000,0770520,1030421
128,22927588,威州投資有限公司,新北市板橋區民生路三段廿五號一樓,null,6000000,0770523,1030414
129,23017685,新女性服飾有限公司,臺北市大安區大安路1段95號1樓,陳月環,5000000,0770707,1030414
130,23086161,肇盈有限公司,高雄市楠梓區東寧里清豐二路360巷2號1樓,null,5000000,0771101,1030417
131,23120745,配鑫企業有限公司,新北市汐止區明峰街二○○號一樓,null,1000000,0771024,1030414
132,23178859,鴻吉車業有限公司,嘉義縣中埔鄉富收村頂中下街5號之24,null,1200000,0780105,1030411
133,23180449,合興度量衡有限公司,桃園縣桃園市光興里勇一街34號,null,1000000,null,1030410
134,23264030,鮮美農產有限公司,彰化縣溪湖鎮湖東里英山街７號,null,15000000,0780516,1030428
135,23269160,燦易實業有限公司,新北市汐止區中興路89號2樓,null,5000000,0780523,1030430
136,23312265,櫻盛開發有限公司,新北市新店區安祥路131號2樓,null,5000000,0780524,1030417
137,23384295,東良電腦有限公司,苗栗縣竹南鎮環巿路一段376號,null,2000000,0780706,1030401
138,23394104,藝霖影寫製版有限公司,新北市板橋區中正路三一三號三樓之十八,null,6000000,0780720,1030411
139,23430951,航得企業有限公司,臺北市士林區德行東路266巷15號,null,5000000,0780724,1030430
140,23522311,博可興播音視材有限公司,新北市板橋區新民里漢生東路5號1樓,null,5000000,0781117,1030430
141,23524556,健興化學有限公司,新竹市埔前里牛埔南路一四二巷八弄一二號,null,5000000,0781121,1030424
142,23567442,宬昇企業有限公司,臺南市永康區勝利里十八鄰中華一路三二四巷一號,null,1000000,0790109,1030409
143,23570925,?全有限公司,彰化縣和美鎮和西里道周路799巷32號,null,5000000,0790117,1030401
144,23610102,富仕得貿易有限公司,臺北市信義區吳興街600巷83弄1號5樓,null,5020000,0790111,1030430
145,23615583,大富電梯有限公司,臺北市大同區哈密街45巷1弄13號4樓,null,5000000,0790125,1030401
146,23622753,群逸建材股份有限公司,新北市中和區興南路1段56巷1弄1之3號4樓,null,31500000,0790221,1030421
147,23676574,德寶工業有限公司,新北市汐止區樟樹一路九九巷九弄一號五樓,null,1000000,0790312,1030403
148,23758293,慶展廣告事業有限公司,臺北市中山區復興北路514巷35號3樓,null,2000000,0790620,1030407
149,23799175,聖玹有限公司,新北市新莊區中和街一七五巷八號,null,5000000,0790630,1030411
150,23804590,南加洲家具有限公司,臺南市永康區甲頂里中正南路240號,null,3000000,0790710,1030409
151,23813958,村闐企業有限公司,新竹市光華一街四十號,null,2000000,0790724,1030410
152,23833814,路江企業有限公司,新北市蘆洲區仁愛街118巷6號1樓,null,5000000,0790815,1030409
153,23876989,隨利企業有限公司,臺中市北區建成里東光路412號1樓,null,5000000,0791105,1030428
154,23938417,亞爾達有限公司,臺北市大安區敦化南路2段26號13樓之1,null,8000000,0791119,1030403
155,23954318,江氏汽車有限公司,臺中市南區大慶街1段240號,null,4000000,0791217,1030401
156,23963999,玉新食品有限公司,南投縣名間鄉新街村彰南路564號,null,3000000,0800105,1030414
157,23965770,鴻穀有限公司,桃園縣八德鄉霄裡村龍宮街３４號,null,6000000,0800109,1030421
158,24207826,奇樂國際事業有限公司,臺中市東區東英里三賢街126號四樓,null,2000000,0970729,1030403
159,24215092,茗達設計工程有限公司,新北市新莊區化成路431巷68號,null,5000000,0970808,1030417
160,24219288,果立實業有限公司,新北市汐止區大同路2段153號10樓,null,10000000,0970818,1030407
161,24221427,源寶運輸設備有限公司,南投縣南投市營北里下庄巷24-1號1樓,null,250000,0970821,1030424
162,24223635,鋆陞企業有限公司,臺中市大雅區學府路403巷16號1樓,null,500000,0970825,1030429
163,24226725,蒂諾亞傢飾有限公司,新北市新莊區中正路新建巷28弄23之4號5樓,null,1000000,0970901,1030417
164,24232212,泰悅有限公司,臺中市北屯區平德里文心路四段466號,null,260000,0970910,1030426
165,24239833,濰麟國際有限公司,新北市土城區立德路107號3樓之1,null,1100000,0970926,1030430
166,24241893,安基機械有限公司,新北市中和區圓通路369巷5弄8之3號,null,350000,0971001,1030422
167,24247931,保莊企業有限公司,新北市泰山區福興里泰林路2段93巷11號8樓,null,1000000,0971013,1030410
168,24250674,如陽工業有限公司,臺中市南區福田路123巷53號1樓,null,250000,0971017,1030411
169,24252602,賓彥有限公司,新北市中和區中山路2段338號,null,1000000,0971021,1030415
170,24262117,飛悅實業有限公司,null,null,0,0971107,1030430
171,24264781,村耕?舖有限公司,彰化縣線西鄉線西村沿海路二段12號1樓,null,500000,0971113,1030417
172,24265705,工二不動產有限公司,臺中市南屯區寶山里工業區18路31之1號1樓,null,3000000,0971114,1030428
173,24267078,倍司特科技有限公司,臺南市安南區北安路2段501號1樓,null,2500000,0971118,1030402
174,24279525,達清消防有限公司,桃園縣桃園市天祥五街5號6樓之3,null,3000000,0971215,1030425
175,24283817,優評網路有限公司,臺中市西屯區櫻城一街130號1樓,null,500000,0971223,1030428
176,24291942,山滿水晶坊有限公司,新北市樹林區大有路126號,null,250000,0980110,1030414
177,24293821,毅陽農業科技有限公司,屏東縣潮州鎮光華里光華路95號,null,1000000,0980115,1030402
178,24294167,康士亞牙技有限公司,臺中市東區自由路四段425號1樓,null,3000000,0980115,1030421
179,24297994,祥璨實業有限公司,臺中市沙鹿區西勢里中清路西勢六巷8號,null,500000,0980122,1030403
180,24298038,建圓有限公司,新北市樹林區中正路663號,null,1000000,0980122,1030417
181,24307986,捷森國際興業有限公司,臺北市中正區杭州南路1段23號8樓之2,null,250000,0971118,1030414
182,24314852,目立康科技有限公司,臺北市中山區松江路69巷2之1號1樓,null,1000000,0971218,1030422
183,24344722,雅達利國際有限公司,臺北市大安區忠孝東路4段148號4樓之3,null,1000000,0980507,1030410
184,24354848,春天興業股份有限公司,臺中市西屯區何安里西屯路二段101-5號3樓,null,2000000,0980216,1030401
185,24356402,中原一零一不動產經紀有限公司,桃園縣中壢市信義里成都路64號,null,1000000,0980219,1030401
186,24368548,上慶管理顧問事業有限公司,桃園縣桃園市大興里23鄰春日路947號,null,5000000,0980312,1030407
187,24378172,乃元國際股份有限公司,臺中市南區樹義里高工路95號2樓,null,5000000,0980330,1030415
188,24380022,綠夾克運動事業有限公司,null,null,0,0980401,1030416
189,24392076,茂逸實業有限公司,嘉義市國華里民權路387號9樓2,null,7000000,0980421,1030411
190,24401785,友立醫療器材有限公司,新北市三重區三和路4段145巷3號,null,1000000,0980507,1030423
191,24404191,璟圓不動產有限公司,臺中市豐原區中山路124號,null,500000,0980512,1030409
192,24404713,志峰科技有限公司,臺南市北區文賢二街500巷25號,null,250000,0980513,1030417
193,24409386,時現室內裝修有限公司,臺中市北區建成里東光六街7號1樓,null,500000,0980520,1030407
194,24410601,立鑫精密儀器有限公司,新北市板橋區玉光里永豐街83號,null,1000000,0980522,1030416
195,24411088,伊諾投資有限公司,桃園縣桃園市復興路51號10樓之6,null,11500000,0980522,1030415
196,24418759,丰耀科技股份有限公司,新竹市新莊里關新路19巷107號14樓,null,500000,0980606,1030410
197,24419096,皇承實業有限公司,臺中市西屯區福上巷251弄58號1樓,null,3000000,0980606,1030409
198,24426272,新威工程有限公司,新北市板橋區大智街71巷48號,null,2000000,0980618,1030403
199,24429518,生詠有限公司,新北市土城區中央路1段118巷1弄11號3樓,null,500000,0980623,1030415
200,24432160,宜陞科技股份有限公司,桃園縣桃園市瑞慶里莊一街130號3樓,呂曉雯,5000000,0980626,1030410
201,24434316,寶佳生活有限公司,臺南市南區金華里金華路二段51巷69號1樓,null,500000,0980701,1030407
202,24438024,嘉讚資訊有限公司,臺中市西屯區天水西一街22號1樓,null,2000000,0980707,1030403
203,24452019,宇鴻消防工程有限公司,新北市板橋區中山路2段465巷29之2號,null,1000000,0980731,1030408
204,24452165,志堅精密工業有限公司,臺北市松山區南京東路4段130號3樓之1,null,500000,0980803,1030430
205,24457458,鼎拓有限公司,臺北市中正區延平南路21號2樓,null,500000,0980821,1030422
206,24459006,雋之有限公司,臺北市大同區南京西路18巷20之1號4樓,null,500000,0980827,1030411
207,24462852,佳利行銷有限公司,臺中市西區忠誠里台中港路1段393號12樓之1,null,10000000,0980910,1030418
208,24482132,文地吉有限公司,臺北市信義區基隆路1段200號4樓,null,500000,0981124,1030401
209,24492693,鑫益電子有限公司,臺北市中正區開封街1段2號7樓之6,null,500000,0981231,1030407
210,24493460,衣創有限公司,臺北市內湖區洲子街70號7樓之1,null,1000000,0990105,1030430
211,24493980,御騰投資有限公司,臺北市大安區復興南路2段27號7樓之5,null,3200000,0990107,1030407
212,24500130,中聯實業有限公司,高雄市前鎮區文橫3路35之5號9樓,null,1000000,0981020,1030410
213,24500841,昌日盛工程有限公司,高雄市三民區民族1路543巷25之9號8樓,null,1000000,0981102,1030423
214,24501399,詠建勝企業有限公司,屏東縣里港鄉潮厝村潮厝路117-5號1樓,null,1000000,0981110,1030410
215,24507909,金海峽股份有限公司,臺中市烏日區自立街43號1樓,null,3000000,0990212,1030418
216,24509792,順天福實業有限公司,高雄市楠梓區德祥路4號1樓,null,5000000,0990322,1030328
217,24510502,寶來旺有限公司,高雄市鼓山區大順一路1031號地下1樓之3,null,1000000,0990329,1030421
218,24510812,台灣網資訊有限公司,高雄市左營區軍校路622號,null,1000000,0990401,1030423
219,24520184,匯承國際有限公司,高雄市苓雅區光華一路206號11樓之2,null,501000,0990728,1030401
220,24522373,東協貿易有限公司,高雄市鹽埕區必忠街61巷16號,null,1000000,0990826,1030423
221,24526363,創意達電子科技有限公司,高雄市三民區明賢街100號13樓之3,null,1000000,0991019,1030421
222,24526624,達樂生化技術股份有限公司,高雄市前鎮區民權二路6號4樓之2,null,2015330,0991025,1030416
223,25000061,弘晹有限公司,嘉義縣民雄鄉文隆村建國路2段61號 ,null,2000000,0980724,1030402
224,25008401,極智股份有限公司,高雄市岡山區華園路31巷5號1樓,null,1000000,0980805,1030417
