序號,統一編號,公司名稱,公司所在地,代表人,資本額,核准設立日期,核准解散日期
1,13077608,高鶴實業有限公司,彰化縣員林鎮萬年里員水路二段四二一巷八一號　,,2000000,910426,1020306
2,13077749,介面房屋仲介有限公司,宜蘭縣羅東鎮北成里四維路155巷3號1樓,,500000,910426,1020305
3,13084571,中悅實業有限公司,新北市汐止區汐萬路2段122巷27號1樓,,21880000,921104,1020319
4,13140975,博智藥品有限公司,臺北市大安區和平東路1段197號8樓之2,,2500000,910722,1020301
5,13144418,波羅的海商貿開發有限公司,高雄市新興區青年一路206號,,1000000,900320,1020322
6,13150683,晉嶸企業有限公司,高雄市前鎮區興東里民權二路378之1號9樓之8,,500000,900621,1020304
7,13152916,朗盛科技實業有限公司,高雄市三民區皓東路9巷28號5樓,,500000,900726,1020308
8,13153318,有田國際有限公司,高雄市苓雅區福建街220號1樓,,500000,900801,1020304
9,13155408,佐嶧實業有限公司,高雄市前鎮區民興街11號1樓,,2000000,900907,1020306
10,13155821,威利特國際貿易有限公司,臺中市北屯區松安里柳陽西街135號4樓之1,,1000000,900913,1020319
11,13160211,翰勝有限公司,高雄市小港區青山街123巷52號6樓,,1000000,901128,1020227
12,13177493,中華美食有限公司,高雄市小港區飛機路542之1號,,1000000,910620,1020318
13,13177830,茂盛針車實業有限公司,高雄市鼓山區翠華路141號,,500000,910625,1020226
14,13184115,杰成投資股份有限公司,高雄市左營區裕誠路394號9樓,,10000000,910903,1020312
15,13185711,宜真企業有限公司,高雄市苓雅區三多三路224號8樓,,500000,910923,1020305
16,14010520,台灣標準電腦股份有限公司,臺北市中正區忠孝東路2段100號8樓,,19000000,640227,1020314
17,14053457,聖倫利諾企業有限公司,臺北市松山區興安街155號7樓,,5000000,650112,1020311
18,14063151,意明裝潢材料有限公司,臺北市大安區溫州街22巷16號1樓,,3000000,501010,1020326
19,14074925,安舜交通股份有限公司,臺北市士林區通河西街2段210號1樓,,3500000,650514,1020328
20,15966091,泓誌五金股份有限公司,新北市土城區中央路4段35之1號1樓,,50000000,790620,1020306
21,16001286,銘顥企業有限公司,桃園縣楊梅市秀才路一七五巷一九弄五七號,,5000000,860513,1020227
22,16015818,儀力企業有限公司,新北市中和區中山路2段526巷25弄4之1號,,4800000,861105,1020322
23,16019172,晨藝有限公司,桃園縣桃園市汴洲里大有路九四六巷五弄二號,,1000000,860529,1020312
24,16033436,農高實業有限公司,臺中市西屯區潮洋里龍門一街三三○號,,1000000,860613,1020325
25,16059358,興傳工程有限公司,桃園縣龍潭鄉高原村11鄰大庄18號之1（二樓）,,1000000,860707,1020308
26,16072520,基誠電信工程有限公司,臺中市龍井區山腳里沙田路6段東巷55號,,1000000,860722,1020328
27,16074837,清發廢棄物清理有限公司,彰化縣埔鹽鄉打廉村埔打路37之1號,,1000000,860724,1020325
28,16075553,寶華食品有限公司,臺中市太平區新光路新生五○巷一七弄五號,,500000,860725,1020321
29,16076954,宋益有限公司,雲林縣斗六市榴中里石榴路369巷110弄8號1樓,,600000,860725,1020328
30,16080514,亞仕帝科技股份有限公司,,,0,860422,1020321
31,16107767,金松利有限公司,高雄市三民區明仁路16之4號13樓之2,,1000000,860724,1020325
32,16122227,亞太建築物公共安全檢查有限公司,高雄市鼓山區大順一路817號1樓,,2000000,861213,1020312
33,16123422,亞太消防技術顧問有限公司,高雄市鼓山區大順一路817號1樓,,10000000,861224,1020312
34,16127074,長照工程有限公司,屏東縣九如鄉東寧村林森路35號1樓,,5000000,870218,1020313
35,16128876,浡展企業有限公司,高雄市三民區灣復街卅號5樓之11,,5000000,870310,1020311
36,16159589,富基投資股份有限公司,臺北市中山區通北街111號2樓,,53330000,860922,1020305
37,16160517,富鴻投資股份有限公司,臺北市中山區通北街111號2樓,,53330000,860925,1020305
38,16180268,昌利通信有限公司,臺北市文山區景興路248號1樓,,500000,861120,1020320
39,16195537,揚海企業有限公司,新北市板橋區中正路325巷1弄21之1號2樓,,5000000,860806,1020308
40,16206555,必爾登工程事業有限公司,新北市林口區中山路250號7樓之3,,5000000,860827,1020318
41,16235973,來帥企業有限公司,新北市汐止區新昌里忠孝東路２８１號,,1000000,861006,1020308
42,16238000,漢法實業有限公司,臺北市信義區忠孝東路5段457號5樓之8,,1000000,861007,1020318
43,16250144,世豐汽車音響有限公司,新北市土城區中華路一段八五號,,1000000,861022,1020318
44,16277559,世通不動產鑑價顧問有限公司,臺中市西區梅川西路二段36號2樓,,1000000,861125,1020328
45,16277853,益進剎車實業有限公司,新北市淡水區興仁路34巷18號,,3500000,861126,1020325
46,16296459,興利食品有限公司,臺北市中正區金山南路1段31號1樓,,500000,870108,1020305
47,16302516,俊和投資股份有限公司,臺北市中正區南海路20號3樓,,30000000,870203,1020306
48,16309567,百盈國際企業有限公司,臺北市中山區長安東路2段162號5樓之1,,5000000,870302,1020321
49,16353577,學助螺絲有限公司,新北市板橋區長安街138巷1弄2號3樓,,5000000,861227,1020322
50,16356408,仟翔加油站企業股份有限公司,高雄市大寮區山頂里萬丹路16號,,7000000,861231,1020326
51,16363344,泉淮水電有限公司,雲林縣麥寮鄉麥豐村新興路67號1樓,,2000000,870112,1020307
52,16399981,翁明營造有限公司,花蓮縣新城鄉嘉里村三鄰福德路十七之七號一樓,,3000000,870312,1020304
53,16416790,慶元木業有限公司,新北市中和區景新街447之2號,,10000000,870401,1020325
54,16419142,觀海加油站有限公司,新竹市西濱路三段501號,,15000000,870404,1020304
55,16422625,百分好通信有限公司,桃園縣中壢市石頭里中正路二六號,,1000000,870409,1020329
56,16461485,良安消防工程有限公司,高雄市左營區新上里辛亥路197號,,5000000,870717,1020227
57,16470576,光筌貿易有限公司,高雄市三民區建國一路468號,,10000000,871102,1020301
58,16509495,泰聯石材有限公司,臺北市文山區興隆路2段220巷55弄10號,,650000,870525,1020329
59,16538668,橋翰水電材料有限公司,雲林縣土庫鎮宮北里文化路64號,,500000,870630,1020227
60,16539580,尚達國際有限公司,臺中市西區大隆路20號7樓之2,,1000000,870701,1020320
61,16552247,億旺投資有限公司,基隆市仁愛區博愛里愛三路9號4樓之1,,30000000,870720,1020320
62,16568578,德泰清潔有限公司,新北市新莊區民本街23巷7之4號,,1000000,870807,1020304
63,16579225,金加達織帶有限公司,彰化縣鹿港鎮詔安里某旦巷23之1號2樓,,1000000,870821,1020327
64,16595225,蔚欣企業有限公司,臺北市內湖區內湖路1段602號1樓,,2000000,870611,1020329
65,16612842,寶顥股份有限公司,臺北市松山區民生東路5段159號6樓,,1000000,870804,1020304
66,16652724,儒億企業有限公司,新北市蘆洲區復興路286號4樓,,1000000,870910,1020307
67,16664600,茂煜貿易有限公司,臺南市永康區中興里中興街91巷44號2樓,,1000000,870928,1020326
68,16701416,勤焊機械工程有限公司,新北市淡水區大義街29巷6之2號,,5000000,871123,1020320
69,16709183,沛根有限公司,宜蘭縣羅東鎮國華里建國街39號1樓,,1000000,871208,1020307
70,16776149,鴻澤貿易實業有限公司,臺北市中山區雙城街43巷16號1樓,,1000000,871231,1020329
71,16812285,華納大舞廳有限公司,高雄市新興區七賢二路58號1樓,,5000000,880824,1020307
72,16814050,巨曜國際企業有限公司,高雄市左營區重吉路40號,,2400000,880920,1020328
73,16814663,積利達科技有限公司,高雄市三民區鼎泰里裕誠路70之3號9樓,,5000000,880929,1020307
74,16816199,迦誠企業有限公司,高雄市三民區朝陽街143號,,500000,881020,1020318
75,16892323,儷京旅館事業股份有限公司,臺中市南屯區公益路2段411號1、2樓,,4660000,880414,1020315
76,16894981,上逸廣告工程有限公司,新北市中和區景新街467巷27號,,5000000,880417,1020325
77,16913495,百巨科技有限公司,新北市土城區明德路1段195巷1弄11號,,3000000,880511,1020319
78,16918132,好嘉婷有限公司,新北市新店區新生街61號5樓,,1000000,880517,1020322
79,16928357,呈格企業有限公司,臺中市南屯區大墩七街一九七號一樓,,500000,880528,1020307
80,16944130,朕明鋼鐵有限公司,高雄市大寮區鳳屏一路６７６號２樓,,10000000,880621,1020305
81,16954874,聯勤國際有限公司,臺中市北屯區后庄路７１號之３,,1000000,880706,1020320
82,16975533,宇震木業有限公司,臺中市神岡區新庄里和睦路五○六巷一號,,500000,880804,1020322
83,16989677,順譽企業有限公司,雲林縣二崙鄉油車村成功路六一號,,1000000,880824,1020319
84,18654425,伊犁股份有限公司,臺北市松山區八德路3段247號4樓之2,,3500000,610731,1020320
85,18844024,美臺針織股份有限公司,臺北市大安區泰順街60巷9號7樓,,10000000,581224,1020307
86,20923592,岡泉企業股份有限公司,臺北市松山區八德路2段356號6樓,,60000000,710513,1020328
87,20930329,智博工程有限公司,臺中市北屯區文心路4段233號1樓,,5000000,710617,1020312
88,20978630,金達國際物流股份有限公司,臺中市南屯區公益路2段61號17樓,,10000000,720607,1020329
89,20987167,聯高企業有限公司,臺北市大同區承德路2段81號14樓之1,,1000000,720714,1020301
90,21233048,百笛光電科技股份有限公司,臺北市南港區成福路26巷1弄4之1號,,10000000,730831,1020325
91,22016483,山谷蘭股份有限公司,臺北市文山區忠順街1段9巷11號,,1000000,750207,1020314
92,22084067,權?鋼鐵有限公司,高雄市小港區店中路48巷32號,,2000000,750319,1020306
93,22085621,啟羽企業有限公司,臺中市北區忠太西路93號1樓,,3000000,750321,1020314
94,22090716,營餘企業有限公司,新北市五股區御史路七八巷二號,,1000000,750331,1020321
95,22097020,謙樺海事工程有限公司,高雄市三民區民業路3號5樓,,5000000,750322,1020326
96,22143592,成皇工程有限公司,高雄市楠梓區右昌二巷37號,,3000000,750502,1020306
97,22184116,鳴昌實業有限公司,臺北市信義區松德路65號11樓之1,,1000000,750820,1020318
98,22187129,中華電梯股份有限公司,臺北市信義區永吉路186號4樓,,25050000,750827,1020306
99,22208779,特岡工業有限公司,新北市樹林區保安街2段195之2號3樓,,15000000,750619,1020328
100,22274854,家家油漆工程有限公司,新北市新店區直潭六街46號1樓,,5000000,750922,1020329
101,22282073,暐勝實業有限公司,臺南市東區崇明十一街10巷2號,,5000000,751008,1020312
102,22386915,揚明新娘服飾股份有限公司,嘉義縣水上鄉下寮村鴿溪寮20-129號,,5000000,760203,1020322
103,22464340,福陞貿易有限公司,新北市汐止區大同路2段271號9樓之3,,5000000,760609,1020308
104,22510111,福松實業有限公司,新北市三重區長壽西街一六七號,,3000000,760603,1020304
105,22532179,銘福冷凍食品廠股份有限公司,高雄市前鎮區興漁四路3號,,18000000,760708,1020227
106,22552097,宏運船務代理有限公司,高雄市鼓山區臨海一路15之2號,,1800000,770411,1020312
107,22604567,慶隆工業股份有限公司,臺中市神岡區豐洲里東洲路23巷1弄9號1樓,,15000000,760930,1020312
108,22621550,威獅商業有限公司,臺北市大安區忠孝東路4段223巷49弄2號1樓,,500000,760806,1020319
109,22663930,安泰證券投資顧問股份有限公司,,,0,770308,1020304
110,22665424,凱隆藝品有限公司,桃園縣平鎮市中豐路山頂段四六九巷四四弄十一號,,5000000,761005,1020301
111,22719625,大福企管顧問股份有限公司,臺北市信義區忠孝東路4段563號9樓,,5000000,761113,1020307
112,22761496,天資興業有限公司,臺北市士林區天母西路32號34號1樓,,1000000,770307,1020304
113,22768316,聖宗實業有限公司,臺中市大里區塗城里三民一街9巷7號,,2000000,770122,1020320
114,22775549,泓星有限公司,新北市三重區中興南街六六號,,1000000,770204,1020328
115,22802285,琦泰股份有限公司,桃園縣桃園市汴洲里有恒街25號,,5000000,770401,1020313
116,22814515,聖昕企業有限公司,桃園縣中壢市龍岡里後寮62之19號,,5000000,770420,1020320
117,22834483,歐傑電腦科技有限公司,高雄市三民區建國二路１３７號１樓,,2000000,770804,1020320
118,22835244,首都室內設計有限公司,高雄市苓雅區成功1路232號13樓之6,,1000000,770813,1020326
119,22845587,傑林餐飲器材有限公司,高雄市苓雅區成功一路86號,,5000000,771231,1020301
120,22863064,王品家飾裝潢有限公司,臺北市大安區信義路4段309號,,3000000,770406,1020328
121,22864275,羅棟室內裝修設計有限公司,臺北市信義區基隆路2段85號5樓,,6000000,770407,1020327
122,22889233,亨坤企業有限公司,臺北市內湖區康樂街136巷15弄41號5樓,,2000000,770526,1020329
123,22899339,明華汽車百貨有限公司,臺北市北投區中和街453之11號,,1000000,770614,1020320
124,22902138,漢鑫圖書縮影出版有限公司,新北市中和區安平路74號,,10000000,770621,1020312
125,22905584,千新家具有限公司,臺中市潭子區東寶里大德北路一四五巷一○號,,5000000,770425,1020306
126,22925195,新程機械有限公司,彰化縣北斗鎮光復里復興路三一六巷四號,,5000000,770519,1020322
127,22939894,富勛工業股份有限公司,高雄市大寮區中庄里立德路665巷2號1樓,,10000000,770607,1020318
128,22963303,長德加油站實業有限公司,屏東縣新園鄉五房村龍洲路47-2號,,5500000,770701,1020306
129,22995987,伯奇企業有限公司,新北市蘆洲區信義路二二二巷二二弄六號四樓,,5000000,770823,1020306
130,23013843,士賢貿易有限公司,臺北市大同區承德路3段34號1樓,,5000000,770630,1020306
131,23015188,泰崗科技有限公司,臺北市松山區三民路9號2樓之4,,6000000,770702,1020307
132,23078556,螢德鋼鐵股份有限公司,臺南市新營區嘉芳里四維路7號,,10000000,771018,1020311
133,23108708,高陽汽車有限公司,臺中市北區梅川東路三段213號1樓,,1000000,771212,1020305
134,23122693,莎菈企業有限公司,臺北市文山區木柵路2段197號,,5000000,771029,1020301
135,23134831,同信環境工程股份有限公司,臺北市中山區長安東路2段162號5樓之1,,10000000,771201,1020321
136,23183712,祐宏實業有限公司,新北市三重區中正北路一四五巷四弄一七號三樓,,5000000,780113,1020305
137,23186366,元嘉農藥有限公司,嘉義縣太保市麻寮里中山路二段一三七巷六號一樓　,,1000000,780118,1020320
138,23230264,世昇藥品有限公司,新北市土城區明德路一段20巷2弄1號,,5000000,780327,1020325
139,23230623,淳琿企業有限公司,新北市板橋區大觀路二段170號3樓,,10000000,780328,1020328
140,23251773,銓億豐企業有限公司,臺中市大雅區上楓里中正路188之2號,,5000000,780426,1020314
141,23285915,偉企貿易有限公司,臺北市松山區南京東路5段308號5樓之1,,5000000,780322,1020306
142,23311771,大立影視燈光工程有限公司,臺北市文山區興隆路3段112巷2弄30號1樓,,3000000,780523,1020319
143,23328013,薪泰實業有限公司,高雄市新興區河南路354號,,2000000,780413,1020306
144,23341108,祐暢貿易有限公司,高雄市鹽埕區建國四路278號,,250000,780901,1020305
145,23352688,泰發成漁業股份有限公司,高雄市鼓山區鼓元街62號,,24000000,790125,1020306
146,23363186,福祿壽紙器有限公司,桃園縣蘆竹鄉營盤村六福路165巷25號2樓,,500000,780605,1020304
147,23374825,元隆輪業有限公司,臺中市西區成功路四七七號一樓,,5000000,780621,1020314
148,23421411,上紘企業有限公司,臺北市中山區中山北路3段26號3樓,,3400000,780701,1020313
149,23479237,梵宇室內裝潢設計有限公司,臺中市南屯區大業路一三一號二樓,,1000000,780828,1020227
150,23501006,雄欽企業有限公司,臺中市沙鹿區埔子里屏西路古月巷二一號之四,,5000000,781006,1020329
151,23504030,竹村建設有限公司,新竹市龍山里惠民街27號,,500000,781012,1020329
152,23511481,智瀅企業股份有限公司,臺中市南區瑞豐街40號1樓,,6000000,781026,1020306
153,23511980,瑋晨工業股份有限公司,新北市鶯歌區鶯桃路91巷42弄24號2樓,,10000000,781027,1020319
154,23519147,源山紙器有限公司,新北市新莊區新莊路四九三巷四弄二一號三樓　,,1000000,,1020315
155,23557893,誠德塑膠工業股份有限公司,新北市泰山區泰林路二段二九二巷九號一樓,,5000000,790202,1020306
156,23576054,麒勝裝潢有限公司,新北市新莊區中信街４９號５樓,,5000000,790214,1020313
157,23591908,昱軒實業有限公司,新北市中和區捷運路一五五號,,1000000,781118,1020320
158,23594308,學美文具印刷有限公司,臺北市中山區建國北路2段186巷15號1樓,,2000000,781124,1020326
159,23645290,順力工程有限公司,高雄市三民區九如一路74巷8號,,5000000,790423,1020227
160,23645968,成來漁業股份有限公司,高雄市鼓山區鼓元街62號,,12000000,790428,1020305
161,23682983,美大立實業有限公司,臺中市西屯區何安里重慶路二五九號,,1000000,790321,1020311
162,23691110,廣群鋼鐵有限公司,臺中市太平區成功里東平路209號,,10000000,790403,1020308
163,23696749,吉信冷氣機電工程有限公司,桃園縣八德市大湳里和平路991巷58弄11號,,5000000,790411,1020328
164,23760592,玉晟有限公司,臺北市大安區青田街8之2號,,5000000,790626,1020322
165,23818644,笙榮實業有限公司,桃園縣中壢市西園路102巷16號,,3000000,790731,1020312
166,23819622,榮奕工業有限公司,新北市中和區福美路301巷11號,,1000000,790801,1020318
167,23879613,瑞智實業股份有限公司,新北市新莊區仁愛里福樂街156巷12弄18號4樓,,5000000,790727,1020314
168,23898098,至銓實業有限公司,桃園縣桃園市青溪里三民路一段167號9樓,,5000000,790915,1020319
169,23948169,佑勝有限公司,臺中市清水區西寧里中興街一一五號壹樓,,2000000,791206,1020314
170,23949060,旺達紙器企業有限公司,桃園縣龜山鄉山德村民安街64巷25弄23號,,5000000,791207,1020306
171,23993699,訊興企業有限公司,臺北市大安區建國南路2段11巷26號2樓,,3000000,791228,1020314
172,23996252,千特企業有限公司,新北市淡水區民族路八七號一樓,,5000000,800108,1020307
173,23997219,譜訊傳播有限公司,臺北市松山區光復北路100巷23號1樓,,3000000,800111,1020304
174,24200719,銓鈺實業有限公司,嘉義縣民雄鄉大崎村大丘園18之18號1樓,,1680000,970716,1020301
175,24204573,翊閎企業有限公司,高雄市大寮區內坑里崇恩路６３巷１１號,,1000000,970722,1020304
176,24208557,環亦科技股份有限公司,南投縣鹿谷鄉廣興村中正路一段82號1樓,,1000000,970730,1020329
177,24211390,鈺宸興業有限公司,桃園縣大園鄉三和路3巷1弄8號,,250000,970804,1020306
178,24229841,薇閣清潔服務有限公司,新竹縣竹北市鹿場里2鄰成功三路80號二樓,,2000000,970905,1020227
179,24231298,富華達科技股份有限公司,桃園縣桃園市新埔里新埔五街９１號６樓,,5000000,970909,1020307
180,24233465,友竣科技有限公司,彰化縣員林鎮民生里四平街２４巷８號,,300000,970912,1020306
181,24233599,金佳億服飾有限公司,新北市板橋區四川路2段245巷53-6號4樓,,2000000,970912,1020305
182,24234582,冠宇國際企業有限公司,臺中市北屯區遼陽六街60號,,8000000,970916,1020301
183,24240304,晶泳企業有限公司,新竹縣竹北市嘉政三街10號,,1200000,970926,1020321
184,24243371,易庫瑪有限公司,臺北市信義區基隆路1段333號19樓,,250000,971003,1020306
185,24243674,?鑫食品有限公司,臺中市烏日區螺潭里太明路成豐巷308-1號,,5000000,971003,1020329
186,24243908,藍金環保科技股份有限公司,新竹市新莊里長春街95號,,1100000,971006,1020301
187,24257493,歐金國貿有限公司,臺中市西區大同街266巷6號,,250000,971029,1020305
188,24269391,菉漾國際有限公司,彰化縣彰化市忠權里彰美路1段207巷24號1樓,,250000,971124,1020314
189,24272494,福仲生物科技股份有限公司,新北市樹林區柑園里學勤路266號6樓,,1000000,971128,1020319
190,24273022,周正股份有限公司,臺中市西區中美街626號7樓之1,,20000000,971201,1020328
191,24273830,惟伸企業有限公司,彰化縣彰化市古夷里泰和路3段26巷36號,,500000,971202,1020320
192,24275176,緻邦有限公司,新北市板橋區文化路1段319號,,500000,971204,1020304
193,24282606,芃勝工程有限公司,新北市蘆洲區忠義里長安街110號4樓,,5000000,971222,1020319
194,24284061,粉樂町國際事業有限公司,臺南市東區東寧路134巷51號1樓,,2000000,971224,1020311
195,24285998,金銘揚企業有限公司,臺中市南屯區文山里保安二街235之18號2樓,,2000000,971226,1020319
196,24288849,元丞工程有限公司,臺中市西屯區大聖街482號1樓,,3000000,980105,1020311
197,24290465,長合禮儀有限公司,新北市板橋區縣民大道1段64巷5弄3號2樓,,1000000,980108,1020304
198,24293028,巨宇騰實業有限公司,新北市三重區六張街127號,,1000000,980114,1020304
199,24296046,北金山開發實業有限公司,新北市蘆洲區中山一路42之1號,,5000000,980119,1020311
200,24316710,光融科技有限公司,臺北市內湖區內湖路1段737巷8弄3號,,1000000,971226,1020329
201,24316916,輝皇科技股份有限公司,臺北市松山區八德路3段182號3樓之10,,1000000,971229,1020307
202,24322017,台旺物業有限公司,臺北市中山區吉林路461巷14號1樓,,1000000,980123,1020312
203,24328856,永冀電子實業有限公司,新北市深坑區北深路3段153號4樓,,3000000,980305,1020329
204,24331000,綠勝國際貿易股份有限公司,臺北市士林區中山北路7段14巷36之1號,,1000000,980313,1020326
205,24345362,新凡間餐飲事業有限公司,臺北市松山區敦化南路1段7號1樓,,1000000,980511,1020326
206,24346051,信捷投資股份有限公司,臺北市信義區松德路159號11樓之1,,6000000,980513,1020319
207,24347468,和翔都市更新股份有限公司,臺北市萬華區漢中街131號9樓之3,,1000000,980519,1020305
208,24347761,策博顧問有限公司,臺北市中山區北安路476巷26號1樓,,1000000,980519,1020301
209,24349249,輝盟有限公司,臺北市大同區南京西路107巷21號,,500000,980525,1020311
210,24352124,峻強工程有限公司,新北市泰山區民生路17巷23號,,500000,980210,1020329
211,24352270,旭順貿易有限公司,桃園縣龜山鄉文化三路81巷1號7樓之6,,250000,980210,1020315
212,24355852,伸宇營造有限公司,苗栗縣頭份鎮忠孝里6鄰長安街70號4樓,,3000000,980218,1020307
213,24358035,台灣恩能發展生物技術有限公司,臺南市東區莊敬路136巷10號,,250000,980223,1020306
214,24361453,金海登有限公司,臺南市歸仁區後市里文化五街25號,,250000,980227,1020305
215,24368646,瀚統實業有限公司,臺中市潭子區得天街69巷17弄2號4樓,,2000000,980312,1020227
216,24371179,全奈米國際有限公司,新北市板橋區文化路二段327號5樓,,5000000,980317,1020312
217,24372228,巧棠企業有限公司,新北市中和區積穗里中山路2段485之2號,,5000000,980318,1020306
218,24372846,佑宇貿易有限公司,臺中市北區明德里忠明路211號8樓之3,,500000,980319,1020320
219,24373710,蔡興有限公司,彰化縣員林鎮三多里永安街143號1樓,,500000,980320,1020307
220,24380917,香榮企業股份有限公司,臺北市大同區承德路1段77之1號8樓之1,,1200000,980402,1020306
221,24381802,珍寶齋藝品有限公司,新竹縣竹東鎮中豐路三段233號,,1000000,980403,1020320
222,24384619,民錦機械有限公司,高雄市大社區三奶里新興路60號,,500000,980408,1020313
223,24385960,巧枋洗鞋有限公司,新北市汐止區康福里福德一路101之1號1樓,,1000000,980410,1020312
224,24387799,永立智慧財產有限公司,臺中市大里區大明路516號3樓之3,,800000,980414,1020312
225,24388208,翊群興業有限公司,桃園縣桃園市大林里榮華街64巷46-1號5樓,,1000000,980415,1020326
226,24392358,天心岩食品有限公司,臺南市南區中華西路一段312號,,5000000,980422,1020313
227,24397918,聯弘國際有限公司,新北市瑞芳區中山路236之1號,,500000,980430,1020325
228,24402519,潔興環保有限公司,臺中市龍井區山腳里沙田路6段東巷83號1樓,,1080000,980508,1020327
229,24402721,領亞通信有限公司,新北市板橋區黃石里北門街52-1號,,100000,980508,1020322
230,24406698,艾迪爾國際媒體有限公司,新北市中和區秀福里秀朗路3段10巷14弄62號4樓,,250000,980518,1020319
231,24410068,久暘光電科技有限公司,新竹縣竹北市縣政九路56號4樓之6,,500000,980521,1020328
232,24413038,昇立諮訊有限公司,臺中市北屯區大坑里東山路二段92-5號1樓,,250000,980526,1020327
233,24414064,鴻德傢俱有限公司,高雄市鳳山區文華里文化路10之1號4樓,,1000000,980527,1020226
234,24417506,信廣源有限公司,新北市板橋區中山路2段255巷4號1樓,,1000000,980604,1020304
