序號,統一編號,公司名稱,公司所在地,代表人,資本額,核准設立日期,核准解散日期
469,29002153,大靚有限公司,高雄市三民區光武路152號15之1樓,,500000,970821,1020227
470,29004808,昌輝科技股份有限公司,高雄市楠梓區壽民路68巷16號1樓,,5000000,971002,1020325
471,29025331,廣曜光電有限公司,高雄市苓雅區中正1路315號3樓之2,,500000,980817,1020306
472,29032776,七號音樂工作室有限公司,臺北市大安區忠孝東路3段303號4樓之7,,3000000,970529,1020311
473,29036457,安格珠寶有限公司,臺北市大安區東豐街13號1樓,,250000,970616,1020306
474,29047813,台灣星都傳播有限公司,臺北市大安區和平東路3段63號6樓,,1200000,970725,1020321
475,29054433,碩晟顧問有限公司,臺北市文山區羅斯福路5段125號4樓之1,,250000,970822,1020320
476,29054996,上迪國際有限公司,新北市中和區莒光路63號,,2200000,970825,1020314
477,29055643,捷登運動場館業有限公司,臺北市南港區興中路80巷5號3樓,,250000,970827,1020304
478,29060596,御芙蓉有限公司,臺北市南港區研究院路2段70巷33號,,250000,970919,1020307
479,29061960,新利揚裝潢工程有限公司,臺北市中山區長安東路1段63-1號2樓,,2000000,970924,1020329
480,29063019,東穎生物科技股份有限公司,,,0,970930,1020325
481,29064474,弘逸顧問有限公司,臺北市中正區忠孝西路1段7號10樓之6,,250000,971007,1020301
482,29067541,欣鑫資訊有限公司,臺北市中正區重慶南路1段63號11樓之2,,1000000,980608,1020311
483,29073706,永達雞鴨有限公司,屏東縣潮州鎮三共里文化路107號,,500000,980630,1020304
484,29076078,佳世達系統股份有限公司,臺北市內湖區基湖路18號3樓,,5000000,980709,1020328
485,29081614,金來科技有限公司,臺中市北屯區后庄里中清路１１２巷１３弄１號１樓,,500000,970424,1020308
486,29087032,康特格企業有限公司,新竹縣竹北市北崙里光明五街336–1號4樓之1,,1000000,970505,1020307
487,29092274,集英空間設計有限公司,新北市三重區田安里中山路235號(1樓),,500000,970513,1020329
488,29094955,元新興業有限公司,臺中市大里區仁化路221巷13號1樓,,1000000,970516,1020325
489,29095928,金鴻翔有限公司,新北市中和區連城路469巷72弄23號,,250000,970519,1020325
490,29099918,伯泓食品有限公司,彰化縣伸港鄉大同村福安路7之2號1樓,,1000000,970526,1020321
491,29101301,名鄉食品股份有限公司,桃園縣桃園市會稽里興二街46巷7號,,1000000,970527,1020304
492,29112237,康星貿易有限公司,臺中市沙鹿區公明里忠貞路246巷10弄7號1樓,,1000000,970616,1020315
493,29118680,畦富工程有限公司,新北市永和區秀和里林森路44巷6弄12號2樓,,1000000,970625,1020319
494,29121995,國茂電機有限公司,新北市新莊區中港路217號2樓,,5000000,970701,1020301
495,29123641,韋桀生活科技有限公司,臺南市東區自強里富農街一段199巷34號1樓,,1000000,970703,1020306
496,29135029,亞太首席科技有限公司,新北市三重區中興里重新路5段609巷20號8樓之3,,50000,990128,1020304
497,29136815,富士金生物科技有限公司,新北市土城區中央路3段137號地下1層,,500000,990208,1020321
498,29138428,智興不動產仲介經紀有限公司,新北市汐止區大同路2段221號,,1000000,990222,1020328
499,29139236,富德機械工程有限公司,新北市鶯歌區永明街77-1號7樓,,250000,990301,1020327
500,29139518,漢崴金屬有限公司,新北市雙溪區中山路48巷7號2樓,,200000,990303,1020320
501,29139876,鋐林工程有限公司,基隆市仁愛區復興街145號1號,,2000000,990304,1020301
502,29142703,嘉得建設股份有限公司,新北市新莊區和平里思源路463號4樓,,23000000,990318,1020313
503,29153222,大岡越企業有限公司,新北市土城區中華路1段166號,,600000,990430,1020327
504,29153763,岳成五金科技有限公司,新北市板橋區龍翠里雙十路2段70巷3號1樓,,1000000,990504,1020318
505,29153975,薪羽企業有限公司,新北市板橋區金門街215巷45號,,2000000,990504,1020319
506,29154144,豐佑科技有限公司,新北市土城區中央路4段410巷8號7樓,,1000000,990505,1020318
507,29156001,彼上品牌顧問有限公司,新北市新莊區思源里明中街12之9號5樓,,5000000,990514,1020322
508,29157178,朵彩國際股份有限公司,新北市三峽區八張里民族街6號,,1200000,990519,1020321
509,29157732,誠泰電子有限公司,新北市新莊區中泰里中港三街9巷2弄9號,,500000,990520,1020319
510,29158710,建旭開發股份有限公司,新北市板橋區中正路13之4號,,2000000,990526,1020319
511,29159078,星禾數位科技股份有限公司,新北市板橋區大觀路2段174巷179弄6之1號,,3000000,990527,1020301
512,29167197,鍠偉有限公司,新北市板橋區光復街192巷16弄16號1樓,,2000000,990701,1020301
513,29169060,衫力國際有限公司,臺北市大同區延平北路2段197號10樓之8,,3000000,990712,1020306
514,29173326,台灣綠像生機有限公司,新北市永和區民樂里民樂街53號5樓,,1000000,990730,1020321
515,29174015,群澤國際股份有限公司,新北市板橋區中山路2段372巷23號,,1000000,990803,1020305
516,29174107,喬峰有限公司,新北市新店區安昌里安德街116巷18號7樓,,100000,990804,1020315
517,29174232,靚盒彩妝造型有限公司,新北市板橋區南雅東路27之12號7樓,,400000,990804,1020327
518,29174943,昇厚科技有限公司,新北市林口區民享路183號,,2100000,990806,1020308
519,29176652,眾鼎開發有限公司,新北市中和區中興街266巷18號,,3000000,990817,1020311
520,29178477,創設科技股份有限公司,新北市新店區建國路257號7樓之11,,1000000,990826,1020318
521,29184962,柏崴生技股份有限公司,臺南市新市區南科二路12號R503室,,650000,1010411,1020306
522,30840993,縣一企業有限公司,新北市永和區協和里保平路五○巷八弄一二號,,1000000,661022,1020304
523,30920383,衣格門企業有限公司,臺北市大安區復興南路1段321號A32室,,1000000,690710,1020307
524,30930045,弘誠有限公司,新北市三重區重新路五段六○九巷十二號七樓之三,,5000000,661101,1020319
525,30957986,康智股份有限公司,臺北市松山區南京東路5段230號14樓之8,,5000000,701008,1020313
526,31101171,一二電子有限公司,臺北市士林區和豐街26號1樓,,2000000,680319,1020315
527,31122817,依祥有限公司,新北市中和區連城路139巷21號,,12000000,690225,1020304
528,31125461,君祐企業有限公司,臺北市大同區承德路1段77巷15號2樓,,5000000,690407,1020318
529,31260938,昂德電器有限公司,臺北市北投區承德路7段80號2樓,,2000000,650119,1020320
530,33731463,宏禮企業股份有限公司,新北市五股區五工六路66號,,15000000,620813,1020318
531,33863941,祥興煤氣有限公司,新北市汐止區宜興街3號,,3500000,641017,1020305
532,34080869,億陵煤氣行有限公司,新北市泰山區明志路3段196巷21弄33號,,4000000,650512,1020307
533,34128815,力霸窯業股份有限公司,新北市鶯歌區二甲路41號,,22000000,651111,1020321
534,34187102,真禾企業有限公司,臺北市松山區民生東路5段252號1樓,,1000000,661210,1020325
535,34352881,健夫企業有限公司,新北市永和區民生路22巷2號1樓,,3000000,700716,1020326
536,34484068,及美實業有限公司,臺北市內湖區內湖路1段308號8樓之2,,5000000,710415,1020325
537,35161781,宏仁煤氣有限公司,新北市泰山區文程路一六號,,5000000,600226,1020320
538,35982746,仁銘大建設股份有限公司,新北市新莊區思源路593巷2號2樓,,20000000,680720,1020319
539,36014289,昇飛實業有限公司,新北市蘆洲區仁愛路三五巷一五弄一二號,,1500000,690702,1020326
540,38422698,一久工程有限公司,新北市新店區民權路四二巷一七號二樓,,1000000,711129,1020325
541,40528937,溫泉煤氣有限公司,宜蘭縣宜蘭市鄂王里城隍街24號1樓,,500000,590514,1020307
542,41609514,光益電料有限公司,宜蘭縣羅東鎮民權路二八號,,8000000,571105,1020306
543,43854344,源沛工業股份有限公司,桃園縣蘆竹鄉興隆街40巷1號,,15000000,700501,1020307
544,47297616,錦權企業有限公司,新竹市頂埔里埔頂路12號,,10000000,721123,1020315
545,47316867,震洋儀電有限公司,新北市板橋區府中路七號二樓,,3000000,740209,1020319
546,50511127,力剛機械工程有限公司,苗栗縣頭份鎮東庄里16鄰自強路201號,,20000000,690723,1020313
547,52285111,吉新凡而儀器有限公司,臺中市南區福平里復興路二段一二○之一二號,,10000000,631121,1020320
548,52651502,大宜興業有限公司,臺中市天乙街一四０巷六二號一樓,,500000,701021,1020312
549,53030910,旺家開發建設有限公司,臺南市南區大林里大林路91號2樓,,3000000,990423,1020320
550,53031039,高力森國際股份有限公司,臺中市西區公益里忠明南路259號2樓,,1000000,990426,1020322
551,53035491,沅亨國際貿易有限公司,臺中市太平區宜昌里2鄰宜昌路465巷36弄3號,,300000,990503,1020326
552,53036554,勤合科技有限公司,彰化縣員林鎮中東里浮圳路1段82號,,500000,990504,1020306
553,53042824,幸福盒子有限公司,桃園縣桃園市大德二街2巷4號,,58899,990517,1020308
554,53046960,大發不動產有限公司,新竹縣竹北市東平里文興路一段128號,,2000000,990524,1020306
555,53047320,博昶食品工業有限公司,臺中市大雅區四德里永興路2-8號1樓,,1000000,990524,1020308
556,53047356,媚麗人生國際行銷有限公司,雲林縣北港鎮華勝里30鄰民享路64號,,3000000,990524,1020329
557,53047460,坤傑興業有限公司,彰化縣員林鎮大埔里員大路二段167巷19號,,3000000,990525,1020325
558,53052771,安立妥有限公司,桃園縣龍潭鄉東興村安康新村116號1樓,,100000,990603,1020329
559,53053960,盛鑫管理顧問股份有限公司,桃園縣桃園市南門里22鄰三民路3段282號7樓,,300000,990607,1020307
560,53067471,啟益塑膠工業有限公司,臺南市仁德區土庫里大發路28號,,2000000,990702,1020308
561,53067660,震陽國際開發有限公司,嘉義縣民雄鄉大崎村大丘園18之18號1樓,,1000000,990702,1020304
562,53073163,享味食品有限公司,桃園縣平鎮市東勢里東龍街21號,,2000000,990715,1020301
563,53075042,秝辰企業有限公司,雲林縣元長鄉潭西村潭內路72-18號1樓,,3000000,990720,1020301
564,53076231,設計人資源整合行銷有限公司,高雄市鳥松區美山路77巷9之2號,,680000,990721,1020326
565,53079321,綺羅貿易有限公司,臺北市中山區雙城街28巷1號3樓之2,,200000,990728,1020318
566,53080360,慶成國際發展股份有限公司,新北市三重區中正北路71巷13號（1樓）,,1000000,990802,1020306
567,53084416,威誠環保股份有限公司,新北市三峽區中正路3段238號,,1000000,990817,1020307
568,53084859,蔓沁蘿有限公司,臺北市大安區復興南路1段219巷27號1樓,,1500000,990818,1020327
569,53086884,問鼎實業有限公司,臺北市信義區忠孝東路5段270號3樓之8,,150000,990825,1020304
570,53089947,晶點企業有限公司,臺北市士林區福港街107巷17號2樓,,250000,990907,1020321
571,53090022,宏強管理顧問有限公司,臺北市大同區承德路1段44號8樓,,500000,990907,1020304
572,53090888,凡登股份有限公司,臺北市中山區明水路575號地下1層之2,,1000000,990909,1020306
573,53097263,濬邦實業股份有限公司,臺北市中山區長安東路2段81號3樓之1,,1000000,991001,1020306
574,53103336,朵蕾蕥精品有限公司,臺北市中山區中山北路1段105巷7號(2樓),,1000000,991025,1020328
575,53107121,晶典資訊企業有限公司,臺北市大安區信義路4段6號6樓,,250000,991109,1020328
576,53109079,富多資訊股份有限公司,臺北市信義區忠孝東路4段560號10樓之2,,200000,991116,1020312
577,53112004,又佳有限公司,臺北市中山區林森北路409號9樓之20,,1000000,991125,1020305
578,53115570,御風國際商業有限公司,臺北市大安區信義路4段6號6樓,,250000,991209,1020326
579,53117021,喜客管理顧問股份有限公司,臺北市松山區南京東路5段222號6樓,,2000000,991214,1020322
580,53117768,一大洋有限公司,臺北市中山區南京東路3段189號8樓,,5000000,991216,1020319
581,53118112,耐克森科技有限公司,臺北市信義區信義路4段391號6樓之1,,5000000,991217,1020312
582,53125900,天青科技股份有限公司,臺北市中山區民權東路3段21號3樓之2,,10000000,1000117,1020301
583,53128033,大圓整合行銷股份有限公司,臺北市松山區南京東路3段303巷5號3樓,,5000000,1000124,1020301
584,53131086,旭紳開發有限公司,彰化縣田中鎮新民里中正路199號1樓,,600000,990730,1020311
585,53132228,麒益有限公司,桃園縣楊梅市楊明里新農街553號,,1500000,990802,1020227
586,53136097,洪氏昌股份有限公司,桃園縣觀音鄉樹林村民生路83巷6號,,25000000,990810,1020321
587,53137510,邑冠股份有限公司,臺中市太平區太平里永平路3段227巷19號,,1500000,990812,1020305
588,53140579,冠賀企業有限公司,臺南市北區國姓里西門路四段28號1樓,,150000,990818,1020307
589,53141802,亮暉科技有限公司,臺中市西屯區台中港路2段122之29巷21之1號1樓,,500000,990820,1020304
590,53143153,簡訊家資訊有限公司,桃園縣八德市茄明里茄苳路91巷17號6樓,,500000,990823,1020319
591,53143560,桔槔有限公司,臺中市大里區瑞城里中興路一段26巷32號1樓,,1000000,990824,1020312
592,53144081,台灣艾科康科技有限公司,桃園縣平鎮市新榮里環南路2段185號1樓,,1000000,990825,1020319
593,53145336,早安藥品有限公司,臺南市永康區永康里中山北路97號1樓,,200000,990827,1020304
594,53150175,曜明土地開發有限公司,桃園縣桃園市莊敬里中正路1372號5樓,,1000000,990907,1020325
595,53158562,伊家數位有限公司,新北市鶯歌區二橋里21鄰鶯華新村36號(2樓),,1000000,990924,1020328
596,53159458,心靈洸洋顧問有限公司,臺中市東區富仁里富榮街63號1樓,,1000000,990927,1020311
597,53159680,蘿雅有限公司,臺中市大里區立德里立仁路224號,,500000,990927,1020325
598,53164516,環盛綠能開發有限公司,臺中市北屯區永定二街75號1樓,,600000,991006,1020308
599,53165634,銓準科技檢驗有限公司,臺南市安平區國平里育平二街17巷3弄20號1樓,,2000000,991008,1020320
600,53171501,時尚國際科技有限公司,臺南市中西區公正里民族路2段38號1樓,,500000,991020,1020313
601,53176409,向野茶業有限公司,南投縣鹿谷鄉彰雅村凍頂巷10-2號1樓,,1500000,991029,1020311
602,53176457,后場中藥事業股份有限公司,雲林縣斗六市工業路89號,,10000000,991029,1020314
603,53177505,辰潾美妝有限公司,高雄市鳳山區文山里文澄街1巷12號4樓,,1000000,991102,1020314
604,53178618,強榮工程有限公司,新竹市福林里東大路二段175-1號2樓,,1000000,991104,1020319
605,53181634,新店堡不動產股份有限公司,新北市新店區寶橋路134號,,1000000,990923,1020301
606,53185596,利威興業有限公司,新北市新店區五峰里大新街7巷25弄5號4樓,,2000000,991013,1020312
607,53189312,峻侯建設有限公司,新北市永和區後溪里永和路2段147號6樓之2,,10000000,991029,1020320
608,53193202,橙豐電子有限公司,新北市永和區中正路702巷17弄6號,,1500000,991119,1020314
609,53193499,睿康資訊有限公司,新北市汐止區忠孝東路459號3樓,,1000000,991122,1020328
610,53193603,群創商業有限公司,新北市板橋區後埔里實踐路30號5樓,,1000000,991122,1020311
611,53197376,吉立成企業有限公司,新北市板橋區文翠里文化路2段516號7樓,,3000000,991208,1020322
612,53197468,麗安生物科技有限公司,新北市板橋區文化路1段290號,,1000000,991208,1020320
613,53198993,威力生科技有限公司,新北市新莊區雙鳳里雙鳳路121號8樓,,5000000,991216,1020319
614,53202173,創藝玩紙有限公司,新北市蘆洲區中山一路120巷15號1樓,,30000,1000103,1020304
615,53202531,全西園文化事業有限公司,新北市新莊區中港路138巷3號,,250000,1000104,1020314
616,53206939,豪茗茶業有限公司,新北市汐止區大同路2段659號3樓之1,,1000000,1000124,1020311
617,53207727,新安人本事業有限公司,臺中市北屯區文心路4段696號16樓之1,,1000000,1000127,1020321
618,53212405,元禎開發實業有限公司,新北市土城區中央路1段96巷19號9樓,,3000000,1000301,1020313
619,53212496,祐嘉貿易有限公司,新北市三峽區龍學里20鄰學勤路198之1號12樓,,500000,1000302,1020327
620,53213050,貿得國際有限公司,新北市新莊區中正路508巷5弄10號2樓,,1000000,1000303,1020320
621,53213586,墾丁樂活股份有限公司,新北市新店區環河路182號5樓,,200000,1000307,1020321
622,53219483,青鳶美學傢俬有限公司,新北市八里區頂罟里博物館路203號,,200000,1000330,1020318
623,53223064,康寶東光科技有限公司,新北市蘆洲區鷺江里9鄰信義路361巷5號3樓,,500000,1000415,1020304
624,53223070,法諾室內裝修設計有限公司,新北市板橋區中山路1段273號（2樓),,1000000,1000415,1020308
625,53225540,懋竹企業有限公司,新北市永和區保生路22巷19弄38號11樓,,600000,1000426,1020304
626,53229460,陽基眼鏡有限公司,高雄市美濃區中正路一段40號2樓,,250000,991214,1020318
627,53233133,禧元堂康健有限公司,高雄市前金區新田路326號1、2樓,,1000000,1000118,1020306
628,53235511,翊群國際貿易有限公司,高雄市大寮區裕民街37號,,500000,1000216,1020227
629,53237665,中海物業管理顧問有限公司,高雄市三民區同盟二路51號10樓,,20000,1000308,1020320
630,53238025,箱根國際精品有限公司,高雄市鳳山區鳳頂路555號,,1000000,1000309,1020319
631,53240943,彩憶國際貿易有限公司,高雄市左營區文府路51號1樓,,10000000,1000401,1020320
632,53242920,巴洛克國際美食股份有限公司,高雄市鼓山區青海路191號1~2樓、193號1~2樓,,5000000,1000421,1020306
633,53245594,碩和有限公司,高雄市三民區鼎山街355號2樓,,2000000,1000505,1020227
634,53247925,成馬車業有限公司,高雄市三民區河北二路90號1樓,,300000,1000525,1020227
635,53249563,上奇國際水產有限公司,高雄市鳳山區過雄街27巷2號,,1500000,1000610,1020319
636,53251997,台灣碼朵有限公司,高雄市鼓山區博愛二路343號5樓之1,,300000,1000701,1020318
637,53252222,金家利企業有限公司,高雄市前鎮區復興三路391號1樓,,5000000,1000704,1020322
638,53255608,雅尚國際美容生技有限公司,高雄市左營區文萊路306號,,3000000,1000803,1020312
639,53259858,禾雅國際股份有限公司,臺北市中山區中山北路2段128巷6弄5號3樓之5,,10000000,991108,1020313
640,53267689,廣國際有限公司,臺中市北屯區進化北路16號1樓,,1000000,991124,1020320
641,53271229,品勝生物科技有限公司,彰化縣和美鎮月眉里和厝路一段382巷70弄16號1樓,,250000,991201,1020312
642,53277259,捷盛五金有限公司,彰化縣大村鄉平和村聖瑤東路12巷10號,,2000000,991214,1020329
643,53277928,豐澤園藝企業有限公司,彰化縣埔鹽鄉豐澤村埔打路50號,,500000,991215,1020321
644,53293151,允富不動產有限公司,臺中市西區自立街117之1號2樓,,3000000,1000117,1020305
645,53295088,品味餐飲有限公司,新竹市頂竹里7鄰東南街55號1樓,,2000000,1000119,1020304
646,53295171,亮言實業有限公司,臺中市東區樂成里樂業路188巷56號1樓,,2000000,1000119,1020312
647,53297142,萬齡開發工程有限公司,基隆市七堵區百福里百三街83號1樓,,500000,1000124,1020312
648,53299036,得利好有限公司,臺中市豐原區北陽里豐東路220巷65號1樓,,500000,1000126,1020313
649,53305038,鑫致盈實業有限公司,臺南市仁德區太子路86巷9弄1號,,1000000,1000217,1020328
650,53307330,大衛健康有限公司,屏東縣長治鄉長興村中興路112巷41號1樓,,500000,1000222,1020305
651,53309766,陸客秀股份有限公司,,,0,1000128,1020322
652,53315036,旭為股份有限公司,臺北市大安區辛亥路2段121號,,2000000,1000225,1020308
653,53319477,史丹威爾國際股份有限公司,臺北市松山區南京東路3段346-5號10樓,,1000000,1000314,1020308
654,53320684,長億投資有限公司,臺北市中正區重慶南路1段99號8樓之10,,7200000,1000317,1020318
655,53327271,崴爾斯國際有限公司,臺北市中正區金門街24巷2-1號1樓,,1000000,1000408,1020314
656,53328882,薏斯庭有限公司,臺北市士林區忠誠路2段118巷16號,,1000000,1000413,1020308
657,53329236,台灣禮物國際有限公司,臺北市萬華區漢中街48號,,100000,1000413,1020313
658,53330260,牛頓國際科技有限公司,臺北市北投區中央南路1段93號,,200000,1000418,1020306
659,53332990,凱偲有限公司,新北市淡水區民權路25號6樓之12,,2500000,1000425,1020307
660,53335407,新希望顧問有限公司,臺北市中正區衡陽路51號12樓之1,,25000000,1000503,1020321
661,53336519,豐洋公關顧問有限公司,臺北市松山區南京東路4段130號10樓,,2000000,1000506,1020301
662,53340984,薇健康概念館有限公司,臺北市中山區明水路575號地下1層之5,,1000000,1000524,1020307
663,53346191,夏朵國際貿易有限公司,臺北市中山區松江路32之1號7樓,,500000,1000607,1020312
664,53346636,金樂毅企業有限公司,臺北市中山區中山北路3段28號10樓,,500000,1000608,1020318
665,53347184,喬媒廣告有限公司,臺北市松山區八德路3段200號8樓之2,,1000000,1000609,1020313
666,53349015,威勢行銷股份有限公司,臺北市信義區松平路75號,,4000000,1000615,1020321
667,24515871,賢錦科技有限公司,高雄市三民區大興街90號7樓之1,,500000,990603,1020322
668,24515979,立聖齒技有限公司,高雄市三民區鼎中路46號7樓之3,,250000,990607,1020312
669,24518976,名洋工業有限公司,高雄市前鎮區南衙路106巷55號,,5000000,990713,1020301
670,24519187,林瑪莉有限公司,高雄市鹽埕區七賢3路47號1樓,,250000,990715,1020307
671,24520240,卓登國際企業有限公司,高雄市小港區宏泰街80巷20號,,5000000,990729,1020312
672,24522155,一通有限公司,高雄市左營區裕誠路429號8樓,,300000,990825,1020314
673,24523823,亦達國際有限公司,高雄市鼓山區美術東2路96號9樓之1,,500000,990915,1020320
674,25000604,華君科技有限公司,臺中市西屯區福和里福安十一街32號2樓,,360000,980724,1020322
675,25003497,多普聯有限公司,新北市汐止區秀山路5巷2弄14號,,200000,980729,1020311
676,25005214,正統欣業有限公司,臺中市北區賴厝里山西路1段55之1號,,1000000,980731,1020328
677,25015917,豐能文化有限公司,新北市中和區連城路127巷7之1號2樓,,3000000,980819,1020325
678,25016444,暘丞有限公司,高雄市大寮區中庄里承德街7號1樓,,500000,980819,1020312
679,25018105,崎斯企業有限公司,新北市板橋區大智街10號1樓,,250000,980821,1020307
680,25018344,巨強科技有限公司,臺中市西屯區市政北一路77號13樓之14,,1500000,980821,1020315
681,25018702,華陽投資顧問有限公司,苗栗縣後龍鎮中龍里176號,,20000,980824,1020301
682,25019569,威卡貿易有限公司,高雄市仁武區八卦里八德西路350巷22號1樓,,500000,980825,1020315
683,25024346,葆捷工程有限公司,新北市三重區永安北路2段5巷23號1樓,,1000000,980901,1020301
684,25024958,禾森建設股份有限公司,臺中市西區東興路3段152號4樓,,3000000,980902,1020301
685,25028666,寶珍味食品有限公司,彰化縣鹿港鎮中興里民族路190號,,500000,980909,1020326
686,25031418,宗信紙品興業有限公司,臺中市潭子區家興里榮興街57巷16號8樓之1,,250000,980914,1020320
687,25034219,康泰和企業有限公司,臺南市中西區公正里中山路90號10樓之16,,300000,980918,1020313
688,25037807,協沛有限公司,新北市新店區安祥路135號5樓,,1000000,980925,1020320
689,25044552,酷樂電子遊戲場有限公司,桃園縣桃園市東埔里2鄰中正路466號,,500000,981006,1020328
690,25045898,緯創生物科技有限公司,桃園縣大園鄉大園村忠孝一街54號1樓,,250000,981007,1020326
691,25046475,億鼎工業有限公司,彰化縣永靖鄉五汴村中山路3段118號,,1000000,981008,1020328
692,25046762,強棒電子遊戲場業有限公司,桃園縣八德市瑞祥里興豐路770號,,500000,981008,1020328
693,25054208,佑潔工業有限公司,彰化縣員林鎮三條里員東路2段215號,,500000,981020,1020227
694,25055277,吉雅實業有限公司,桃園縣八德市大昌里介壽路2段252巷15弄8衖14號,,300000,981022,1020304
695,25056536,匯鑫數位資訊有限公司,高雄市岡山區碧紅里平和東街27號1樓,,1000000,981023,1020322
696,25069151,長德汽車股份有限公司,宜蘭縣五結鄉福興村光榮北路101號,,24800000,981116,1020307
697,25069602,達新微電子股份有限公司,苗栗縣竹南鎮公義里11鄰科義街1號1樓,,80000000,981116,1020318
698,25072992,星盛光電股份有限公司,新竹市中央路148號2樓,謝時化,65991700,981120,1020306
699,25077265,晶錡半導體有限公司,新北市新莊區民安西路212巷3弄16號1樓,,1000000,981127,1020306
700,25077672,利得國際事業有限公司,新北市板橋區聚安里大觀路2段174巷179弄3號,,200000,981127,1020307
701,25081227,詠聯通科技有限公司,新北市林口區中山路49之1號,,500000,981203,1020328
