序號,統一編號,公司名稱,公司所在地,代表人,資本額,核准設立日期,核准解散日期
702,25085791,兆夆精密有限公司,臺中市梧棲區草湳里梧南路132-30號,,250000,981210,1020306
703,25085976,靖業實業有限公司,臺中市西屯區福科路805號1樓,,1500000,981210,1020312
704,25086715,畯田有限公司,新北市板橋區府後街1巷12號2樓,,10000000,981211,1020326
705,25087643,嵩創實業有限公司,桃園縣龜山鄉山頂村11鄰明興街37號,,2500000,981214,1020306
706,25088093,凌宏科技股份有限公司,新竹市自由路67號7樓之1,,50000,981215,1020305
707,25088241,超積科技股份有限公司,新竹市自由路67號7樓之1,,50000,981215,1020305
708,25088262,凌奇科技股份有限公司,新竹市自由路67號7樓之1,,50000,981215,1020305
709,25088299,鴻泰環保清潔有限公司,新北市鶯歌區鳳福里鳳吉五街1號4樓,,300000,981215,1020328
710,25088333,越積科技股份有限公司,新竹市自由路67號7樓之1,,50000,981215,1020305
711,25088994,越宏科技股份有限公司,新竹市自由路67號7樓之1,,50000,981216,1020305
712,25090675,越奇科技股份有限公司,新竹市自由路67號7樓之1,,50000,981217,1020305
713,25096018,寶生國際實業股份有限公司,臺中市西區公益路161號4樓之5,,100000,981225,1020305
714,25097662,夏米國際有限公司,桃園縣桃園市慈德街128號3樓,,5000000,981228,1020313
715,25100337,九榮昌企業有限公司,臺北市士林區大南路372號1樓,,1000000,990129,1020320
716,25104066,吉得堡國際有限公司,臺北市中山區民權東路3段60巷9號7樓,,1000000,990210,1020327
717,25107606,鉅科生技有限公司,臺北市中山區松江路67號7樓之2,,500000,990304,1020306
718,25109082,上達下學教育創新有限公司,新北市新店區安祥路110巷24號3樓,,500000,990309,1020304
719,25109169,逍遙林投資有限公司,臺北市中正區開封街1段37號6樓,,1000000,990311,1020312
720,25109718,相安投資有限公司,新北市林口區文化二路1段575號17樓之3,,5000000,990311,1020318
721,25111030,百聯健康事業股份有限公司,臺北市松山區光復南路6巷13號,,500000,990316,1020304
722,25111290,逍遙林文創科技股份有限公司,臺北市中正區開封街1段37號6樓,,1000000,990318,1020311
723,25115303,正旺興業有限公司,臺北市中山區南京東路3段29號7樓,,250000,990329,1020321
724,25116979,精策教育有限公司,臺北市萬華區艋舺大道394號2樓,,300000,990402,1020319
725,25122711,大眾環保清潔有限公司,臺北市內湖區康樂街30號,,200000,990422,1020326
726,25123036,樂樂樂有限公司,臺北市大安區光復南路634號3樓,,3000000,990423,1020325
727,25123872,晨光不動產有限公司,臺北市大安區金山南路2段147號,,2000000,990426,1020322
728,25124133,易捷國際有限公司,臺北市中正區中華路1段47號2樓,,1000000,990429,1020322
729,25131633,尼莫星球有限公司,臺北市大安區光復南路290巷53號,,1000000,990521,1020312
730,25134441,嘉德孚國際股份有限公司,臺北市大安區羅斯福路2段91號23樓之2,,3000000,990603,1020306
731,25139558,豐聖華有限公司,臺北市大安區四維路6巷36號,,1000000,990621,1020326
732,25140491,新聞線上公關顧問有限公司,臺北市信義區忠孝東路5段1之7號11樓,,200000,990623,1020308
733,25143743,魔數創智科技有限公司,臺北市大安區敦化南路1段192號5樓之8,,500000,990705,1020328
734,25144378,朝隆興業有限公司,臺北市中正區中山北路1段2號10樓,,100000,990707,1020320
735,25146925,采社有限公司,臺北市信義區逸仙路50巷20號3樓,,1000000,990715,1020319
736,25155064,亞相企業有限公司,臺南市永康區西橋里中華路827-3號2樓,,1000000,990112,1020327
737,25156562,典鼎科技有限公司,臺中市太平區中興里中興路128巷16號,,2000000,990114,1020329
738,25173422,優的國際開發有限公司,桃園縣中壢市興南里新生路182號1樓,,3000000,990226,1020308
739,25173513,愛立得生活科技有限公司,桃園縣八德市大和里銀和街71巷1號9樓之1,,1000000,990301,1020318
740,25178778,龍壕建設有限公司,桃園縣中壢市忠孝里文化路302號,,2000000,990312,1020328
741,25181936,觀視音國際行銷股份有限公司,臺中市西區忠明里中興街229號4樓,,650000,990318,1020306
742,25182512,弘晉機電工程有限公司,高雄市林園區港嘴里港埔三路162巷87號1樓,,800000,990319,1020304
743,25183553,陸佳壹有限公司,桃園縣中壢市過嶺里民族路5段2號2樓,,1300000,990322,1020304
744,25190436,傑鎂資訊有限公司,桃園縣平鎮市廣興里民族路105號2樓,,1000000,990402,1020305
745,25191435,群馥資訊有限公司,苗栗縣竹南鎮正南里和平街43-5號1樓,,1000000,990406,1020319
746,25191786,玉佰禾有限公司,南投縣南投市中興路791巷20號1樓,,1000000,990406,1020311
747,25193264,龍富有限公司,桃園縣平鎮市金陵里環南路3段201號2樓,,5000000,990408,1020301
748,25194279,頂赫工程有限公司,基隆市安樂區基金一路135巷5弄9號,,1500000,990412,1020304
749,25194502,惠豐全球生技有限公司,彰化縣彰化市國聖里中山路三段838號1樓,,100000,990412,1020322
750,25194926,久紅企業有限公司,屏東縣屏東市潭漧里潭漧16-1號1樓,,8300000,990413,1020307
751,25195100,國証工程有限公司,桃園縣桃園市大有路152號12樓之12,,1000000,990413,1020301
752,25196804,雨香有限公司,嘉義市東區後湖里保健街8號1樓,,500000,990415,1020313
753,25198090,億傑工程顧問有限公司,彰化縣彰化市茄南里茄南街24號1樓,,1000000,990419,1020319
754,27021416,宇昌企業有限公司,臺北市信義區基隆路1段155號13樓之6,,1000000,590216,1020305
755,27203582,永典事業國際有限公司,高雄市三民區安發里延吉街26號,,2000000,930826,1020318
756,27204978,介順有限公司,高雄市苓雅區苓東里苓中路6號1樓,,1000000,930914,1020321
757,27208019,東春食品有限公司,高雄市前鎮區明正里明道路91號1樓,,500000,931018,1020328
758,27209489,維生好實業有限公司,高雄市仁武區赤山里赤貴街60號1樓,,2000000,931103,1020308
759,27212386,御國企業有限公司,高雄市三民區明誠一路583號4樓,,500000,931207,1020307
760,27218831,森羅科技實業有限公司,高雄市前金區中正4路103號7樓之7,,1000000,940224,1020307
761,27222103,照洋企業有限公司,高雄市左營區至真路182號,,3000000,940329,1020308
762,27272449,聖樺投資有限公司,新竹縣竹北市斗崙里8鄰光明十街26巷3號1樓,,3000000,930422,1020321
763,27273382,婷婷舞蹈戲劇服裝有限公司,桃園縣桃園市縣府路二三六號,,1000000,930423,1020304
764,27274690,華力欣國際有限公司,臺中市北區太原路3段78-9號1樓,,5000000,930426,1020315
765,27280861,博?企業有限公司,新北市三重區仁政街70巷24號4樓,,1000000,930430,1020319
766,27308328,世茂工程有限公司,新北市新莊區新莊路54號,,5000000,930607,1020318
767,27309776,上佑實業有限公司,新北市板橋區館前東路八︱二號三樓,,5000000,930608,1020308
768,27330145,雅格詩有限公司,臺北市中山區松江路206號8樓之1,,1000000,930614,1020308
769,27332002,博帝行銷顧問服務有限公司,臺北市中正區愛國西路9號5樓之15,,1000000,930618,1020304
770,27337323,安華爾有限公司,臺北市中山區松江路8號8樓之10,,1000000,930705,1020326
771,27352230,水旺有限公司,臺北市中山區中山北路3段23之2號1，2樓,,500000,930813,1020311
772,27367418,信義壹零壹不動產仲介經紀有限公司,臺北市信義區莊敬路358號1樓,,2500000,931001,1020308
773,27377366,大業人力資源有限公司,花蓮縣吉安鄉北昌村建昌路一五六號,,1000000,930616,1020304
774,27389004,黑網子國際有限公司,新北市三重區重陽路1段53號8樓,,1000000,930701,1020311
775,27389026,三普貿易有限公司,嘉義市西區南京路１５巷１１３號１樓,,5000000,930701,1020328
776,27396309,宏偉精密有限公司,桃園縣桃園市春日路一七七五巷七五弄一三號,,5000000,930712,1020322
777,27411104,康協成企業有限公司,高雄市橋頭區仕豐里仕豐路176號1樓,,5000000,930729,1020301
778,27416425,尚聯國際有限公司,臺中市大里區仁化里善化路一六六巷廿七號一樓,,1000000,930805,1020325
779,27427767,佳辰國際開發有限公司,花蓮縣花蓮市國富里16鄰國富十街136號2樓之7,,1000000,930819,1020306
780,27429097,久易科技股份有限公司,新竹市東山街79巷4號5樓,,10000000,930820,1020312
781,27432044,喬新科技實業有限公司,彰化縣花壇鄉中庄村內厝街二五０號一樓,,500000,930826,1020311
782,27445673,桀昇有限公司,新北市三芝區長勤街42號1樓,,1000000,930915,1020308
783,27454790,睿瑩實業有限公司,彰化縣彰化市富貴里永華街五七號,,1000000,930929,1020312
784,27458249,品瑞生技有限公司,新北市新莊區福壽街九一號三樓,,1000000,931004,1020314
785,27473446,桑傑國際有限公司,臺中市清水區橋頭里中華路413號3樓,,8000000,931021,1020308
786,27487856,言瑞科技有限公司,臺南市永康區東橋里中正路279巷21弄65號,,6000000,931110,1020312
787,27490304,悠克清潔有限公司,新北市新店區安祥路一三五號五樓,,1000000,931115,1020320
788,27490613,佶滿有限公司,桃園縣桃園市豐林里三民路三段四九０號三樓,,500000,931115,1020329
789,27500437,怡源實業有限公司,新竹市光田里經國路一段八三八巷二弄八號二樓,,500000,931126,1020326
790,27501359,冠岩企業有限公司,新竹市香山區頂福里中山路640巷92號4樓,,2000000,931129,1020313
791,27514278,尊盈食品有限公司,桃園縣蘆竹鄉南榮村中正路255號,,500000,931209,1020311
792,27518859,行易科技有限公司,臺中市西屯區何安里四川路十九號一樓,,5000000,931221,1020328
793,27525275,耐爾頓科技股份有限公司,臺北市大安區仁愛路4段151巷18號2樓之1,,6000000,931022,1020329
794,27537574,常騰科技股份有限公司,新北市土城區頂新里中央路4段279巷27號9樓,,5000000,931129,1020318
795,27548586,皇家創意行銷有限公司,臺北市中山區南京東路1段25號9樓,,1000000,931230,1020307
796,27555024,錦伊芳實業有限公司,臺北市松山區復興北路333號7樓之5,,6000000,940120,1020301
797,27568219,紅花景觀設計有限公司,臺北市內湖區新明路326號,,1000000,940310,1020329
798,27570502,大云工業有限公司,臺北市松山區南京東路2段137號14樓,,2000000,940316,1020312
799,27579834,日浩股份有限公司,新北市三重區大同南路153號2樓,,10000000,940408,1020319
800,27587779,昱碩電子科技有限公司,桃園縣大園鄉埔心村埔心九四︱五○號,,1000000,931231,1020318
801,27587905,金東峰企業有限公司,苗栗縣卓蘭鎮內灣里東盛1號1樓,,500000,931231,1020306
802,27588637,全國標準不動產仲介經紀股份有限公司,桃園縣中壢市中原里中華路一段三○四號一樓,,4000000,931231,1020320
803,27605559,立通國際有限公司,新北市三重區重新路4段206號4樓之3,,1000000,940125,1020311
804,27605811,華益精密實業有限公司,新北市樹林區三龍街144號,,3000000,940125,1020308
805,27615825,進欣興工業有限公司,臺中市豐原區成功路447號1樓,,28500000,940204,1020301
806,27646165,奇聖科技有限公司,雲林縣斗六市榴中里河南街３３巷１０號１樓,,1000000,940323,1020321
807,27651407,豪有利興業有限公司,高雄市鳳山區文德里青年路2段400巷2弄10號3樓,,2000000,940328,1020306
808,27652497,揚川建設有限公司,南投縣南投市平和里民族路３５號１樓,,1000000,940329,1020304
809,27654066,上沅平價事業有限公司,高雄市鳳山區埤頂里埤頂街200號,,3000000,940330,1020227
810,27662951,頂客斯有限公司,新竹縣竹北市斗崙里福興路９０９號,,500000,940408,1020319
811,27684272,錞瑩有限公司,高雄市苓雅區中正1路120號6樓之2,,3000000,940627,1020301
812,27725750,大灣不動產仲介股份有限公司,,,0,940512,1020320
813,27740491,瑋瑄實業有限公司,臺北市松山區健康路228號2樓,,3000000,940623,1020314
814,27744736,乾象有限公司,臺北市大同區西寧北路92號2樓,,26000000,940704,1020322
815,27759913,致霖實業有限公司,臺北市大同區延平北路2段100號,,3000000,940817,1020319
816,27767821,天浪一有限公司,臺北市大安區信義路4段339號6樓,,6000000,940908,1020321
817,27768027,喬陞國際有限公司,新北市新店區達觀路8巷2號16樓之5,,1000000,940909,1020314
818,27783337,台品精密有限公司,臺中市西屯區福安五街25巷23號1樓,,6000000,940509,1020304
819,27786165,大慶汽車百貨有限公司,宜蘭縣宜蘭市孝廉里力行街1巷30號1樓,,7400000,940511,1020314
820,27793659,文仁有限公司,桃園縣龜山鄉幸福村幸福十三街１７號４樓,,500000,940519,1020325
821,27797521,安盈建設有限公司,臺南市中西區武聖路４５巷１６號１樓,,3000000,940524,1020322
822,27808554,科達國際股份有限公司,新北市板橋區文化路1段147號3樓之2,,16800000,940606,1020306
823,27814232,捷舜國際股份有限公司,新北市樹林區俊英街248巷6號,,300000,940610,1020315
824,27819980,微碩自動化股份有限公司,新北市新莊區中華路１段８號１０樓,,5000000,940617,1020318
825,27829946,世召實業有限公司,高雄市鳳山區福興里五福二路100巷51弄8之3號,,2000000,940628,1020320
826,27833316,倍勁節能科技股份有限公司,桃園縣楊梅市水美里民富路１段１３６巷１１號,,10000000,940704,1020329
827,27847830,銳齊科技工程有限公司,新竹市延平路3段513之1號1樓,,6000000,940721,1020301
828,27850551,藏玉資產管理有限公司,新北市板橋區文化路2段453號12樓,,6000000,940724,1020322
829,27853451,連瑟電控股份有限公司,桃園縣楊梅市中山里中山北路一段293巷17號3樓,,2000000,940727,1020329
830,27859357,大溧群企業有限公司,嘉義縣中埔鄉金蘭村頂山門55號1樓,,5000000,940802,1020326
831,27859928,宏大申企業有限公司,高雄市大寮區昭明里鳳林一路300巷26之33號8樓,,1000000,940803,1020325
832,27861071,明利國際電子有限公司,基隆市安樂區武聖街246號,,2000000,940804,1020306
833,27871893,典藏家有限公司,桃園縣中壢市慈惠一街１３６號１樓,,500000,940818,1020301
834,27873800,三堡企業有限公司,彰化縣員林鎮三義里莒光路１３８巷２弄１號,,1000000,940819,1020320
835,27877398,永新統一紙業有限公司,臺南市東區崇成里崇明路589之10號,,7000000,940824,1020328
836,27898794,言瑞固客科技有限公司,桃園縣平鎮市金星里中豐路南勢二段９６之２號,,6000000,940922,1020307
837,27899610,鼎煜食品有限公司,彰化縣大村鄉美港村中山路一段１４３號,,1000000,940923,1020304
838,27901329,金色階梯時尚金飾有限公司,臺南市安南區安西里安和路1段185巷1弄1號3樓,,6000000,940926,1020328
839,27903950,嘉睿威整合行銷有限公司,新北市新莊區民樂街105巷14號,,6000000,940928,1020301
840,27906350,永華管理顧問股份有限公司,臺中市南屯區大墩六街46號2樓,,2000000,940930,1020308
841,27919209,榮盈國際貿易股份有限公司,桃園縣桃園市中路里中山路８１２巷１５之２號,,2000000,941017,1020318
842,27971252,威值國際有限公司,臺北市士林區文昌路169巷24號1樓,,1000000,941116,1020305
843,27973771,創意影音多媒體股份有限公司,臺北市中山區民族東路126號1樓,,3000000,941124,1020318
844,27977740,大海不動產仲介股份有限公司,,,0,941205,1020320
845,27981414,遠澤投資股份有限公司,臺北市內湖區內湖路2段114之1號1樓,,80000000,941216,1020312
846,27987493,大信商仲股份有限公司,,,0,950105,1020320
847,27995249,崇峻企業有限公司,臺北市士林區永平街45號1樓,,1000000,950206,1020328
848,27998631,連恩國際企業有限公司,新北市汐止區福德一路141巷64號,,3000000,950221,1020305
849,27999961,綵方有限公司,臺北市中正區金山南路1段108之4號1樓,,700000,950227,1020325
850,28009848,崇井資訊有限公司,臺北市萬華區西園路2段129號8樓,,1000000,950328,1020318
851,28014455,地中海開發建設有限公司,桃園縣楊梅市豐野里民生街６１號１樓,,10000000,941024,1020314
852,28021821,康博汽車零部件有限公司,臺南市東區崇明路578號,,500000,941102,1020329
853,28029041,唐芸絲路企業有限公司,臺中市北區永興街27-48號5樓,,5000000,941111,1020312
854,28033306,薇珍妮國際開發有限公司,新北市新莊區思源路38號(6樓),,1000000,941117,1020327
855,28035395,研光科技股份有限公司,高雄市鳳山區南榮路17號,,10000000,941121,1020227
856,28047224,辰峰交通器材有限公司,新北市新店區北宜路2段267巷33號2樓,,3000000,941205,1020315
857,28053822,建廣建設開發有限公司,彰化縣員林鎮仁美里林森路416號,,510000,941213,1020320
858,28058381,寶邑企業有限公司,臺中市東區東光園路３３６之６號１樓,,500000,941220,1020305
859,28065382,仟霖工程有限公司,臺中市烏日區三榮路2段29號,,5000000,941228,1020328
860,28077916,宏福電子科技有限公司,桃園縣平鎮市廣明路21巷35號1樓,,5000000,950116,1020301
861,28093182,弘翔科技工程有限公司,新竹市文華里田美三街２８號２樓,,10000000,950215,1020314
862,28124333,喬笙國際企業有限公司,臺南市東區忠孝里中華東路三段452巷8弄34號1樓,,3000000,950317,1020312
863,28126521,元朝消防安全設備有限公司,新北市板橋區僑中一街124巷18弄5-4號,,5000000,950321,1020320
864,28137793,順風興業有限公司,新北市板橋區長江路1段57之2號,,1000000,950331,1020321
865,28140571,蕙勤科技有限公司,新北市新莊區中誠街142巷3之1號,,1000000,950404,1020322
866,28142331,世匡實業有限公司,苗栗縣竹南鎮大厝里14鄰國泰路91號,,5000000,950407,1020326
867,28144295,世暘國際有限公司,臺中市西區忠明里忠誠街６８之１號１樓,,1000000,950410,1020312
868,53696942,泰翔工程有限公司,新北市板橋區重慶路308巷19號6樓之4,,200000,1010411,1020325
869,53701332,金宥能源科技有限公司,新北市中和區華安街16巷6號(1樓),,3000000,1010430,1020319
870,53703818,韶鑫有限公司,新北市新莊區思源路289號,,200000,1010511,1020326
871,53704176,鴻泰股份有限公司,新北市新店區北新路2段122號13樓之10,,5800000,1010514,1020318
872,53705626,羽漾有限公司,新北市三重區正義北路60號,,1000000,1010518,1020305
873,53711704,騰平實業有限公司,新北市汐止區大同路3段206號6樓,,1000000,1010618,1020312
874,53716911,耘誠室內設計有限公司,新北市三重區成功路73巷23之5號1樓,,200000,1010712,1020326
875,53718517,昱宏光電科技有限公司,新北市中和區民樂路15號2樓之5,,1000000,1010720,1020328
876,53724686,ㄚ鳳企業有限公司,新北市新莊區新樹路603號10樓,,250000,1010821,1020308
877,53726235,博碩人力資源有限公司,新北市蘆洲區光華路136號8樓,,5000000,1010828,1020320
878,53730287,緁品設計開發有限公司,臺北市中山區德惠街17號5樓,,1000000,1010111,1020315
879,53730863,新而安股份有限公司,臺北市信義區基隆路1段163號9樓之1,,1000000,1010113,1020314
880,53732026,松盛國際興業有限公司,臺北市大安區光復南路390號5樓,,2000000,1010118,1020313
881,53737704,蒂衣行銷有限公司,臺北市松山區八德路3段225號9樓之7,,1400000,1010216,1020322
882,53739885,大師租賃股份有限公司,,,0,1010223,1020320
883,53746226,心富有限公司,臺北市信義區松山路421號11樓之4,,1000000,1010314,1020306
884,53747674,甘丹實業有限公司,臺北市信義區松德路65號11樓之2,,5000000,1010319,1020315
885,53752182,天時餐飲有限公司,臺北市大安區忠孝東路4段98號6樓,,1000000,1010402,1020308
886,53753529,勝興實業有限公司,臺北市信義區忠孝東路5段1-10號2樓,,501000,1010406,1020321
887,53758382,富三資通股份有限公司,臺北市中山區南京西路1之1號10樓,,1500000,1010423,1020318
888,53762007,奧森股份有限公司,臺北市南港區成福路121巷27號1樓,,1200000,1010504,1020322
889,53763478,紅柿文創有限公司,臺北市中山區合江街116巷28號1樓,,2000000,1010509,1020314
890,53765200,昱崎有限公司,臺北市中正區羅斯福路4段136巷1弄3號,,3900000,1010515,1020319
891,53767122,豐研股份有限公司,臺北市信義區吳興街123號,,2500000,1010521,1020305
892,53767312,永承室內裝修有限公司,臺北市大同區民族西路76巷12弄10號1樓,,100000,1010522,1020328
893,53769310,基石國際行銷有限公司,臺北市中山區松江路237號10樓之1,,1000000,1010528,1020307
894,53769748,楓景國際顧問有限公司,臺北市士林區文林路714巷4號4樓,,5000000,1010529,1020304
895,53769775,鼎強有限公司,臺北市萬華區西寧南路36-15號1樓,,500000,1010529,1020314
896,53770082,愛瑞絲生技股份有限公司,臺北市中山區松江路28號10樓之1,,2000000,1010530,1020319
897,53771250,和雅創意設計有限公司,臺北市中正區開封街1段48號9樓之7,,100000,1010604,1020306
898,53778850,綜一企業有限公司,臺北市松山區民生東路4段75巷5弄1-1號3樓,,20000000,1010628,1020326
899,53782236,心同有限公司,苗栗縣苗栗市福麗里國華路982號,,200000,1001226,1020301
900,53782279,心全有限公司,新竹市東區東園里忠孝路281號,,200000,1001226,1020301
901,53782783,華鼎科學有限公司,屏東縣滿州鄉港口村港口路150巷39號,,100000,1001227,1020318
902,53790778,總太應用材料股份有限公司,臺中市西區自治街119號1樓,,1000000,1010113,1020314
903,53790860,取榙室內裝修有限公司,臺南市永康區龍潭里龍埔街85號10樓之9,,2000000,1010113,1020322
904,53793114,豫騰實業有限公司,臺中市西屯區上安里至善路38巷58號1樓,,5000000,1010118,1020308
905,53793439,冠竑有限公司,桃園縣蘆竹鄉南興村忠孝西路175巷22號1樓,,1000000,1010119,1020304
906,53800261,赤龍餐飲有限公司,臺中市南屯區惠中里大觀路21號,,4500000,1010213,1020328
907,53803990,索威爾艾利蒙特企業有限公司,臺中市大里區中興路2段136巷32號2樓,,1000000,1010221,1020329
908,53805511,翔勝漁業有限公司,屏東縣東港鎮朝安里新生三路188號1樓,,5000000,1010223,1020313
909,53805548,窩比幼教資訊網路股份有限公司,臺中市西屯區文心路三段241號17樓之1,,8000000,1010223,1020312
910,53810541,台化技術有限公司,雲林縣北港鎮華勝里民政路31號1樓,,1000000,1010306,1020307
911,53815285,寶樹銀國際有限公司,花蓮縣花蓮市國富里2鄰國富十街16號2樓,,10000,1010315,1020321
912,53816355,匯盛行動應用股份有限公司,桃園縣八德市介壽路二段608號,,500000,1010316,1020327
913,53816974,倉富有限公司,花蓮縣新城鄉北埔村樹林街233巷2弄23號1樓,,250000,1010319,1020306
914,53817875,意大利有限公司,臺中市東區東勢里進化路177號,,500000,1010320,1020327
915,53818115,中信資材管理顧問有限公司,臺中市北屯區松強里松竹路2段384號1樓,,300000,1010320,1020320
916,53822357,高山青視聽歌唱有限公司,臺中市中區光復路99號3樓,,300000,1010327,1020327
917,53823975,中華悅霖科技有限公司,臺南市安南區溪頂里郡安路四段278巷15弄13號1樓,,5000000,1010329,1020308
918,53824019,金詠國際古典音樂經紀有限公司,新竹縣竹北市福興一路22號15樓之1,,2000000,1010329,1020308
919,53828015,紐豪斯傢俱有限公司,桃園縣桃園市南埔里大興西路二段261號1樓,,3000000,1010405,1020314
920,53828042,第一街餐飲事業有限公司,宜蘭縣宜蘭市新興里宜興路1段338、340、342號,,1500000,1010405,1020320
921,53834017,譯斯伯活動行銷有限公司,臺中市南屯區黎明路2段71巷7號1樓,,5000000,1010417,1020322
922,53837014,品果匠企業有限公司,臺中市東勢區中嵙里東崎街東北巷32之1號3樓,,1000000,1010423,1020306
923,53837318,三禾食研股份有限公司,臺中市南屯區豐樂里永春東三路459號4樓,,500000,1010423,1020328
924,53837838,儀安科技文化有限公司,嘉義縣民雄鄉松山村松子腳11-1號,,2000000,1010424,1020308
925,53837892,佳易興業有限公司,桃園縣桃園市大業路一段334號13樓,,88888,1010424,1020307
926,53839033,德科企業有限公司,基隆市安樂區基金一路121巷2號(2樓),,500000,1010426,1020312
927,53841777,元順消防設備有限公司,臺中市大里區永隆里爽文路757號1樓,,100000,1010502,1020306
928,53842001,億順太有限公司,彰化縣員林鎮民生里永昌街51號,,600000,1010503,1020304
929,53843260,幸運抱有限公司,桃園縣桃園市莊敬里中正路1270號1樓,,10000000,1010504,1020301
930,53843509,品勝系統廚具有限公司,臺南市北區正風里公園路960號1樓,,2000000,1010504,1020304
931,53848997,君品工程顧問有限公司,臺中市北區三民路三段203號5樓之5,,50000,1010515,1020326
932,53850254,里品食品有限公司,臺中市南屯區同心里大墩五街318號1樓,,1000000,1010517,1020321
933,53850677,鍾恕精密工業有限公司,臺南市中西區康樂街225巷5號5樓之20,,100000,1010518,1020304
934,53854717,百年吳家餐飲有限公司,桃園縣中壢市東興里新興路180號7樓,,5000000,1010528,1020327
