"序號","統一編號","公司名稱","公司所在地","代表人","資本額","核准設立日期","核准解散日期"
"1626","54228307","傳承顧問有限公司","新竹縣竹北市竹義里福竹街96號2樓","","500000","1020403","1031204"
"1627","54229559","盛和機電工程有限公司","雲林縣麥寮鄉麥豐村中山路104號1樓","","5900000","1020409","1031224"
"1628","54230253","寶輝生物科技有限公司","臺中市西屯區西屯路二段63之1號1樓","","1000000","1020410","1031203"
"1629","54231345","佰億緣工程有限公司","新竹市北區臺溪里中華路二段736號8樓之6","","100000","1020412","1031204"
"1630","54234639","康柏咖啡有限公司","臺中市霧峰區福新路208號1樓","","1000000","1020417","1031223"
"1631","54235503","品弈國際事業有限公司","新竹縣竹北市東平里六家一路1段25號10樓","","10000000","0970825","1031217"
"1632","54235546","富羽得有限公司","臺中市南屯區同心里文心路一段186號18樓之10","","5000000","1020419","1031224"
"1633","54236405","慶惠精品有限公司","臺中市北屯區文昌東十一街41號1樓","","2000000","1020422","1031226"
"1634","54238895","元形有限公司","臺中市龍井區東海里藝術街16巷25號1樓","","1500000","1020425","1031226"
"1635","54240338","差派科技有限公司","桃園市楊梅區金溪里17鄰三民路2段172巷9弄1號1樓","","100000","1020429","1031222"
"1636","54241202","達成投資有限公司","臺中市西區後龍里民權路213巷2-1號2樓","","500000","1020430","1031225"
"1637","54242103","佳貝通訊有限公司","桃園市龜山區新路里中興路311號1樓","","300000","1020502","1031205"
"1638","54242737","蔻絲國際有限公司","臺中市北區淡溝里博館一街56號1樓","","600000","1020503","1031204"
"1639","54243118","富向開發建設有限公司","新竹縣湖口鄉勝利村安宅八街119號1樓","","5000000","1020506","1031227"
"1640","54243335","三碼建設有限公司","臺中市南屯區春社里永春南路61巷19號1樓","","10000000","1020506","1031204"
"1641","54252571","健昌機械有限公司","雲林縣麥寮鄉雷厝村雷厝路186之6號1樓","","5000000","1020523","1031216"
"1642","54253109","益品文化有限公司","桃園市平鎮區金華街84巷20號1樓","","500000","1020523","1031209"
"1643","54256669","時代光學眼鏡有限公司","桃園市桃園區民生里中正路112號1樓","","3000000","1020530","1031128"
"1644","54260143","文中廣告科技有限公司","桃園市桃園區文中里文中路177號1樓","","1400000","1020606","1031205"
"1645","54260853","歷士國際有限公司","桃園市桃園區新埔十街24巷16號(1樓)","","500000","1020607","1031215"
"1646","54260903","正鏹實業有限公司","桃園市蘆竹區錦興里光明路二段240號","","200000","1020607","1031231"
"1647","54261760","綠夏國際有限公司","雲林縣斗六市八德里豐興路174號1樓","","250000","1020611","1031225"
"1648","54263768","印順包裝有限公司","新竹市吉羊路201號1樓","","1000000","1020617","1031226"
"1649","54264128","祥勝創意有限公司","新竹縣竹北市泰和里新泰路35號8樓之6","","2000000","1020617","1031205"
"1650","54272703","永佳興工程有限公司","新北市新店區環河路113號","","5000000","1020527","1031224"
"1651","54273082","長沃有限公司","新北市板橋區中山路1段160之11號","","2400000","1020529","1031209"
"1652","54273338","捷斯微電子股份有限公司","新北市永和區中山路1段311號12樓(B室)","","500000","1020529","1031230"
"1653","54275960","權榮有限公司","新北市永和區永貞路79號(1樓)","","500000","1020611","1031231"
"1654","54279966","黑杰餐飲有限公司","新北市新莊區雙鳳里中正路730之3號","","500000","1020627","1031201"
"1655","54281294","陽嶸電器有限公司","新北市樹林區中山路3段261號","","500000","1020702","1031225"
"1656","54281610","龍華欣業有限公司","新北市三峽區二鬮路136巷24弄69號3樓","","250000","1020703","1031223"
"1657","54281935","琍橙有限公司","新北市板橋區青翠里民治街82巷14號","","1000000","1020704","1031227"
"1658","54283758","黃家香食品有限公司","新北市樹林區俊英街223巷24號1樓","","1000000","1020712","1031218"
"1659","54285708","瑟露宣實業有限公司","新北市板橋區大觀路3段160巷4號(1樓)","","1000000","1020722","1031222"
"1660","54288162","喬薇國際貿易有限公司","新北市板橋區仁愛里17鄰仁愛路40巷9號","","500000","1020802","1031230"
"1661","54288803","新酷奇有限公司","新北市三峽區大勇路16巷6號6樓","","100000","1020806","1031205"
"1662","54290131","宇源有限公司","新北市中和區秀朗路3段36巷14之1號","","500000","1020812","1031216"
"1663","54290815","正鮭實業有限公司","新北市汐止區樟樹里中興路74號3樓","","10000000","1020814","1031224"
"1664","54290998","宗暉工程有限公司","新北市萬里區大鵬里頂社59號之1","","1000000","1020815","1031212"
"1665","54293046","佳冠企業有限公司","新北市林口區文化三路1段367號","","1000000","1020826","1031223"
"1666","54297541","尚彗瑩有限公司","新北市土城區忠承路119號8樓","","100000","1020917","1031201"
"1667","54301469","崴丞光電有限公司","新北市林口區中正路45號","","500000","1021007","1031216"
"1668","54301691","科羅應用科技有限公司","新北市五股區成泰路3段2巷8號9樓之3","","5000000","1021007","1031215"
"1669","54304509","利和豐有限公司","新北市三重區光復路1段130巷9號(5樓)","","3000000","1021018","1031231"
"1670","54307421","育翔工程股份有限公司","新北市板橋區中山路2段415號(2樓)","","500000","1021031","1031223"
"1671","54307724","私生活國際開發股份有限公司","新北市五股區五權路7巷10號6樓","","1000000","1021101","1031217"
"1672","54309173","盈毅國際有限公司","新北市新莊區思源路353號4樓","","3000000","1021108","1031224"
"1673","54310376","華鎰資訊有限公司","新北市新店區民權路153號4樓(K室)","","500000","1021115","1031201"
"1674","54311425","巴哈文創有限公司","新北市永和區永和路2段57號7樓","","5000000","1021120","1031223"
"1675","54312091","集緻整合設計有限公司","新北市板橋區莒光里莒光路32號(1樓)","","200000","1021125","1031208"
"1676","54314838","尚盈嘉不動產有限公司","新北市新莊區五工三路88號3樓","","1000000","1021206","1031201"
"1677","54314957","上懿國際整合行銷有限公司","新北市新店區民權路12號3樓","","1000000","1021209","1031229"
"1678","54316603","億設有限公司","新北市淡水區中正東路2段87之2號24樓","","500000","1021217","1031201"
"1679","54319469","海納川資產開發股份有限公司","臺北市大同區太原路197號1樓","張煥奇","10000000","1020507","1031212"
"1680","54327572","奎源盛科技有限公司","臺北市內湖區民權東路6段189-3號","","5000000","1020531","1031223"
"1681","54332316","英德貝克有限公司","臺北市中山區長春路378號6樓","","500000","1020619","1031230"
"1682","54333589","永誠資產管理顧問股份有限公司","臺北市大安區復興南路2段236號11樓","","20000000","1020625","1031209"
"1683","54338043","松雲創意有限公司","臺北市信義區信義路4段413號10樓","","480000","1020708","1031226"
"1684","54340174","亞大東凌國際股份有限公司","臺北市松山區復興北路1號6樓之5","","10000000","1020716","1031217"
"1685","54340195","日日宏企業有限公司","臺北市松山區敦化北路303號3樓之8","","500000","1020716","1031204"
"1686","54342412","尚林堂古董藝術有限公司","臺北市大安區建國南路1段291巷14號","","250000","1020723","1031217"
"1687","54345537","崧成國際企業股份有限公司","臺北市中山區民生東路3段3號1-2樓","","32790000","1020729","1031225"
"1688","54347916","順聯國際有限公司","臺北市大安區信義路4段184號9樓","","700000","1020805","1031231"
"1689","54351404","聯意數位廣告有限公司","臺北市南港區興中路44巷22號2樓","","1000000","1020816","1031204"
"1690","54351798","凱司國際有限公司","臺北市信義區基隆路1段176號13樓","","500000","1020819","1031222"
"1691","54354731","金沙攝影造型有限公司","臺北市中山區中山北路2段26巷9號2樓","","500000","1020828","1031229"
"1692","54356098","路大科技有限公司","臺北市文山區興隆路3段304巷28號6樓之3","","3000000","1020903","1031218"
"1693","54358130","恬品投資股份有限公司","臺北市中山區民權西路11號11樓","","20000000","1020910","1031202"
"1694","54358482","新航道文教事業有限公司","臺北市松山區民生東路4段54號6樓之11","","1000000","1020911","1031216"
"1695","54358906","新洋廣告有限公司","臺北市松山區南京東路4段171號12樓之3","","2000000","1020911","1031229"
"1696","54358960","祥發廣告有限公司","臺北市松山區南京東路4段171號9樓之2","","2000000","1020912","1031229"
"1697","54365857","俊成資訊有限公司","臺北市中正區忠孝西路1段72號9樓之11","","1000000","1021007","1031210"
"1698","54367638","捷勁行銷顧問有限公司","臺北市大安區復興南路1段293號2樓之1","","100000","1021014","1031209"
"1699","54368995","碩源資訊股份有限公司","臺北市松山區八德路2段374號6樓之8","","3000000","1021017","1031231"
"1700","54386115","萬誠人力仲介有限公司","金門縣金寧鄉湖下143之4號","","5000000","1030711","1031204"
"1701","54399879","同欣蒂童裝有限公司","臺中市北屯區平興里大連路三段155號1樓","","200000","1020626","1031226"
"1702","54503726","鑫瑞有限公司","桃園市大溪區仁愛里埔頂五街21號1樓","","1000000","1020705","1031215"
"1703","54505766","尚悅建設有限公司","桃園市桃園區長德里永安路558號","","10000000","1020711","1031226"
"1704","54506081","禾惠國際股份有限公司","桃園市桃園區民光東路97號4樓","","1000000","1020712","1031227"
"1705","54506759","果容興業有限公司","桃園市龜山區光明街243巷37弄4號5樓","","500000","1020716","1031218"
"1706","54506836","富達開發藥品生技股份有限公司","彰化縣彰化市五權里金馬路三段25號","","5000000","1020716","1031205"
"1707","54508757","宇軒有限公司","桃園市中壢區仁祥里華勛街141巷10號2樓","","1000000","1020723","1031223"
"1708","54513652","渥唯客生技有限公司","新竹市東區復中里民生路170巷12號","","200000","1020808","1031223"
"1709","54514842","史瑪特國際有限公司","桃園市平鎮區建安里平東路573巷82弄7號","","2000000","1020813","1031218"
"1710","54520598","崮崴創意印刷有限公司","桃園市桃園區三民路三段288號4樓之2","","1000000","1020904","1031216"
"1711","54520871","華泰資源整合顧問有限公司","宜蘭縣羅東鎮復興路3段21巷3號","","1000000","1020905","1031218"
"1712","54521479","仕鎰國際有限公司","彰化縣竹塘鄉竹塘村仁愛街58巷18弄20號1樓","","2000000","1020909","1031204"
"1713","54523167","宏蒼精密股份有限公司","桃園市平鎮區中庸路1段129之3號","","10000000","1020913","1031128"
"1714","54525003","群發國際有限公司","彰化縣伸港鄉新港村自強路37號","","1000000","1020923","1031205"
"1715","54525186","采協有限公司","桃園市中壢區延平路90巷218弄8號1樓","","700000","1020924","1031128"
"1716","54526312","寶得聚建設有限公司","新竹縣竹北市東平里文興路二段128號3樓","","10000000","1020927","1031222"
"1717","54526636","拓實匠有限公司","新竹市成功里文昌街67號2樓","","500000","1020930","1031208"
"1718","54528108","映唐視訊有限公司","新竹市東區中正里中央路90號","","500000","1021003","1031201"
"1719","54531650","銳旗興業有限公司","桃園市新屋區槺榔村6鄰上槺榔51-6號","","1000000","1021016","1031225"
"1720","54536178","祐通國際有限公司","桃園市中壢區中華路一段644巷32號","","500000","1021031","1031229"
"1721","54536634","尚聯工程有限公司","桃園市中壢區中堅里中山東路4段39巷20號4樓之7","","200000","1021101","1031227"
"1722","54536851","奇星電子股份有限公司","臺北市內湖區陽光街345巷10號3樓","","10000000","1021104","1031225"
"1723","54537486","飛進室內設計有限公司","嘉義市竹圍里遠東街30巷2號","","500000","1021106","1031227"
"1724","54540068","宏益國際貿易有限公司","南投縣南投市福興里南崗三路145號1樓","","100000","1021114","1031218"
"1725","54541762","金偉汽車服務有限公司","嘉義市西區磚磘里大華路73號1樓","","1000000","1021120","1031202"
"1726","54545465","威盛木業有限公司","桃園市平鎮區北興里正義路121號1樓","","100000","1021129","1031209"
"1727","54548028","欣揚聲電科技股份有限公司","桃園市中壢區環西路6號1樓","","3700000","1021210","1031204"
"1728","54548239","翔鴻企業有限公司","彰化縣秀水鄉安溪村彰鹿路44號","","2000000","1021210","1031226"
"1729","54548343","台灣赫滋科技有限公司","新竹縣竹北市新社里國強街30號二樓","","1000000","1021211","1031205"
"1730","54549407","祥鶴傳播有限公司","臺南市北區北安路1段177之30號","","500000","1021209","1031229"
"1731","54552471","國際春秀美好生活有限公司","臺南市東區自強里富農街1段67號1樓","","5680000","1030129","1031212"
"1732","54553561","金嘉湋金屬有限公司","臺南市官田區二鎮里工業路6號","","5000000","1030221","1031209"
"1733","54555322","耀福科技有限公司","臺南市東區文聖里裕平路268號1樓","","250000","1030318","1031225"
"1734","54555759","芝寶福生物科技有限公司","臺南市北區文成里文賢二街160號2樓","","1000000","1030325","1031230"
"1735","54561648","宏和國際有限公司","臺南市仁德區保安里二仁路1段132號","","300000","1030624","1031209"
"1736","54562772","朝陽健康村事業有限公司","臺南市永康區六合里中華路593號1樓","","300000","1030709","1031202"
"1737","54567592","寶躍科技有限公司","臺南市東區裕聖里裕華三街86號1樓","","3000000","1030924","1031203"
"1738","54580477","佳駿生技有限公司","臺中市潭子區頭家路198號1樓","","1000000","1020709","1031210"
"1739","54584733","京臨生物科技有限公司","臺中市西屯區福林里福康路78號7樓","","500000","1020729","1031227"
"1740","54586681","台能能源開發股份有限公司","臺中市太平區新高里育才路436號","","1000000","1020808","1031128"
"1741","54587393","久業行銷有限公司","臺中市南屯區豐樂里萬安街16巷11號","","300000","1020812","1031230"
"1742","54587990","玉山實業有限公司","臺中市北屯區平德里天津路三段67號2樓","","100000","1020814","1031216"
"1743","54588061","沅洲有限公司","臺中市北屯區水景里松竹五路165號11樓之3","","500000","1020815","1031219"
"1744","54588148","雅瑪國際貿易有限公司","臺中市西區昇平里福人街118巷3號","","500000","1020815","1031225"
"1745","54591713","瓦爾哈拉有限公司","臺中市北區健行里忠明路424地下一層之2號","","150000","1020905","1031212"
"1746","54592902","綠合光有限公司","臺中市中區柳川西路三段36號5樓之2","","1000000","1020913","1031201"
"1747","54597456","品岡建築有限公司","臺中市東區興大路1號1樓","","2000000","1021014","1031204"
"1748","54598125","盛華設計有限公司","臺中市北區賴旺里文心路四段182號地下一層之1","","70000","1021017","1031201"
"1749","54599237","睿聯有限公司","臺中市烏日區仁德里信義路193巷6弄16號1樓","","2000000","1021024","1031211"
"1750","54600348","余達生技有限公司","臺中市大里區大元里中興路二段94號3樓","","1010000","1021031","1031230"
"1751","54601655","育典設計有限公司","臺中市北屯區后庄里中清路108巷10號7樓","","100000","1021106","1031223"
"1752","54604533","惠通端子有限公司","臺中市北區金龍里北屯路23號2樓","","6600000","1021122","1031219"
"1753","54605982","沅德工業有限公司","臺中市南屯區向心里永春東路357號9樓之1","","1000000","1021202","1031218"
"1754","54608088","台灣穆拉德科技管理顧問股份有限公司","臺中市北屯區平德里文昌東五街16號2樓","","10000000","1021213","1031203"
"1755","54610710","金翅有限公司","高雄市苓雅區青年一路8之5號","","2000000","1021205","1031208"
"1756","54617241","鈺軒生物科技股份有限公司","高雄市三民區博愛一路396號","","3000000","1030129","1031210"
"1757","54618852","誠邦地產有限公司","高雄市楠梓區後昌路1102號1樓","","1000000","1030219","1031212"
"1758","54619705","哲宜廣告有限公司","高雄市前鎮區佛西街60號7樓","","100000","1030225","1031205"
"1759","54623594","亞酋精密工業有限公司","高雄市岡山區岡山北路2巷41號","","5000000","1030328","1031216"
"1760","54624165","風帆蘇威國際貿易有限公司","高雄市左營區榮耀街59號1樓","","500000","1030402","1031229"
"1761","54624215","紅寶國際有限公司","高雄市仁武區赤東六街16號1樓","","600000","1030402","1031201"
"1762","54624756","立丞廣告事業有限公司","高雄市鳳山區永忠街25號2樓","","2000000","1030407","1031230"
"1763","54626728","雋晨有限公司","高雄市湖內區中山路1段234巷18弄4號1樓","","800000","1030421","1031229"
"1764","54629598","鎰耀環保有限公司","高雄市前鎮區瑞華街18號7樓","","600000","1030514","1031227"
"1765","54630477","尚祈有限公司","高雄市湖內區中正路1段296號1樓","","200000","1030521","1031204"
"1766","54632046","暄辰生命科技有限公司","高雄市苓雅區光華一路232號9樓","","1000000","1030605","1031202"
"1767","54632904","庄泰企業有限公司","高雄市林園區東林里福興街16號","","2000000","0840712","1031226"
"1768","54633798","四方緣國際有限公司","高雄市左營區德威街90號1樓","","280000","1030623","1031229"
"1769","54638111","友安建設開發有限公司","高雄市前鎮區一心二路136巷1之2號4樓","","500000","1030729","1031226"
"1770","54638626","祥登股份有限公司","高雄市前鎮區中山二路2號10樓之6","","200000","1030804","1031216"
"1771","54640307","日興繁榮發展股份有限公司","臺北市大安區信義路4段281號8樓","","1000000","1021022","1031204"
"1772","54640995","麗紳餐飲實業有限公司","臺北市大安區復興南路1段348號地下室","","1000000","1021023","1031218"
"1773","54642781","騰昌國際有限公司","臺北市松山區八德路4段465號7樓","","100000","1021030","1031229"
"1774","54646750","弘群國際開發股份有限公司","臺北市中山區松江路158號7樓之5","","1000000","1021108","1031231"
"1775","54646787","天馬飛翔創意有限公司","臺北市內湖區瑞光路607號4樓","","300000","1021108","1031218"
"1776","54646822","科晶綠能有限公司","臺北市松山區民生東路5段184號11樓之3","","1000000","1021108","1031231"
"1777","54647293","全球菁英股份有限公司","臺北市北投區奇岩路12號3樓","","7000000","1021112","1031227"
"1778","54649052","風華國際行銷股份有限公司","臺北市大安區信義路2段72號地下","","1000000","1021115","1031225"
"1779","54649412","松旅行銷管理顧問股份有限公司","臺北市大安區忠孝東路4段221號12樓","","1000000","1021119","1031230"
"1780","54650276","一案視覺觀廣告有限公司","新北市中和區景新街132巷6號9樓","","1000000","1021120","1031209"
"1781","54653843","睿豐行銷股份有限公司","臺北市大安區忠孝東路4段221號12樓","","3000000","1021129","1031204"
"1782","54653885","光彩生物科技有限公司","臺北市松山區復興南路1段63號7樓之2","","500000","1021202","1031229"
"1783","54654955","名臻水果企業有限公司","臺北市萬華區中華路1段132號","","200000","1021204","1031203"
"1784","54656784","亞詒有限公司","臺北市中山區南京東路2段76號4樓","","500000","1021210","1031215"
"1785","54656898","仕鋒科技有限公司","臺北市中山區民權東路2段148號3樓","","1000000","1021210","1031209"
"1786","54657502","政泰管理顧問股份有限公司","臺北市大安區和平東路3段308巷15弄41號1樓","","3000000","1021212","1031204"
"1787","54657995","斯緹利亞貿易有限公司","臺北市萬華區和平西路3段396號","","200000","1021213","1031229"
"1788","54658538","富寶興業有限公司","臺北市大安區和平東路2段96巷51號1樓","","6000000","1021216","1031223"
"1789","54659261","北海資產管理有限公司","臺北市信義區忠孝東路5段552號9樓","","600000","1021218","1031223"
"1790","54659895","上又舜有限公司","臺北市內湖區內湖路1段359巷5號3樓","","5000000","1021219","1031208"
"1791","54660099","庫鰈鶶有限公司","臺北市信義區忠孝東路5段1之6號10樓","","900000","1021220","1031231"
"1792","54662174","康堡國際有限公司","臺北市信義區仁愛路4段520號8樓","","2500000","1021226","1031229"
"1793","54663379","展聯商務有限公司","臺北市大同區環河北路2段115號4樓","","100000","1021231","1031219"
"1794","54665382","台灣硝子王科技股份有限公司","臺北市信義區忠孝東路5段552號9樓","","1500000","1030108","1031231"
"1795","54667305","羊羊四合院有限公司","臺北市大同區迪化街2段146巷22號4樓","","200000","1030115","1031227"
"1796","54667620","振晟國際有限公司","臺北市大安區忠孝東路4段220號13樓","","2000000","1030116","1031218"
"1797","54668661","沛音生物科技有限公司","臺北市中正區館前路65號11樓","","200000","1030120","1031216"
"1798","54668732","伍拾有限公司","臺北市中山區長安東路2段81號12樓之1","","40000","1030120","1031212"
"1799","54672291","台灣幸運堡投資有限公司","臺北市中正區和平西路1段84號3樓","","1000000","1030205","1031211"
"1800","54675494","通聖有限公司","臺北市士林區天母東路105巷35號3樓之1","","1000000","1030219","1031211"
"1801","54676016","進益實業有限公司","臺北市中山區松江路283號5樓","","500000","1030220","1031229"
"1802","54676212","錏錮國際行銷有限公司","臺北市大安區泰順街50巷16號1樓","","950000","1030220","1031226"
"1803","54676557","傑升國際有限公司","臺北市信義區永吉路30巷157弄18號1樓","","500000","1030224","1031227"
"1804","54677063","勝田餐飲企業有限公司","臺北市大安區忠孝東路4段177號2樓之2","","1000000","1030225","1031229"
"1805","54679870","極高頻演藝經紀工作室有限公司","臺北市南港區忠孝東路7段575號2樓","","50000","1030306","1031202"
"1806","54680314","台灣浩德能源股份有限公司","臺北市信義區松智路1段11樓","","10000000","1030307","1031231"
"1807","54680356","銘琪科技有限公司","臺北市信義區莊敬路178巷1號3樓之2","","200000","1030306","1031216"
"1808","54683966","台灣關愛和平企業有限公司","臺北市大安區敦化南路2段207號16樓","","1500000","1030319","1031208"
"1809","54685042","琪霖國際有限公司","臺北市松山區南京東路5段296號10樓","","1000000","1030321","1031204"
"1810","54685710","智庫創業投資有限公司","臺北市大安區忠孝東路4段209號12樓","","27595000","1030324","1031217"
"1811","54686289","量子實業股份有限公司","臺北市中正區青島東路4號5樓之9","","5000000","1030325","1031216"
"1812","54687386","維軒生技有限公司","新北市中和區莒光路129巷1弄10號","","1000000","1030327","1031227"
"1813","54689899","樟樹出版有限公司","新北市板橋區福星里重慶路139巷6號4樓","","10000","1021231","1031216"
"1814","54691608","佐仕萊特工業開發有限公司","新北市新莊區民安西路415巷13號(1樓)","","250000","1030109","1031225"
"1815","54691678","秧華國際有限公司","新北市永和區自由街47號(2樓)","","400000","1030109","1031204"
"1816","54694154","金萬利食品股份有限公司","新北市新莊區長青街17號3樓之1","","888880","1030121","1031226"
"1817","54696511","旺弘投資有限公司","新北市三重區集仁街38號11樓","","6000000","1030206","1031201"
"1818","54697167","感恩國際餐飲有限公司","新北市板橋區大明街25巷2弄18之3號","","100000","1030211","1031230"
"1819","54698709","奧趣科技有限公司","新北市永和區大新里大新街76號5樓之6","","450000","1030219","1031231"
"1820","54699524","益成不動產仲介經紀有限公司","新北市汐止區康福里福德一路118號","","1000000","1030224","1031225"
"1821","54699658","欣和房屋仲介經紀有限公司","新北市永和區中和路409號(1樓)","","4000000","1030224","1031219"
"1822","54699904","拓荒者室內裝潢工程有限公司","新北市中和區保健路106巷85號","","1000000","1030224","1031211"
"1823","54706200","遠瞻科技有限公司","新北市新莊區頭前路48號(1樓)","","2000000","1030320","1031201"
"1824","54709282","楊真藏藝術有限公司","新北市淡水區中正路1段92號4樓","","3000000","1030401","1031218"
"1825","54710921","亞承貿易有限公司","新北市萬里區港東三巷11之1號3樓","","3000000","1030409","1031224"
"1826","54713758","淮澤室內裝修有限公司","新北市新店區中正里中正路249號3樓","","500000","1030418","1031224"
"1827","54713770","伊美特國際有限公司","新北市中和區華新街143巷47號","","500000","1030418","1031211"
