"序號","統一編號","公司名稱","公司所在地","代表人","資本額","核准設立日期","核准解散日期"
"614","25079257","向勝科技有限公司","彰化縣線西鄉頂犂村曉陽路351號","","500000","0981201","1031202"
"615","25079762","八百屋生鮮有限公司","新北市汐止區水源路2段72巷28弄21號","","3000000","0981201","1031227"
"616","25082817","鼎茗實業有限公司","桃園市龍潭區百年里百年二街43號11樓","","1000000","0981204","1031229"
"617","25082990","豐佑工程有限公司","雲林縣斗六市林頭里榮譽路152巷69號1樓","","250000","0981204","1031224"
"618","25085949","遠智娛樂事業股份有限公司","新北市新店區廣興路松碧巷5號","","2000000","0981210","1031224"
"619","25087094","振輝精密股份有限公司","新北市中和區平河里中正路700號6樓之6","","5000000","0981211","1031215"
"620","25087398","北都酷比汽車股份有限公司","新北市新店區中興路3段3號2樓","","62000000","0981214","1031223"
"621","25092343","廣榮彈簧企業有限公司","高雄市苓雅區中山二路483號8樓之10","","100000","0981221","1031215"
"622","25092701","鴻奕不銹鋼有限公司","臺南市中西區西賢一街187巷116號1樓","","3000000","0981221","1031219"
"623","25092982","丞軒再生科技股份有限公司","新北市鶯歌區鳳祥里德昌街270號3樓","","10000000","0981222","1031226"
"624","25093005","成琪貿易有限公司","屏東縣屏東市瑞光里民生路57之37號1樓","","1000000","0981222","1031223"
"625","25104636","友裕建設股份有限公司","臺北市中山區中山北路3段57號6樓","","30000000","0990211","1031222"
"626","25106557","鉅金鎮企業有限公司","臺北市信義區光復南路551號4樓","","2000000","0990226","1031222"
"627","25108725","極光攝影器材有限公司","新北市新莊區光明里民安西路296號4樓","","500000","0990309","1031229"
"628","25112919","大運發投資顧問股份有限公司","臺北市內湖區文德路155號","","2000000","0990322","1031224"
"629","25113229","樂意設計有限公司","臺北市中山區南京東路1段16號9樓之1","","500000","0990323","1031202"
"630","25113298","登棠國際有限公司","基隆市七堵區長興里東新街73巷9號2樓","","3000000","0990323","1031205"
"631","25113754","玻達答爾有限公司","臺北市中山區敬業三路162巷66號2樓","","2000000","0990324","1031227"
"632","25114402","鈺玻有限公司","臺北市大安區安和路2段5號4樓之2","","500000","0990325","1031203"
"633","25116470","新港商事有限公司","臺北市中山區合江街93巷13號1樓","","2000000","0990401","1031211"
"634","25116730","爆爆谷食品有限公司","臺北市松山區民權東路5段7-1號4樓","","1000000","0990401","1031222"
"635","25119151","謙懿有限公司","臺北市信義區忠孝東路5段800號6樓之9","","500000","0990409","1031223"
"636","25122260","尚臻食品有限公司","臺北市士林區承德路4段277巷58號","","250000","0990421","1031209"
"637","25125983","利多不動產經紀有限公司","臺北市松山區八德路3段139號(1樓)","","3000000","0990503","1031216"
"638","25126998","春麟開發股份有限公司","臺北市中山區農安街49號4樓之6","","10000000","0990506","1031223"
"639","25127005","圓氣養生館有限公司","臺北市松山區八德路4段46號","","300000","0990506","1031215"
"640","25127835","興林開發工程有限公司","臺北市萬華區西園路2段261巷34弄45號","","5000000","0990510","1031231"
"641","25128406","樺謙工程有限公司","臺北市萬華區寶興街202號","","5000000","0990511","1031217"
"642","25130037","楊益生技有限公司","臺北市大安區光復南路102號13樓","","1000000","0990518","1031225"
"643","25132611","立行養生研創有限公司","臺北市中正區忠孝西路1段50號23樓之21","","30000","0990526","1031226"
"644","25136237","以勒豐盛有限公司","臺北市大安區師大路86巷16號","","3000000","0990608","1031218"
"645","25136882","凱傑整合行銷有限公司","臺北市大安區和平東路1段182之2號8樓","","300000","0990610","1031230"
"646","25137670","八鰭歐有限公司","臺北市大安區忠孝東路4段170巷17弄7號1樓","","1500000","0990614","1031215"
"647","25143357","禾泰豐紙業有限公司","臺北市北投區自強街46巷21號","","1000000","0990702","1031223"
"648","25144573","億馬動力股份有限公司","臺北市大安區信義路4段337號9樓","","3000000","0990707","1031224"
"649","25145475","浩色客有限公司","臺北市內湖區瑞光路358巷38弄36號3樓之3","","500000","0990709","1031224"
"650","25146376","瀚馬仕國際股份有限公司","臺北市內湖區瑞光路288號2樓","","1000000","0990714","1031202"
"651","25147895","鋒田有限公司","臺北市士林區翠山街2號1樓","","500000","0990720","1031205"
"652","25147924","馬亞生物科技有限公司","臺北市中正區信義路2段1-6號","","2000000","0990720","1031210"
"653","25152897","聯合國際財務管理顧問有限公司","南投縣草屯鎮御史里御富路284巷50號1樓","","1000000","0990107","1031225"
"654","25154380","宥順生活百貨有限公司","臺中市西屯區福順路829號","","1000000","0990111","1031129"
"655","25156161","福澤食品科技股份有限公司","臺中市西屯區福雅里福祥街11號5樓之1","","12000000","0990114","1031202"
"656","25166668","睿盛資訊有限公司","新竹縣竹東鎮二重里學府路47號1樓","","5600000","0990204","1031226"
"657","25171819","穩建機械工程有限公司","宜蘭縣蘇澳鎮德興一路1號","","1000000","0990222","1031202"
"658","25172346","吉星洋行實業有限公司","臺北市中山區吉林路24號3樓之5","","5000000","0990223","1031224"
"659","25173387","冠儀有限公司","苗栗縣公館鄉館東村2鄰忠孝路138巷2之16號1樓","","500000","0990226","1031205"
"660","25173963","理想家不動產有限公司","桃園市平鎮區義興里環南路351號1樓","","1000000","0990301","1031230"
"661","25185503","橙國生技國際有限公司","彰化縣溪湖鎮西溪里忠溪路231號","","200600","0990324","1031231"
"662","25186989","宏能國際企業有限公司","桃園市桃園區自強里經國路336巷72號9樓","","600000","0990326","1031225"
"663","25192188","莊家生技有限公司","臺中市南屯區同心里文心路1段186號18樓之7","","1000000","0990407","1031208"
"664","25195262","新思路數位資訊股份有限公司","彰化縣員林鎮浮圳里員東路1段442號","","2000000","0990413","1031209"
"665","25196966","權威重金機械有限公司","新竹縣竹北市東海里興海街107號1樓","","1000000","0990415","1031202"
"666","27104014","石誠文具印刷有限公司","臺北市文山區景華街218號","","5000000","0610601","1031219"
"667","27207476","建昇機電工程有限公司","高雄市前鎮區林森三路82巷20之1號1樓","","1000000","0931012","1031128"
"668","27213012","瑞翔汽車企業有限公司","高雄市小港區桂誠街142號6樓","","500000","0931214","1031225"
"669","27218213","永傳營造有限公司","高雄市鼓山區鼓山2路37巷37號1樓","","3000000","0940215","1031215"
"670","27218585","啟東貿易有限公司","高雄市前鎮區漁港東2路3號301室","","1000000","0940222","1031209"
"671","27220251","吉立登有限公司","高雄市鼓山區美術南三路65號","","500000","0940311","1031227"
"672","27222531","坤宏興業有限公司","高雄市鼓山區明華路305號4樓之2","","1000000","0940331","1031202"
"673","27229318","承緯科技有限公司","高雄市苓雅區正義里正義路42號1樓","","2000000","0940530","1031224"
"674","27260099","尚盈建設有限公司","臺南市新營區忠政里中正路39巷80號1樓","","2000000","0930408","1031203"
"675","27270998","威綸工程有限公司","臺中市大里區東湖里34鄰國寶街46號1樓","","500000","0930421","1031217"
"676","27283023","鑫益鋼鐵有限公司","桃園市觀音區大同里中山路二段八０三巷五弄十六號二樓","","7000000","0930504","1031223"
"677","27288147","仲閔運動用品有限公司","臺南市善化區胡厝里百二甲四號一樓","","2000000","0930511","1031208"
"678","27290853","大南海國際科技事業有限公司","臺北市中正區公園路26號7樓","","600000","0930513","1031215"
"679","27299448","泰鏵有限公司","臺中市豐原區建成路29號1樓","","5000000","0930525","1031202"
"680","27299947","暐倫實業股份有限公司","臺東縣臺東市豐樂里大業路72號1樓","","1000000","0930526","1031202"
"681","27334439","顧顥開發建設股份有限公司","臺北市中正區羅斯福路2段7之3號12樓","","26000000","0930625","1031222"
"682","27341776","金石資產顧問有限公司","臺北市中山區中山北路3段26號10樓之3","","5000000","0930716","1031229"
"683","27347096","邦尼數位行銷有限公司","臺北市中山區松江路206號11樓","","5000000","0930802","1031230"
"684","27349307","欣力安國際有限公司","臺北市萬華區環河南路1段23號7樓之21","","2000000","0930805","1031203"
"685","27353224","皚翟有限公司","臺北市大安區忠孝東路3段276巷6弄3號2樓","","500000","0930818","1031231"
"686","27359466","位元室內裝修設計工程有限公司","臺北市信義區松德路161號12樓","","8000000","0930907","1031222"
"687","27368084","世間國際有限公司","臺北市信義區福德街268巷7弄5號","","3000000","0931004","1031223"
"688","27377400","揚丞科技股份有限公司","桃園市龜山區文化三路63號地下一層之2","","5000000","0930617","1031226"
"689","27381827","誠豐企劃有限公司","臺中市西區安龍里民權路185號3樓","","1000000","0930623","1031219"
"690","27389546","愛森威有限公司","彰化縣福興鄉大崙村大崙街39號","","500000","0930702","1031201"
"691","27400155","全拓國際貿易股份有限公司","","","0","0930716","1031225"
"692","27405503","黃騰有限公司","彰化縣彰化市西興里金馬路三段五六五號一樓","","1000000","0930722","1031222"
"693","27414186","北旭百科技有限公司","新北市樹林區三俊街１９９巷２０弄１７之１號","","5000000","0930803","1031212"
"694","27423137","伏鑽工程有限公司","嘉義縣新港鄉福德村福德路140巷21之1號","","1000000","0930813","1031210"
"695","27424558","瑞正佳有限公司","基隆市中正區新豐街四八○之三號七樓","","500000","0930816","1031226"
"696","27431397","峰嘉貿易股份有限公司","臺北市士林區承德路4段81號5樓","","5000000","0930826","1031225"
"697","27433613","沛穎企業有限公司","高雄市大社區文聖路35號1樓","","5000000","0930830","1031212"
"698","27446912","太和田實業有限公司","新北市新莊區建福路48巷24號3樓","","1000000","0930917","1031205"
"699","27449853","度爾企管顧問有限公司","桃園市龍潭區三和里渴望路六○三巷七號二樓","","1000000","0930922","1031203"
"700","27451822","統瀛有限公司","新北市新莊區民安西路一六七號一樓","","500000","0930924","1031222"
"701","27457305","大立投資有限公司","桃園市桃園區宏昌十二街398巷7號","","250000000","0931001","1031204"
"702","27458753","辰寧有限公司","新北市中和區中原里立德街51號(2樓)","","1000000","0931004","1031209"
"703","27465115","濤鋒企業有限公司","新北市樹林區太順街一一四巷七號一樓","","1000000","0931012","1031209"
"704","27470784","加盛水電工程有限公司","新北市新莊區仁愛街11之1號","","2000000","0931019","1031210"
"705","27473889","達亮企業有限公司","新北市新店區安祥路102巷71號","","5000000","0931022","1031231"
"706","27475704","源鋮企業有限公司","高雄市岡山區碧紅里18鄰大全街11巷12弄30號","","1000000","0931026","1031204"
"707","27477528","豐盛清潔有限公司","新北市五股區五福路二三巷一號一樓","","1000000","0931028","1031208"
"708","27480468","台世通有限公司","新北市五股區中興路一段一八號","","1000000","0931101","1031201"
"709","27482613","頂曜建設有限公司","臺南市南區大忠里國民路220號","","2000000","0931103","1031230"
"710","27491134","冠宇欣業有限公司","新北市樹林區信和街134號（1）樓","","1000000","0931116","1031211"
"711","27491795","毅達國際有限公司","彰化縣員林鎮三條里員東路二段307巷20號","","500000","0931116","1031230"
"712","27497762","速配貿易股份有限公司","新北市三重區中正北路2號4樓之2","","5000000","0931124","1031219"
"713","27503336","鴻興寶有限公司","臺中市大里區中新里中興路2段240巷31之1號5樓","","1000000","0931201","1031229"
"714","27507564","利東昇有限公司","新北市新店區永華街23號4樓","","2000000","0931207","1031203"
"715","27528147","大仙院有限公司","臺北市松山區南京東路5段308號7樓之3","","1000000","0931101","1031202"
"716","27530170","太河投資股份有限公司","臺北市中山區松江路369號4樓","","365000000","0931105","1031212"
"717","27530798","建雄國際股份有限公司","臺北市松山區南京東路3段305號3樓","","25000000","0931108","1031215"
"718","27539030","稚竹企業有限公司","臺北市南港區昆陽街79號1樓","","6000000","0931202","1031217"
"719","27560906","旭升國際有限公司","新北市樹林區保順街97號4樓","","1000000","0940205","1031229"
"720","27563299","萬昌國際有限公司","臺北市士林區福港街244巷1號1樓","","5000000","0940218","1031217"
"721","27565418","八方行銷股份有限公司","臺北市松山區南京東路4段52巷3號1樓","","3000000","0940301","1031212"
"722","27566704","英伯雷商品檢驗股份有限公司","新北市三重區重新路4段206號8樓之2","","1500000","0940304","1031204"
"723","27573509","勤誌科技股份有限公司","臺北市中山區復興北路50號4樓之1","","5000000","0940324","1031219"
"724","27581212","普堤爾斯有限公司","高雄市三民區鼎瑞街67巷22號5樓","","1000000","0931223","1031219"
"725","27583035","宜泉國際有限公司","桃園市楊梅區大成路168，170號","","720000","0931224","1031203"
"726","27585076","福鼎豐企業有限公司","高雄市楠梓區安泰街132巷36弄1號1樓","","1000000","0931228","1031128"
"727","27587996","和利興業有限公司","嘉義縣新港鄉宮前村古民街十七巷十六號一樓　","","1000000","0931231","1031230"
"728","27593842","百富祥有限公司","新竹市育英里四維路３２號２樓","","500000","0940110","1031202"
"729","27594151","全美印刷品有限公司","新北市板橋區文化路1段188巷9弄33之3號","","2000000","0940110","1031204"
"730","27595026","邑倫有限公司","新北市中和區圓通路１６７巷７號５樓","","500000","0940111","1031202"
"731","27595671","駿上企業有限公司","臺中市南區長榮里濟世街２５號","","1000000","0940112","1031225"
"732","27596186","宇聖科技有限公司","新竹縣竹北市北崙里博愛街275巷33弄58號2樓","","5000000","0940113","1031226"
"733","27598473","鼎致有限公司","臺南市中西區郡西里永華路一段98巷8號","","250000","0940117","1031229"
"734","27598966","翔瑞五金有限公司","臺中市烏日區榮泉里榮泉路99巷28弄32號1樓","","1000000","0940117","1031229"
"735","27599769","龍駿建設有限公司","桃園市中壢區三民里三樂二街15號1樓","","10000000","0940118","1031208"
"736","27609366","英嵩有限公司","高雄市鳳山區建國路一段377巷37弄1號1樓","","500000","0940128","1031219"
"737","27615819","豐盛不動產經紀有限公司","新北市新莊區中華路1段36號","","1000000","0940204","1031203"
"738","27616802","飛鈴有限公司","新北市中和區中山路2段523巷5號3樓","","1000000","0940205","1031223"
"739","27627998","欣城開發建設有限公司","桃園市楊梅區新江路２２１巷３７號","","15000000","0940302","1031216"
"740","27634153","蒲林生物科技股份有限公司","新竹市中華路２段５４８號５樓","","3000000","0940309","1031219"
"741","27634533","茂豐興業有限公司","新北市新莊區瓊林南路73之2號","","3000000","0940309","1031205"
"742","27634750","唯普科技有限公司","臺南市永康區勝利里勝學路８５號２樓","","500000","0940310","1031225"
"743","27636146","宇康有限公司","臺北市文山區忠順街2段70號","","500000","0940311","1031211"
"744","27637406","瑪薇安國際音樂藝術有限公司","桃園市大溪區長興街2段81號","","500000","0940314","1031226"
"745","27650147","和豊投資股份有限公司","臺中市中區民權路102號11樓之1","","6000000","0940325","1031215"
"746","27655810","明霖服飾有限公司","桃園市龜山區大同路３５６巷６２弄７２號","","500000","0940331","1031226"
"747","27661025","六毅建材有限公司","桃園市桃園區大有路181號3樓之1","","500000","0940407","1031201"
"748","27682176","福優國際企業股份有限公司","高雄市前金區大同二路147號11樓之4","","5000000","0940608","1031226"
"749","27684771","佳歆有限公司","高雄市左營區文自路363巷38號1樓","","500000","0940704","1031215"
"750","27684815","信居開發有限公司","高雄市小港區沿海1路182號3樓之1","","3000000","0940704","1031222"
"751","27688713","宏澤工程有限公司","高雄市三民區臥龍路49號7樓之5","","2000000","0940815","1031202"
"752","27693785","全佑房屋不動產有限公司","高雄市鼓山區華榮路47號","","1000000","0941011","1031210"
"753","27695313","五九一不動產有限公司","高雄市左營區博愛3路623號1樓","","2000000","0941026","1031205"
"754","27701027","您必得國際有限公司","高雄市鼓山區明誠4路8號14樓","","1000000","0941226","1031212"
"755","27709604","隆茂科技有限公司","高雄市三民區興隆街70號4樓","","1000000","0950406","1031210"
"756","27723471","鑫大業建設股份有限公司","臺北市松山區南京東路4段107號3樓","","1000000","0940505","1031231"
"757","27723937","固鍵科技有限公司","臺北市大同區民族西路120號1樓","","1000000","0940506","1031230"
"758","27724268","屋外旅行社有限公司","臺北市中山區松江路131之5號","","5000000","0940509","1031205"
"759","27725843","明呈工程有限公司","臺北市北投區文林北路196號3樓","","5000000","0940513","1031212"
"760","27733822","保盈國際創意行銷有限公司","新北市中和區碧河里建八路209號6樓","","5000000","0940606","1031218"
"761","27735835","鏵中油品有限公司","新北市中和區中正路286號8樓之1","","2000000","0940609","1031212"
"762","27736644","安信富達科技有限公司","臺北市信義區永吉路120巷24號3樓","","1000000","0940613","1031217"
"763","27738185","易丹數位有限公司","臺北市士林區葫蘆街140號2樓","","3000000","0940616","1031231"
"764","27758409","瑞昇光電股份有限公司","臺北市北投區北投路2段11號2樓","","15500000","0940812","1031203"
"765","27760117","東裕國際開發有限公司","臺北市大安區忠孝東路4段59號6樓之3","","3000000","0940817","1031210"
"766","27765921","普美興業有限公司","臺北市中山區錦州街199號1樓","","2000000","0940905","1031210"
"767","27770852","日旭媒體整合行銷股份有限公司","臺北市信義區莊敬路289巷3弄37號1樓","","5000000","0940919","1031226"
"768","27770987","元昌投資股份有限公司","臺北市內湖區瑞光路318號11樓","","300000000","0940920","1031219"
"769","27773154","雄新建設有限公司","彰化縣員林鎮萬年里員水路２段４６５巷１５弄１８號","","1000000","0940427","1031218"
"770","27777709","豪信電通股份有限公司","新北市三重區中興北街153之6號2樓","","1000000","0940502","1031225"
"771","27778236","璨擷實業有限公司","臺中市神岡區大社里大豐北街９７巷３０弄６號１樓","","500000","0940503","1031227"
"772","27779930","悠摩實業有限公司","新北市土城區中央路２段２５４號３樓","","1000000","0940504","1031229"
"773","27782766","承鴻國際有限公司","新北市永和區保生路1號8樓","","10000000","0940506","1031215"
"774","27783478","順盛鞋業股份有限公司","臺中市大里區仁德里仁禮街39號1樓","","10000000","0940509","1031203"
"775","27792292","喬比國際有限公司","嘉義市太平里林森東路１６３巷４６號","","1000000","0940519","1031226"
"776","27793145","總和食材物流有限公司","桃園市桃園區三民路1段42巷16之4號5樓","","1000000","0940519","1031223"
"777","27794192","凱業環境規劃有限公司","臺中市西屯區福林里西屯路3段宏福1巷32號6樓","","1000000","0940520","1031211"
"778","27794566","新瀚工程有限公司","新北市新莊區民安西路172巷6弄4號1樓","","2000000","0940520","1031204"
"779","27797016","創意橄欖股份有限公司","臺北市中山區長安東路2段189號10樓之7","","9000000","0940524","1031230"
"780","27812776","楹麗實業有限公司","苗栗縣頭份鎮山下里13鄰信東路2段162號1樓","","1000000","0940609","1031218"
"781","27827659","岳豪實業有限公司","新北市蘆洲區中山二路201號2樓","","2000000","0940627","1031215"
"782","27835551","冠宏工程有限公司","新竹市振興里9鄰食品路554號","","500000","0940705","1031225"
"783","27842265","迦南地籍測量工程顧問有限公司","臺南市安平區安平路98巷18號","","1000000","0940712","1031225"
"784","27842477","漢民文化事業有限公司","臺南市東區龍山里林森路１段３９５號１０樓之３","","500000","0940713","1031209"
"785","27844685","誠賀實業有限公司","臺中市烏日區仁德里信義街１５１巷２３號１樓","","2000000","0940715","1031201"
"786","27873225","長豐國際商務有限公司","新北市永和區永貞路136號6樓","","1000000","0940818","1031227"
"787","27875639","利寶德實業有限公司","新北市中和區秀朗路三段78巷2弄1號","","2000000","0940822","1031224"
"788","27876877","惠登富景企業有限公司","新北市永和區秀朗路2段62號3樓","","1500000","0940824","1031231"
"789","27878002","阿碼科技股份有限公司","臺北市南港區三重路19之13號5樓","","210000000","0940825","1031225"
"790","27880529","詠宏有限公司","新北市新莊區新樹路３８７巷１９號２樓","","1000000","0940829","1031205"
"791","27882955","亞庭室內裝修有限公司","臺中市大里區塗城路635巷2弄2號1樓","","5000000","0940902","1031230"
"792","27890694","磊成投資股份有限公司","臺中市北區文莊里大雅路45號13樓之2","","29000000","0940912","1031229"
"793","27890723","玄成投資股份有限公司","臺中市北區文莊里大雅路45號13樓之2","","29000000","0940912","1031212"
"794","27892270","永興水電工程股份有限公司","新北市中和區中山路2段449巷1弄2號1樓","","5000000","0940914","1031217"
"795","27896326","至盛國際股份有限公司","臺中市豐原區豐圳里豐社路２４５號","","1000000","0940919","1031215"
"796","27919545","鼎碩精密科技股份有限公司","桃園市平鎮區湧安里工業南路249號","","15000000","0941018","1031218"
"797","27919783","永鎮科技管理有限公司","新竹市東區光復路1段89巷123之6號樓","","1000000","0941018","1031229"
"798","27973499","瀚予國際有限公司","臺北市南港區忠孝東路6段81巷8號1樓","","5000000","0941123","1031222"
"799","27973580","金庫一資產管理股份有限公司","","","0","0941123","1031211"
"800","27973857","台大礦業有限公司","臺北市松山區復興南路1段47巷11號1樓","","1000000","0941124","1031215"
"801","27974151","羅丹有限公司","臺北市大同區民權西路136號12樓之4","","500000","0941124","1031225"
"802","27982841","萬事雄有限公司","臺北市北投區大度路3段301巷208之1號1樓","","3000000","0941221","1031225"
"803","27987260","濰宣投資股份有限公司","臺北市信義區松隆路167號9樓","","25000000","0950104","1031230"
"804","28000298","富鎰布業有限公司","臺北市大同區民樂街77-1號3樓","","3600000","0950227","1031226"
"805","28002275","旺奇科技有限公司","臺北市北投區中山路1之7號5樓之10","","5000000","0950307","1031230"
"806","28008355","富宸纖維有限公司","臺北市士林區承德路5段6號1樓","","1000000","0950323","1031231"
"807","28020837","堃源建設開發股份有限公司","臺北市大同區承德路3段230號7樓","","28000000","0941101","1031224"
"808","28023659","宏濱工程有限公司","新北市永和區福和路57巷4弄2號1樓","","2000000","0941104","1031231"
"809","28024242","宇益螺絲有限公司","高雄市橋頭區橋頭里樹德路216號","","5000000","0941104","1031224"
"810","28033170","如宏機械股份有限公司","臺中市太平區中平九街215號","","1200000","0941117","1031227"
"811","28034847","泳駿裝潢設計有限公司","嘉義縣水上鄉寬士村崎子頭22之321號1樓","","1000000","0941118","1031227"
"812","28036140","詠長有限公司","臺中市大雅區中山北路１９７巷１５號１樓","","500000","0941121","1031211"
"813","28037020","常勝教育有限公司","南投縣草屯鎮炎峰里育英街97號1樓","","1500000","0941122","1031204"
"814","28038344","瑞田國際有限公司","高雄市鳳山區興仁里立志街100巷6之6號","","2000000","0941123","1031216"
"815","28038858","顯昀企業股份有限公司","新北市三重區重陽路１段１號６樓之５","","10000000","0941124","1031229"
"816","28039857","和翊汽車科技股份有限公司","桃園市楊梅區梅高路２段４３１巷１９０號","","6000000","0941125","1031222"
