"序號","統一編號","公司名稱","公司所在地","代表人","資本額","核准設立日期","核准解散日期"
"1223","53290513","加倍吉事物品流通有限公司","臺南市安平區怡平里建平十七街153號2樓","","100000","1000110","1031218"
"1224","53291787","太全生化科技有限公司","臺中市南屯區河南路四段690巷12號1樓","","300000","1000113","1031224"
"1225","53295284","密爾興業有限公司","臺南市中西區安海里中正路356號2樓之3","","500000","1000119","1031219"
"1226","53295756","威廣開發事業有限公司","新竹縣竹北市十興里光明六路東一段223號","","1000000","1000120","1031211"
"1227","53298352","旺宏地產開發有限公司","新竹縣竹北市十興里嘉豐北路68號2樓","","500000","1000125","1031219"
"1228","53302258","悦勤國際有限公司","臺南市安平區平通里永華路二段768號5樓之3","","500000","1000201","1031225"
"1229","53304381","以理電子有限公司","新竹市東區新莊里新莊街220巷11號4樓","","500000","1000216","1031212"
"1230","53313179","康福寶科技有限公司","臺北市中山區松江路101號5樓之1","","5000000","1000218","1031224"
"1231","53313591","台灣萬匯基建有限公司","臺北市中山區林森北路557巷3號6樓","","119200","1000222","1031209"
"1232","53313678","巴莎美學有限公司","臺北市大安區泰順街26巷4之3號1樓","","300000","1000222","1031217"
"1233","53315802","亞洲國際資訊科技股份有限公司","臺北市中山區長安東路2段67號3樓","","20400000","1000302","1031209"
"1234","53320397","民丞科技有限公司","臺北市中正區紹興北街35號4樓之2","","200000","1000316","1031224"
"1235","53323514","福磊資產管理股份有限公司","臺北市松山區塔悠路179號","","249020000","1000329","1031211"
"1236","53324984","凱愛股份有限公司","臺北市松山區復興北路167號5樓之1","","500000","1000330","1031223"
"1237","53328503","刺馬娛樂有限公司","臺北市內湖區新明路380巷4弄8之1號4樓","","886000","1000412","1031211"
"1238","53328601","亞拓生醫國際股份有限公司","臺北市中正區許昌街42之1號10樓","","4700000","1000412","1031210"
"1239","53330135","全智策略整合行銷有限公司","臺北市中山區松江路206號4樓之7","","5000000","1000415","1031201"
"1240","53330521","巨翔電子有限公司","臺北市士林區重慶北路4段248號3樓","","1000000","1000418","1031215"
"1241","53334195","立田國際開發有限公司","臺中市西屯區大祥街12號2樓","","2488888","1000428","1031225"
"1242","53335498","富松不動產股份有限公司","臺北市大安區東豐街66號3樓","","4200000","1000504","1031204"
"1243","53337502","富駿國際有限公司","臺北市中山區復興北路48號3樓","","500000","1000511","1031231"
"1244","53338185","愛國有限公司","臺北市中正區愛國東路96號","","109540","1000513","1031215"
"1245","53340598","產能興業有限公司","新北市板橋區大觀里僑中二街8巷17之1號","","300000","1000523","1031202"
"1246","53341885","久元生物科技股份有限公司","臺北市中山區長安東路2段230號2樓之7","","2000000","1000526","1031215"
"1247","53348780","智電國際實業有限公司","臺北市北投區溫泉路25號","","2000000","1000616","1031227"
"1248","53349514","順利成有限公司","臺北市萬華區成都路106號9樓之3","","1000000","1000616","1031216"
"1249","53349599","保時捷投資股份有限公司","臺北市松山區敦化北路349號","","47000000","1000617","1031204"
"1250","53350265","良芳紙業有限公司","臺北市中山區林森北路100號8樓之6","","1000000","1000620","1031215"
"1251","53353333","振作文化有限公司","新北市新店區安興路85之16號(1樓)","","1500000","1000629","1031231"
"1252","53354754","采昊企業有限公司","臺北市文山區保儀路31之5號4樓","","1000000","1000704","1031222"
"1253","53357838","愛客萊股份有限公司","臺北市大安區信義路3段41號8樓","","2000000","1000713","1031222"
"1254","53358371","金仕達企業有限公司","臺北市大安區忠孝東路4段295號3樓","","1000000","1000714","1031230"
"1255","53366180","巧思文具禮品有限公司","臺南市東區大德里立德十路46巷14號1樓","","400000","1000311","1031215"
"1256","53368130","展新數位科技有限公司","臺中市南屯區文山九街67號1樓","","300000","1000316","1031216"
"1257","53368526","無招牌創意餐飲有限公司","桃園市大溪區福安里24鄰三層41-4號1樓","","1000000","1000316","1031222"
"1258","53375771","冠邑國際貿易有限公司","臺中市東區東信里東英路265號2樓","","1000000","1000329","1031222"
"1259","53378904","翊舜科技有限公司","新竹市南寮里南寮街187巷2號","","1000000","1000401","1031227"
"1260","53379489","典城有限公司","彰化縣秀水鄉莊雅村美溪巷29號","","5000000","1000406","1031222"
"1261","53382132","昌盛速食餐廳有限公司","彰化縣花壇鄉花壇村中山路一段345號","","1000000","1000411","1031205"
"1262","53382597","聖拓室內裝修工程有限公司","臺中市大甲區中山里甲后路177之21號一樓","","800000","1000412","1031210"
"1263","53383174","十二籃不動產經紀有限公司","臺中市太平區樹德路227號1樓","","3000000","1000413","1031223"
"1264","53385834","東港漁場有限公司","屏東縣東港鎮鎮嘉蓮里嘉蓮路91號","","10000000","1000418","1031226"
"1265","53387093","凱鉅建設有限公司","南投縣草屯鎮碧洲里草溪路100-61號","","6000000","1000420","1031224"
"1266","53390392","群繹實業有限公司","新竹縣竹北市嘉豐2街1段19號","","1000000","1000426","1031211"
"1267","53390689","立曜網路有限公司","臺中市北區賴村里五常街380號5樓之30","","1000000","1000426","1031209"
"1268","53392223","利威科技有限公司","新竹縣湖口鄉鳳山村榮光路545號","","2000000","1000428","1031204"
"1269","53395946","金鑫建材有限公司","臺南市永康區鹽洲里洲尾街146巷7號","","110000","1000505","1031201"
"1270","53405254","佳益精機有限公司","屏東縣林邊鄉水利村豊漁路47號","","2000000","1000523","1031202"
"1271","53407181","元旭喬揚有限公司","臺中市北區健行里梅亭街678巷20號1樓","","100000","1000526","1031210"
"1272","53408040","星點晶有限公司","臺南市安南區國安街210巷1號1樓","","500000","1000527","1031211"
"1273","53408421","艾別絲有限公司","","","0","1000527","1031210"
"1274","53410664","芮德印刷設計有限公司","新北市三重區民生街62號5樓","","1000000","1000520","1031203"
"1275","53410904","小園精密科技有限公司","新北市新店區達觀里達觀路8巷1號6樓之5","","200000","1000520","1031225"
"1276","53413183","韻達有限公司","新北市板橋區四川路2段241號13樓之1","","6320000","1000601","1031230"
"1277","53414795","華宸生技有限公司","新北市土城區慶和街9號(1樓)","","1000000","1000610","1031209"
"1278","53416554","星辰時尚實業有限公司","新北市板橋區民生路1段33號5樓之2","","1000000","1000617","1031212"
"1279","53419139","法蘭雅股份有限公司","新北市汐止區茄安路18號3樓","","1000000","1000629","1031229"
"1280","53421629","昇達開發事業有限公司","新北市淡水區新市一路3段12號13樓","","1000000","1000711","1031230"
"1281","53427659","志憲工程有限公司","新北市汐止區汐萬路2段250-2號4樓","","2000000","1000803","1031223"
"1282","53428051","友鴻食品材料有限公司","新北市新莊區中港路138巷7弄16號","","1000000","1000805","1031205"
"1283","53429853","旭怡國際行銷有限公司","新北市新店區安康路3段73號","","1000000","1000812","1031229"
"1284","53431767","百福管理顧問有限公司","新北市新莊區新樹路613-7號11樓","","100000","1000822","1031224"
"1285","53433701","全天會社有限公司","新北市三重區福祉里重新路4段206號2樓之1","","1000000","1000830","1031225"
"1286","53435975","愷安貿易有限公司","新北市中和區連城路319巷3弄2號1樓","","500000","1000908","1031230"
"1287","53438234","昱輝國際有限公司","新北市土城區裕生里1鄰中華路1段60號(1樓)","","5000000","1000922","1031215"
"1288","53438804","木斗工程有限公司","新北市板橋區莒光路40巷15之2號","","100000","1000923","1031202"
"1289","53439493","志升企業有限公司","新北市板橋區後埔里實踐路30號4樓","","1000000","1000927","1031224"
"1290","53451860","暉廣有限公司","新北市泰山區明志路3段74巷19號4樓","","1000000","1001011","1031218"
"1291","53452137","帝晶不動產仲介經紀有限公司","新北市林口區文化三路1段223號","","1000000","1001012","1031229"
"1292","53452185","伯杰有限公司","新北市樹林區中山路3段175號8樓之3","","1350000","1001012","1031229"
"1293","53452328","詮忻科技有限公司","新北市板橋區長安街287號","","100000","1001013","1031230"
"1294","53452349","一驍有限公司","新北市永和區豫溪街137號3樓","","500000","1001013","1031225"
"1295","53455084","君宏不動產有限公司","新北市三峽區大德路198號","","1000000","1001026","1031231"
"1296","53457745","新峰毅工程有限公司","新北市板橋區建國街4號","","2000000","1001108","1031208"
"1297","53459791","愷榮有限公司","新北市淡水區新民街19巷18號6樓","","1000000","1001121","1031202"
"1298","53459899","泰和瑞生機事業有限公司","新竹縣竹東鎮三重里中興路二段248號","","3000000","1001121","1031223"
"1299","53462965","侑湶機械實業有限公司","新北市三重區碧華街456號3樓","","500000","1001207","1031211"
"1300","53463839","聚永興業有限公司","新北市淡水區鄧公路30巷2弄41號","","1000000","1001212","1031203"
"1301","53465288","群創新企業有限公司","新北市新莊區建安里建安街101巷1弄2號","","3000000","1001216","1031224"
"1302","53467526","金新發有限公司","新北市中和區中興街233巷8弄2之3號","","1000000","1001230","1031231"
"1303","53470368","岡杵有限公司","臺中市沙鹿區鎮南路二段93巷50號1樓","","500000","1000601","1031229"
"1304","53470846","富程開發建設有限公司","臺中市南區福新街110號","","3000000","1000602","1031222"
"1305","53471991","獻益農場有限公司","基隆市暖暖區碇和里10鄰源遠路277巷62號1樓","","200000","1000603","1031231"
"1306","53478241","金山成瓦斯有限公司","臺中市東區十甲里自由路四段306號1樓","","1000000","1000616","1031202"
"1307","53482998","惟晶科技工程有限公司","臺中市西區公益里公益路221號14樓之5","","100000","1000624","1031216"
"1308","53487157","喜多多實業有限公司","嘉義市西區後驛里友忠路558號1樓","","6000000","1000704","1031216"
"1309","53489937","畇端生技有限公司","桃園市大溪區仁義里僑愛巷26弄18號","","5200000","1000708","1031219"
"1310","53490929","錩邑股份有限公司","新竹市香山區牛埔里中華路四段411巷11弄10號","","3000000","1000711","1031230"
"1311","53491639","奕昇科技有限公司","桃園市中壢區中堅里台貿一街60號1樓","","500000","1000712","1031212"
"1312","53492573","承暘房屋仲介有限公司","臺中市北區武昌路151號1樓","","3000000","1000714","1031226"
"1313","53496016","弘軒生物科技有限公司","屏東縣內埔鄉內埔村仁華路17號1樓","","1000000","1000720","1031227"
"1314","53496873","出群興業有限公司","臺中市大雅區六寶里光復路24之23號1樓","","2000000","1000721","1031225"
"1315","53497970","飛碟義式料理有限公司","臺中市西屯區何成里大墩十七街108號1樓","","3500000","1000722","1031219"
"1316","53502592","豪爵氏股份有限公司","臺南市安平區億載里永華11街17巷27號1樓","","3000000","1000802","1031224"
"1317","53505280","耀嘉企業有限公司","桃園市八德區大宏里桃德路155巷102號","","2000000","1000808","1031225"
"1318","53505486","杰運建設有限公司","桃園市中壢區興仁里興仁路2段63號2樓","","10000000","1000808","1031230"
"1319","53505710","浤海汽車有限公司","臺中市烏日區烏日里新興路193號","","1000000","1000808","1031225"
"1320","53506020","嘉南科技照明有限公司","嘉義市西區港坪里大同路481號5樓之2","","2000000","1000809","1031211"
"1321","53507484","治勝有限公司","臺中市西區吉龍里五權五街151號7樓之6","","200000","1000811","1031226"
"1322","53508152","莎夏有限公司","臺中市西屯區至善路101巷8號1樓","","1000000","1000812","1031209"
"1323","53508195","囍門企業有限公司","彰化縣埤頭鄉合興村19鄰中央路696巷12號1樓","","1700000","1000812","1031211"
"1324","53509814","皇順有限公司","彰化縣溪州鄉西畔村下庄巷9-1號","","200000","1000816","1031203"
"1325","53514865","伯駿有限公司","臺中市潭子區民族路1段168之1、168之2號","","1000000","1000826","1031226"
"1326","53516060","北大不動產有限公司","新竹縣湖口鄉信勢村5鄰成功路201號","","600000","1000829","1031230"
"1327","53518551","金森綠能科技股份有限公司","花蓮縣花蓮市國華里中山路411巷13號1樓","","5000000","1000902","1031222"
"1328","53527159","庭昀有限公司","臺北市中正區延平南路189號1樓","","3000000","1000812","1031229"
"1329","53530252","湯曜科技有限公司","臺北市大安區羅斯福路3段95號2樓之1","","3000000","1000823","1031201"
"1330","53534187","光星科技有限公司","臺北市大安區復興南路1段62號6樓之5","","1000000","1000906","1031230"
"1331","53537136","大自然能量開發有限公司","臺北市萬華區中華路2段502號1樓","","1000000","1000919","1031230"
"1332","53537874","勝瀚科技有限公司","臺北市松山區健康路23號6樓","","1000000","1000921","1031204"
"1333","53539057","台光石化股份有限公司","臺北市內湖區洲子街100號3樓","","67500000","1000923","1031212"
"1334","53543931","十二月花村有限公司","臺北市內湖區南京東路6段350之7號11樓之5","","2000000","1001012","1031231"
"1335","53546450","強豪實業股份有限公司","臺北市中山區民權西路11號1、2樓","","2000000","1001018","1031223"
"1336","53546705","和居樂活事業有限公司","臺北市士林區天玉街3號7樓","","1000000","1001018","1031226"
"1337","53548041","台灣八春茶葉股份有限公司","臺北市信義區基隆路1段400號8樓之5","","500000","1001024","1031217"
"1338","53549436","數位異象設計有限公司","臺北市信義區永吉路503號4樓","","1400000","1001026","1031208"
"1339","53549597","創立亨有限公司","臺北市南港區東新街77巷7號","","500000","1001027","1031226"
"1340","53550897","芭比國際貿易有限公司","新北市新店區溪園路417號","","3000000","1001101","1031231"
"1341","53551376","純我們健康有限公司","臺北市文山區福興路100之3號5樓","","500000","1001102","1031231"
"1342","53554937","奕霖國際有限公司","臺北市內湖區堤頂大道2段407巷20弄39號1樓","","500000","1001116","1031202"
"1343","53556479","盧師傅創意美食有限公司","臺北市中正區忠孝西路1段173號","","4000000","1001121","1031225"
"1344","53557391","米妮樂國際有限公司","臺北市大安區敦化南路1段187巷19號","","5000000","1001124","1031216"
"1345","53557982","惠國生命事業有限公司","臺北市中山區松江路357巷12號","","1000000","1001125","1031204"
"1346","53564153","億軒科技有限公司","臺北市內湖區瑞光路358巷30弄2之1號6樓","","100000","1001220","1031202"
"1347","53583222","伊山秋有限公司","臺南市永康區烏竹里烏竹街65號1樓","","50000","1010118","1031202"
"1348","53585734","馥澤環保有限公司","高雄市林園區溪州三路２２７號１樓","","500000","1010220","1031222"
"1349","53588198","壹立特互動科技股份有限公司","高雄市左營區博愛四路313號2樓之2","","5000000","1010312","1031211"
"1350","53592545","球王管理顧問股份有限公司","高雄市苓雅區自強三路3號26樓之2","","1200000","1010417","1031215"
"1351","53592664","浤騰企業有限公司","高雄市鳳山區建國路3段340號5樓","","1000000","1010417","1031209"
"1352","53594240","群崴產業顧問有限公司","高雄市新興區民生一路247號8樓之2","","1000000","1010430","1031210"
"1353","53597083","大東車輛企業股份有限公司","高雄市大寮區農場路186號3樓","","5000000","1010523","1031208"
"1354","53597669","建強金屬股份有限公司","高雄市三民區鼎華路191號1樓","","200000","1010528","1031230"
"1355","53602109","中州生技有限公司","新竹縣竹北市斗崙里縣政七街11號1樓","","2000000","1000913","1031128"
"1356","53604599","欣長盈科技有限公司","桃園市蘆竹區蘆竹里富國路三段1400號","","3000000","1000916","1031210"
"1357","53605788","昱昶材料科技股份有限公司","臺南市新市區永就里永就46之41號","","600000","1000920","1031201"
"1358","53606978","世巨生物科技有限公司","臺中市沙鹿區公明里中清路2之17號1樓","","2000000","1000922","1031209"
"1359","53619875","緯鑫製刀有限公司","臺中市豐原區西勢里西勢路109巷1號1樓","","100000","1001018","1031216"
"1360","53620465","侑昇運動管理顧問股份有限公司","新竹縣竹北市竹仁里仁和街2巷21號(1樓)","","10000000","1001019","1031218"
"1361","53632531","易珅有限公司","新竹市湳雅街252號","","500000","1001115","1031216"
"1362","53634524","源錡實業有限公司","臺南市西港區慶安里中山路483之31號","","500000","1001118","1031226"
"1363","53635039","宏邦油品股份有限公司","臺中市北屯區水景里軍功路一段379號1樓","","2000000","1001121","1031204"
"1364","53635256","益源設計有限公司","臺中市西屯區台中港路三段108-6號8樓之2","","800000","1001121","1031228"
"1365","53636662","興鎂有限公司","新竹市東區東勢里東明街98-1號5樓","","100000","1001123","1031201"
"1366","53637825","鉦達昌工程有限公司","基隆市七堵區福一街176號","","1000000","1001125","1031217"
"1367","53641166","奕興國際有限公司","高雄市苓雅區光華一路148之68號2樓","","5000000","1001202","1031209"
"1368","53642377","精鷹物業管理顧問有限公司","臺南市安南區溪北里郡安路四段74號地下一樓","","1000000","1001206","1031226"
"1369","53663870","金瑞傑有限公司","金門縣金城鎮北門里民生路25號10樓之3","","1000000","1020110","1031215"
"1370","53683550","商靖實業有限公司","新北市三重區捷運路69號3樓","","1000000","1010210","1031230"
"1371","53684592","耐特建材有限公司","桃園市八德區桃鶯路南僑巷2弄4號1樓","","3000000","1010216","1031208"
"1372","53685797","台灣優品創意科技有限公司","新北市深坑區北深路3段258號8樓","","1000000","1010222","1031226"
"1373","53685826","菩提樹科技有限公司","新北市蘆洲區民權路82巷5弄1號(1樓)","","1000000","1010222","1031231"
"1374","53688056","立龍開發有限公司","新北市新莊區建中街71巷10號5樓","","500000","1010305","1031203"
"1375","53690638","采捷廣告事業有限公司","新北市中和區永和路458巷3弄19號","","1000000","1010315","1031223"
"1376","53691073","飛瑞環境管理顧問股份有限公司","新北市林口區中山路564號3樓","","2000000","1010316","1031216"
"1377","53703887","金順成機電有限公司","新北市中和區連勝街149號3樓","","3000000","1010511","1031229"
"1378","53705288","源龍國際有限公司","新北市八里區龍米路2段200巷11號4樓","","6100000","1010517","1031215"
"1379","53708829","君鼎國際企業有限公司","新北市中和區福祥里福祥路122號2樓","","1000000","1010605","1031210"
"1380","53709279","越戶國際有限公司","新北市三重區和平街17號1樓","","1000000","1010606","1031212"
"1381","53710070","晶綻精品有限公司","新北市板橋區四川路2段91巷3號","","3000000","1010611","1031230"
"1382","53710212","好好開發有限公司","新北市樹林區南園里學勤路390號12樓","","500000","1010613","1031215"
"1383","53712963","東禾健康事業有限公司","新北市新店區安忠路57巷9弄2號5樓","","1000000","1010622","1031223"
"1384","53713610","允中實業股份有限公司","臺北市松山區南京東路4段197號9樓之1","","500000","1010627","1031227"
"1385","53714337","金揚不動產經紀有限公司","新北市板橋區文化路1段201號","","1000000","0950913","1031202"
"1386","53720400","緹美事業股份有限公司","新北市板橋區板新路107號8樓","","1000000","1010730","1031231"
"1387","53721301","連泰廣告有限公司","新北市三重區仁愛街315巷13號1樓","","2000000","1010803","1031229"
"1388","53721787","東璟科技有限公司","新北市汐止區樟樹一路198巷6號5樓","","100000","1010807","1031222"
"1389","53721843","元鼎不動產仲介有限公司","新北市新店區三民路109號(1樓)","","3000000","1010807","1031230"
"1390","53723103","朝悅電子有限公司","新北市板橋區和平路17號2樓","","1000000","1010814","1031211"
"1391","53723510","恆迎實業有限公司","新北市板橋區新埔里文化路1段435巷31弄11號(1樓)","","1000000","1010815","1031231"
"1392","53724068","愷岳石材有限公司","新北市三重區五華里進安街108號11樓","","3000000","1010817","1031226"
"1393","53724270","証山企業有限公司","新北市板橋區富山街71巷3之2號","","500000","1010820","1031230"
"1394","53727945","鑫晟印刷事業有限公司","桃園市中壢區榮安一街330號2樓之6","","300000","1010905","1031217"
"1395","53732834","萊客運動顧問股份有限公司","臺北市中山區長春路219號12樓之2","","1000000","1010119","1031225"
"1396","53738921","大立開發事業股份有限公司","臺北市萬華區西寧南路123號","","50000000","1010222","1031209"
"1397","53743614","樂活基因生物科技有限公司","臺北市信義區基隆路2段125號8樓之4","","17422263","1010308","1031225"
"1398","53743733","基業貿易有限公司","臺北市大安區信義路4段6號6樓","","500000","1010309","1031216"
"1399","53755548","台灣海信電器有限公司","臺北市南港區三重路66號3樓","","5000000","1010413","1031226"
"1400","53756027","一壽有限公司","臺北市信義區嘉興街216巷11號","","6100000","1010413","1031204"
"1401","53756201","新華資產管理顧問股份有限公司","臺北市萬華區西園路1段200號8樓之1","","2000000","1010416","1031210"
"1402","53758518","捷優資訊有限公司","臺北市信義區信義路5段150巷342弄43號","","1000000","1010423","1031231"
"1403","53762528","興采國際企業有限公司","臺北市內湖區成功路4段30巷12號8樓","","1000000","1010507","1031226"
"1404","53767621","心力量國際企管顧問有限公司","臺北市內湖區基湖路3巷1號6樓","","500000","1010523","1031205"
"1405","53768380","大鈞工程股份有限公司","臺北市大安區大安路1段101巷1號(1樓)","","5000000","1010524","1031218"
"1406","53772309","米福田健康素食有限公司","臺北市士林區中山北路5段829巷14號2樓","","1000000","1010607","1031217"
"1407","53772384","訊益科技股份有限公司","臺北市松山區復興北路331號6樓","","5000010","1010606","1031205"
"1408","53773617","果漾傳播有限公司","臺北市松山區富錦街344號1樓","","1200000","1010611","1031223"
"1409","53775734","英特利國際有限公司","臺北市中山區南京東路2段20號10樓","","1000000","1010619","1031229"
"1410","53777796","星寶維有限公司","臺北市北投區裕民六路3號10樓","","1800000","1010626","1031231"
"1411","53782799","原恆國際有限公司","桃園市楊梅區上湖里楊湖路三段846巷95弄125號1樓","","2000000","1001227","1031216"
"1412","53782876","萬世達物業管理顧問股份有限公司","新竹市北區育英里西門街272巷10號","","1000000","1001228","1031209"
"1413","53783586","夏維若食品有限公司","臺中市大雅區六寶里中清路四段480號","","250000","1001228","1031216"
"1414","53783636","翰翔土木包工業有限公司","臺南市永康區東灣里大灣一街382號1樓","","800000","1001228","1031212"
"1415","53783679","鼎有力有限公司","臺中市大里區光明路20-11號1樓","","2000000","1001229","1031204"
"1416","53785228","博傑顧問有限公司","彰化縣鹿港鎮復興路37號","","500000","1010102","1031208"
"1417","53786514","豐安生技開發有限公司","臺中市西區忠明里臺灣大道二號498號17樓之2","","3000000","1010104","1031222"
"1418","53786660","世界國際海洋生物科技股份有限公司","桃園市平鎮區平安里中豐路南勢一段158巷47號1樓","","10000000","1010104","1031216"
"1419","53792522","艾保隆橡膠科技有限公司","南投縣草屯鎮碧山路853號1樓","","2000000","1010118","1031209"
"1420","53794205","三瑪建設有限公司","臺中市西區精誠25街2號底層","","10500000","1010120","1031204"
"1421","53800874","鈦盛國際有限公司","臺南市東區虎尾里東門路三段179巷153弄33號","","4000000","1010214","1031229"
"1422","53801769","帛昕建設有限公司","臺中市太平區樹孝路274巷24號2樓","","5000000","1010216","1031202"
"1423","53803247","川山有限公司","新竹市虎山里延平路一段487巷1號1樓","","3000000","1010220","1031219"
"1424","53809045","德驛貿易有限公司","桃園市新屋區頭洲里快速路六段876-1號1樓","","2000000","1010302","1031222"
