"序號","統一編號","公司名稱","公司所在地","代表人","資本額","核准設立日期","核准解散日期"
"206","24849244","汎安有限公司","桃園市楊梅區瑞溪里梅獅路二段166巷13號6樓","","1000000","1031203","1040204"
"207","24857834","鎧全有限公司","桃園市中壢區內厝里福全路240巷11號","","300000","1031230","1040211"
"208","24861339","九三餐坊有限公司","桃園市中壢區興仁路二段93號","","100000","1040113","1040206"
"209","25009416","法樂琦有限公司","臺南市中西區永福里民生路1段89號1丶2樓","","500000","0980806","1040216"
"210","25019033","飛騰整合行銷有限公司","新北市新店區安康路2段183巷18號5樓","","3000000","0980824","1040226"
"211","25023070","皓東事業股份有限公司","臺南市南區文南里長南街32號1樓","賴增華","22000000","0980831","1040206"
"212","25030728","紹罡企業有限公司","宜蘭縣宜蘭市東村里校舍路29巷117號1樓","","600000","0980914","1040205"
"213","25056705","樂活投資股份有限公司","臺北市中山區新生北路3段64號9樓之7","","7080000","0981023","1040217"
"214","25060948","家鑫貿易有限公司","桃園市桃園區同安里大興西路1段325號8樓之2","","1000000","0981102","1040226"
"215","25062376","桂旺酒品有限公司","苗栗縣三灣鄉中正路127號2樓","","500000","0981103","1040202"
"216","25064959","凱富科技有限公司","新北市中和區正行里圓通路145巷7號1樓","","500000","0981106","1040217"
"217","25079778","至展貿易有限公司","新北市三重區福隆里自強路4段31巷13號12樓","","12968700","0981201","1040213"
"218","25089017","飛哥裝潢工程有限公司","新北市中和區內南里興南路2段142巷19弄3之3號","","1000000","0981216","1040202"
"219","25090387","康林生命科學股份有限公司","臺北市北投區裕民六路122號7樓","","1000000","0981217","1040211"
"220","25103720","達陸廣告有限公司","臺北市中山區南京東路3段1號5樓","","800000","0990209","1040210"
"221","25107205","醫發生技有限公司","臺北市松山區復興北路179號5樓","","250000","0990303","1040213"
"222","25109338","三喜汽車有限公司","基隆市安樂區樂利二街62巷78號1樓","","5000000","0990311","1040202"
"223","25112191","佳展國際事業有限公司","臺北市中山區南京東路2段50號3樓","","2000000","0990315","1040206"
"224","25124083","長宏國際開發有限公司","臺北市中山區龍江路118號1樓","","1000000","0990427","1040202"
"225","25124252","永霓國際娛樂有限公司","桃園市龜山區復興一路212巷3號1樓","","1700000","0990427","1040202"
"226","25132561","晏翔國際有限公司","臺北市中山區吉林路245號3樓","","500000","0990526","1040209"
"227","25133175","寬鈜國際有限公司","新北市汐止區樟樹一路2巷55號9樓","","600000","0990528","1040212"
"228","25137138","康瑞得生技有限公司","臺南市北區育德路607號","","1000000","0990610","1040206"
"229","25139950","安圖瑞有限公司","臺北市信義區基隆路2段15號10樓","","500000","0990622","1040216"
"230","25140041","威達軟體有限公司","臺北市大安區忠孝東路4段206之1號4樓","","2000000","0990622","1040212"
"231","25142673","達慶不動產有限公司","臺北市北投區致遠一路2段99號1樓","","300000","0990630","1040206"
"232","25142982","太傑科技有限公司","臺北市信義區松德路65號9樓之5","","1000000","0990701","1040213"
"233","25169623","尚典智權資訊有限公司","彰化縣員林鎮惠來里惠明街89號2樓","","2000000","0990210","1040212"
"234","25174436","同君實業有限公司","臺中市北屯區水湳里文心路四段83號地下室一層","","100000","0990302","1040215"
"235","25175370","超纖國際企業有限公司","高雄市鳳山區建國路二段177號1樓","","1000000","0990304","1040216"
"236","25177829","杰佑實業有限公司","臺中市清水區橋頭里五權東路160號2樓","","660000","0990310","1040130"
"237","25185362","駿龍科技有限公司","臺南市善化區坐駕里青年路166巷8號1樓","","4000000","0990324","1040209"
"238","25197705","睿盛實業股份有限公司","桃園市八德區大興里重慶街150巷36弄5號2樓","","1000000","0990416","1040205"
"239","25199540","暢達精密科技股份有限公司","桃園市桃園區大興西路2段273號4樓之1","","10000000","0990421","1040209"
"240","27218895","辰秝企業有限公司","高雄市鼓山區華寧路50號3樓","","500000","0940224","1040130"
"241","27270218","和新欣有限公司","臺東縣東河鄉都蘭村都蘭一○一號","","1000000","0930420","1040203"
"242","27318682","寰創國際有限公司","臺北市大安區光復南路672號10樓之1","","3000000","0930512","1040226"
"243","27328957","訊開科技股份有限公司","臺北市中山區民權西路20號9樓之1","","5000000","0930610","1040206"
"244","27344892","昱承欣業有限公司","臺北市松山區健康路42號1樓","","500000","0930726","1040212"
"245","27348525","瑞品國際有限公司","臺北市中山區南京西路1之2號4樓","","1000000","0930804","1040224"
"246","27349192","天翼創意設計有限公司","嘉義市東區新開里垂楊路45號3樓","","500000","0930805","1040212"
"247","27360999","知識通訊評論股份有限公司","臺北市北投區石牌路2段47號3樓","","10000000","0930914","1040225"
"248","27369210","翰詮生物科技有限公司","臺北市中山區南京東路3段101號7樓","","10000000","0931006","1040202"
"249","27415306","泰虹科技股份有限公司","桃園市桃園區興隆路2號","","1000000","0930804","1040211"
"250","27420336","昆省留學服務有限公司","臺中市沙鹿區賢忠街2號1樓","","500000","0930810","1040203"
"251","27435823","匯財貿易有限公司","桃園市中壢區福星三街73號1樓","","2000000","0930901","1040225"
"252","27437012","宏展德有限公司","嘉義縣鹿草鄉施家村施厝寮五○號","","500000","0930903","1040202"
"253","27438244","崴擎科技股份有限公司","新北市中和區新生街30巷8號1樓","","5000000","0930906","1040206"
"254","27439497","富瓏壓鑄實業有限公司","雲林縣斗南鎮林子里林子九七︱二號","","1000000","0930907","1040225"
"255","27480039","光鋒國際科技有限公司","新北市中和區中山路二段三三號五樓之七","","500000","0931101","1040202"
"256","27486060","益泓工程有限公司","新北市中和區圓通路305巷7弄3之2號","","2000000","0931109","1040205"
"257","27512089","航瀚有限公司","基隆市七堵區東新街四五巷九之一號二樓","","1000000","0931213","1040209"
"258","27519674","宥宣資訊有限公司","彰化縣員林鎮仁愛里成功東路200號","","5000000","0931221","1040212"
"259","27532281","謦楓設計工程有限公司","臺北市南港區興中路28巷7號1樓","","1000000","0931112","1040217"
"260","27533649","金恆多通路行銷有限公司","屏東縣屏東市空翔里迪化街５１之２號１樓","","500000","0931116","1040202"
"261","27599472","三峽金牛角有限公司","新北市三峽區中正路１段３０２號１樓","","500000","0940118","1040203"
"262","27611449","永隆食品工業股份有限公司","臺南市白河區草店里11鄰草店1之17號1樓","","11000000","0940201","1040224"
"263","27618626","丞力國際有限公司","新北市永和區中山路1段186號3樓","","3000000","0940215","1040204"
"264","27627596","聖燿實業有限公司","桃園市蘆竹區長興里南工路一段8-2號2樓","","5000000","0940302","1040211"
"265","27633422","采碩國際股份有限公司","臺中市南屯區大墩十二街３０４號１樓","","5000000","0940308","1040209"
"266","27636336","英美多益認證訓練有限公司","臺南市中西區成功路29號1樓","","2000000","0940311","1040210"
"267","27643126","永來事業有限公司","新北市中和區永和路１９１巷２１號","","1000000","0940321","1040212"
"268","27649711","普萊億烘焙食品有限公司","臺中市西屯區福和里福安十一街１８號１樓","","2000000","0940325","1040130"
"269","27653215","答城國際股份有限公司","新北市土城區永豐路203之1號1樓","","5000000","0940329","1040205"
"270","27694449","辰品烘焙有限公司","高雄市三民區大豐1路333號","","810000","0941017","1040206"
"271","27711637","豪友建築事業有限公司","高雄市苓雅區輔仁路212號1樓","","1000000","0950421","1040210"
"272","27725935","利榮機械有限公司","臺北市中山區民生西路29號1樓","","1000000","0940513","1040211"
"273","27738116","善祥科技有限公司","新竹市東區公園里東大路一段39巷15號4樓","","6000000","0940616","1040225"
"274","27746559","珈浚工程有限公司","臺北市中正區濟南路2段24、24之10號","林采晴","5000000","0940708","1040224"
"275","27758870","道格管理顧問有限公司","臺北市大同區民族西路31巷14號1樓","","1000000","0940815","1040213"
"276","27776618","艾達數碼股份有限公司","新竹縣竹北市莊敬南路65號9樓","","8680000","0940502","1040206"
"277","27800005","慶鴻水電工程有限公司","彰化縣彰化市下廍里茄苳路一段36號1樓","","5000000","0940526","1040204"
"278","27818960","祐佃企業有限公司","臺中市南屯區大墩路６４號１樓","","500000","0940616","1040202"
"279","27830177","鴻崴國際有限公司","新北市新莊區新莊路４２６號１樓","","1000000","0940629","1040211"
"280","27837447","米凱室內裝修有限公司","新竹市磐石里西大路709巷11-6號","","5000000","0940706","1040206"
"281","27847521","台灣金綜合保險代理人股份有限公司","臺中市北區健行里忠明路200號13樓之1","","3000000","0940720","1040209"
"282","27849561","速霸科技有限公司","臺中市大甲區義和里重義一路３１號","","2000000","0940722","1040204"
"283","27852328","祥倫科技有限公司","臺中市潭子區聚興里興豐山莊297號","","1000000","0940726","1040212"
"284","27852690","佳麗寶國際有限公司","新北市五股區民義路１段１８３巷１０之３號","","5000000","0940726","1040204"
"285","27855486","康碩資訊股份有限公司","臺中市大里區爽文路835號3樓","","2000000","0940728","1040212"
"286","27921063","正商鞋材有限公司","新北市三重區碧華街390號1樓","","1000000","0941018","1040216"
"287","27955078","台灣漂兒娛樂股份有限公司","臺北市大安區忠孝東路3段217巷4弄10號","","3000000","0941003","1040210"
"288","27955197","威慎實業有限公司","臺北市大安區信義路4段184號12樓","","5000000","0941003","1040211"
"289","27957879","輝倡有限公司","臺北市萬華區昆明街76號6樓之1","","5000000","0941011","1040206"
"290","27969707","平洋投資有限公司","臺北市中正區新生南路1段6號10樓","","10000000","0941111","1040225"
"291","27972301","德美藥業有限公司","臺北市中山區明水路355號1樓","","3000000","0941121","1040213"
"292","28002985","金凱科技光學股份有限公司","桃園市龜山區南上里民生北路1段40之2號5樓之8","","15805100","0950308","1040212"
"293","28003295","快樂地旅行社股份有限公司","臺北市中山區南京東路2段100號5樓C室","","8000000","0950310","1040226"
"294","28016117","兆騰有限公司","高雄市鳳山區正義里甲智路155巷6號","","1000000","0941025","1040205"
"295","28017592","匯豐不動產有限公司","新竹縣竹北市勝利八街二段51號1樓","","1900000","0941027","1040217"
"296","28030005","感動科技股份有限公司","苗栗縣頭份鎮蟠桃里華美街27號","","10000000","0941111","1040210"
"297","28042608","法藍爸爸有限公司","臺中市西屯區東興路三段392號1樓","","2700000","0941129","1040216"
"298","28044438","台灣小肥羊餐飲事業有限公司","新竹市東區金山里金山七街12號1樓","","4000000","0941201","1040216"
"299","28044839","譁誠科技有限公司","新竹市香山里大庄路106號","","10000000","0941201","1040211"
"300","28089862","宏源纖維科技有限公司","新北市新莊區中港路217號2樓","","1000000","0950208","1040203"
"301","28099849","祥豪水產企業有限公司","屏東縣東港鎮興東里中正路二段２９巷４６之２號１樓","","5000000","0950224","1040209"
"302","28112929","聚成科技股份有限公司","","","0","0990303","1040216"
"303","28126732","富庭實業有限公司","桃園市桃園區中山里泰昌十二街111號6樓","","5000000","0950321","1040204"
"304","28135789","瑞中建設有限公司","雲林縣虎尾鎮穎川里林森路2段423號1樓","","10000000","0950330","1040130"
"305","28151289","東映行銷有限公司","桃園市楊梅區中山南路３２６號１樓","","6000000","0950417","1040224"
"306","28152267","和正科技有限公司","桃園市平鎮區福林里東豐路219號","","1000000","0950418","1040213"
"307","28188568","趨勢光學股份有限公司","臺北市大同區南京西路123號8樓","","30531780","0950526","1040203"
"308","28204510","騏鶴有限公司","新北市板橋區民生路1段119號1樓","","2000000","0950721","1040226"
"309","28215333","來運興業有限公司","基隆市暖暖區源遠路292巷15號1樓","","500000","0950828","1040225"
"310","28284416","富正工程股份有限公司","高雄市前鎮區民權2路380號11樓之3","","2000000","0950620","1040209"
"311","28285344","亞沅國際有限公司","高雄市鼓山區葆禎路68巷15號1樓","","2000000","0950630","1040206"
"312","28319294","麥仕創意有限公司","臺中市西屯區上明一街2之3號1樓","","1000000","0950522","1040209"
"313","28327631","大彰汽車檢驗廠股份有限公司","彰化縣鹿港鎮泰興里彰鹿路八段32之1號","","1000000","0950602","1040213"
"314","28340183","德明萬銀股份有限公司","臺中市北區大雅路５７號８F–１","","2000000","0950619","1040205"
"315","28347777","愛彌兒科技有限公司","臺中市龍井區田中里7鄰龍北路58號","","500000","0950628","1040210"
"316","28349516","道駿工程有限公司","高雄市仁武區文武里新庄路240號","","1000000","0950703","1040212"
"317","28364163","馬輚數位時尚股份有限公司","臺北市萬華區昆明街249號","","19600000","0950721","1040210"
"318","28369358","訊鴻有限公司","桃園市桃園區中正五街207號4樓之2","","1000000","0770728","1040206"
"319","28371517","三永久企業有限公司","彰化縣秀水鄉彰水路1段646號","","500000","0950801","1040202"
"320","28376597","睿誠金屬有限公司","新北市五股區成泰路3段357號","","1000000","0950809","1040202"
"321","28377694","都衛有限公司","新北市三重區安慶街145號2樓","","3000000","0950810","1040212"
"322","28384246","洋博士國際有限公司","新北市瑞芳區三爪子坑路230號1樓","","5000000","0950818","1040205"
"323","28400127","皇祈建設有限公司","新北市鶯歌區信義街46號2樓","","500000","0950913","1040210"
"324","28471419","遠播電通有限公司","臺北市松山區民生東路4段54號6樓之11","","1000000","0960208","1040209"
"325","28481063","鉅枋工程有限公司","臺北市中山區合江街180巷16號1樓","","3000000","0960323","1040226"
"326","28483196","宜承資訊股份有限公司","高雄市左營區崇德路68號3樓","","1000000","0960402","1040204"
"327","28486270","榮德貿易有限公司","桃園市龜山區文德二路148巷12號4樓","","10000000","0960412","1040212"
"328","28487448","台灣京戰煙火有限公司","臺北市中正區南昌路1段88號10樓","","500000","0960416","1040216"
"329","28583688","玉星天下實業有限公司","新竹縣竹東鎮中山里長春路1段109號1樓","","6000000","0960216","1040225"
"330","28592482","基銘營造工程有限公司","高雄市左營區文康路197號5樓","吳清基","15000000","0960620","1040216"
"331","28597888","盛凱實業股份有限公司","高雄市左營區博愛4路401號2樓之5","","2000000","0960906","1040210"
"332","28611734","糖果屋不動產仲介有限公司","高雄市左營區新庄仔路574號","","500000","0970327","1040213"
"333","28616549","久天水電有限公司","高雄市前鎮區武德街140巷23號1樓","","12000000","0970602","1040206"
"334","28626201","宇陽工程有限公司","苗栗縣後龍鎮龍坑里15鄰十班坑153-6號1樓","","5600000","0960321","1040206"
"335","28669382","合佑建設有限公司","桃園市大園區中正東路3段590號1樓","","5000000","0960521","1040217"
"336","28700840","永年物業行銷股份有限公司","臺北市中山區南京東路2段137號14樓","","22000000","0960809","1040226"
"337","28730632","淯晴生化科技有限公司","彰化縣永靖鄉瑚璉村瑚璉路117號","","500000","0960607","1040225"
"338","28730823","崧均工程企業有限公司","桃園市八德區大安里建安街9巷14號","","1000000","0960607","1040203"
"339","28747303","芃吉亞有限公司","新竹縣竹北市竹義里中正西路56巷16號2樓","","500000","0960702","1040224"
"340","28748008","煙火王有限公司","桃園市平鎮區振平街226號3樓","","500000","0960703","1040226"
"341","28768432","亮顏平衡美學有限公司","臺中市北區民權路531號1樓","","500000","0960801","1040204"
"342","28788520","辰旺產業有限公司","臺南市安南區安生街171巷2號","","500000","0960904","1040216"
"343","28806196","豐福國際事業有限公司","臺南市東區裕農路668巷51弄8號之3  1樓","","1000000","0961008","1040202"
"344","28811016","多酪蜜實業有限公司","新竹市北門街36號1樓","","500000","0961016","1040210"
"345","28826263","岳鴻電子有限公司","臺北市內湖區南京東路6段451巷57號3樓之2","","5000000","0961120","1040209"
"346","28842812","第一旺國際有限公司","臺北市中山區民生東路1段43號3樓","","1000000","0970125","1040217"
"347","28849907","尚芸有限公司","臺北市中正區懷寧街44號","","500000","0970306","1040204"
"348","28862339","天德瑞國際物業顧問有限公司","臺北市松山區南京東路5段145-1號5樓","","3000000","0970421","1040225"
"349","28888555","聖順成有限公司","新北市板橋區振義里中山路2段539巷6號3樓","","500000","0961203","1040205"
"350","28888680","馨創國際有限公司","桃園市中壢區福州一街234號","","500000","0961203","1040205"
"351","28909741","豪男有限公司","高雄市鳳山區頂興街170號","","1000000","0970108","1040206"
"352","28926740","翔瀚股份有限公司","","","0","0970212","1040225"
"353","28926988","弘力貿易有限公司","臺中市太平區宜昌東路45號","","500000","0970212","1040206"
"354","28951748","竺昇實業有限公司","高雄市鳳山區文德里文中街234巷12號1樓","","3000000","0970327","1040224"
"355","28953106","鉅揚科技工程有限公司","新竹縣竹北市福德里博愛街473巷17弄3號","","1000000","0970328","1040204"
"356","28967798","得康興業有限公司","桃園市八德區大福里介壽路1段46號1樓","","500000","0970418","1040209"
"357","29025917","夏洛克有限公司","高雄市鼓山區龍勝路72號13樓","","380000","0980821","1040130"
"358","29028560","滷將軍食品有限公司","高雄市楠梓區美昌街192號","","1000000","0980925","1040210"
"359","29035513","捷通網路科技股份有限公司","臺北市內湖區瑞光路298號6樓","","5000000","0970611","1040224"
"360","29053363","全晨照明有限公司","臺北市中正區重慶南路3段36巷7號","","1000000","0970818","1040204"
"361","29054145","亞宸科技有限公司","新北市三重區福德南路65巷10號(1樓)","","500000","0970820","1040210"
"362","29061510","承品生技開發有限公司","臺北市中山區南京東路3段189號10樓","","1000000","0970923","1040210"
"363","29063708","佶優實業有限公司","新北市三重區溪美里仁政街109號3樓","","1000000","0971003","1040225"
"364","29074677","展麒國際股份有限公司","臺北市中山區南京東路1段86號6樓之7","","3000000","0980703","1040202"
"365","29101225","聯立興業有限公司","桃園市龜山區民生北路1段256巷6弄1號1樓","","5000000","0970527","1040202"
"366","29117970","銓懋不動產經紀業有限公司","臺中市豐原區南陽里安康路24號一樓","","1200000","0970625","1040211"
"367","29130729","汩橙農產有限公司","新北市三重區三民街85巷3號1樓","","1000000","0990104","1040213"
"368","29137954","宜園祥不動產有限公司","新北市林口區南勢里文化三路1段177號","","2000000","0990212","1040204"
"369","29142751","錸馬斯特科技有限公司","新北市永和區福和路385號(1樓)","","5000000","0990318","1040224"
"370","29154088","森澤木塑材料股份有限公司","新北市新莊區五權三路12巷1號","","30500000","0990505","1040212"
"371","29171811","森鑫國際開發股份有限公司","臺北市萬華區長沙街2段62號3樓","","12000000","0990723","1040216"
"372","29180966","偉達醫藥有限公司","新北市中和區圓通路367巷33弄103號2樓","","1000000","0990908","1040202"
"373","29768396","福斯汽車股份有限公司","","","0","0580808","1040224"
"374","30824473","榮昇煤氣有限公司","臺北市大安區瑞安街226號","","1500000","0550330","1040224"
"375","30934008","森駿實業有限公司","臺北市大安區瑞安街120巷10弄6號1樓","","1000000","0691226","1040212"
"376","30958319","世瓏貿易股份有限公司","臺北市內湖區康寧路3段99巷39弄38號8樓","","20000000","0701012","1040202"
"377","31151208","昀陽企業有限公司","臺北市松山區南京東路5段162號6樓之1","","5000000","0700519","1040213"
"378","33937508","正武煤氣有限公司","新北市新店區北宜路2段238號1樓","","2500000","0640520","1040226"
"379","34306368","萬年大飯店股份有限公司","新北市中和區中山路2段162號1、2、3、4、5、6樓","","16000000","0670418","1040210"
"380","34472149","山富紙業股份有限公司","","","0","0701205","1040213"
"381","34554768","彩樂電子股份有限公司","","","0","0711116","1040216"
"382","36038085","信洲精工廠有限公司","新北市新莊區中港路二九九巷三一號","","6000000","0690830","1040203"
"383","36109216","上茂紙器實業有限公司","新北市汐止區湖前街110巷97弄10號19樓","","1000000","0710608","1040209"
"384","36231758","復盛興業有限公司","新北市新莊區思源路593巷10號3樓","","5000000","0730613","1040204"
"385","36312935","貫捷電子有限公司","新北市新莊區福營路二二七巷九號","","20000000","0740423","1040210"
"386","42097982","功岱企業有限公司","宜蘭縣羅東鎮竹林街399號","","3000000","0740105","1040203"
"387","47085134","豐市有限公司","新竹縣竹東鎮仁愛里北興路二段21號2樓之2","","25000000","0710403","1040216"
"388","52346659","藍燈文化事業股份有限公司","臺中市北屯區東山路２段６７巷１１號１樓","","1500000","0761029","1040225"
"389","52443033","可口電器工業股份有限公司","臺中市西屯區福安里福安三街37號1樓","","5000000","0661005","1040206"
"390","53031925","禎合科技股份有限公司","新竹縣竹北市北崙里16鄰光明三路136號3樓","","3000000","0990427","1040203"
"391","53037385","台灣普萊姆有限公司","臺中市沙鹿區竹林里臺灣大道七段662號1樓","","1000000","0990505","1040130"
"392","53046954","旭能國際有限公司","臺中市大里區東湖里中湖路8巷5弄20號","","500000","0990524","1040212"
"393","53051127","晉宬有限公司","臺中市東區東信里一心街271之2號1樓","","500000","0990601","1040211"
"394","53075752","溢品國際事業有限公司","臺中市西屯區太原路1段13號2樓","","1300000","0990721","1040211"
"395","53087048","貝斯特防火材料開發有限公司","新北市板橋區溪城路109號8樓","","20000000","0990825","1040206"
"396","53092149","峻紘管理顧問有限公司","臺北市中山區林森北路100號7樓之5","","1000000","0990914","1040202"
"397","53099065","勝葉科技有限公司","臺北市大安區忠孝東路4段148號6樓之6","","5000000","0991008","1040210"
"398","53111814","鐵人化計畫股份有限公司","臺北市中正區忠孝西路1段50號16樓","","5000000","0991125","1040203"
"399","53116418","頡學有限公司","臺北市信義區松山路465巷46號2樓","","3000000","0991213","1040211"
"400","53127219","星合生技股份有限公司","臺北市中山區松江路206號3樓","","2400000","1000120","1040217"
"401","53140629","瑞史博有限公司","臺中市南屯區文心路1段186號15樓之8","","500000","0990818","1040205"
"402","53142181","浡鴻貿易有限公司","臺南市安南區安和路一段96巷42弄25號1樓","","600000","0990820","1040216"
"403","53154550","禾家馨實業有限公司","臺中市霧峰區吉峰里吉峰東路13號1樓","","1000000","0990916","1040206"
"404","53154904","浤展科技有限公司","桃園市桃園區大興西路2段1號7樓","","3000000","0990916","1040202"
"405","53158991","瀚巨實業有限公司","新北市鶯歌區尖山路258巷23號3樓","","2000000","0990927","1040211"
"406","53164430","鋐釔材料股份有限公司","高雄市燕巢區中華路300號","","2000000","0991006","1040225"
"407","53179031","鉅鋐國際股份有限公司","桃園市桃園區中山里國際路一段1002號","","8000000","0991104","1040216"
"408","53185842","光彩資訊股份有限公司","新北市汐止區新台五路1段77號7樓之6","","500000","0991014","1040226"
"409","53186096","鴻霖不動產有限公司","新北市板橋區新民街7巷27號1樓","","1000000","0991014","1040205"
