"序號","統一編號","公司名稱","公司所在地","代表人","資本額","核准設立日期","核准解散日期"
"410","53189967","主信室內裝修工程有限公司","新北市林口區林口里仁愛路1段40號（1樓）","","3000000","0991103","1040204"
"411","53197312","賀菩貿易有限公司","臺中市神岡區社口里中山路928號","","65000000","0991208","1040209"
"412","53201456","英毓環境科技有限公司","新北市三重區安慶街328號","","1000000","0991229","1040206"
"413","53204685","佛馨香品有限公司","新北市土城區員林街10之1號2樓","","300000","1000113","1040226"
"414","53214924","鑫苔貿易有限公司","新北市新店區竹林路2巷23號","","1000000","1000311","1040216"
"415","53221024","益創有限公司","新北市新莊區中正路334巷11號1樓","","300000","1000407","1040209"
"416","53225507","璟裕國際食品有限公司","新北市永和區得和路109號4樓","","100000","1000426","1040204"
"417","53226800","冠嘉國際實業有限公司","新北市新莊區幸福路823號2樓","","300000","1000502","1040204"
"418","53227224","五一八網路科技股份有限公司","","","0","1000504","1040203"
"419","53252840","詠聯國際行銷有限公司","高雄市小港區高坪七路1200號1樓","","500000","1000708","1040130"
"420","53256402","羅丹國際有限公司","高雄市大社區大社路208號1樓","","1000000","1000810","1040213"
"421","53268322","海滬資訊有限公司","臺中市西屯區惠來里市政路500號25樓之6","","5000000","0991124","1040206"
"422","53279165","詮佳房屋仲介股份有限公司","臺中市南屯區永春東路556號1樓","","10000000","0991217","1040213"
"423","53301737","沅信建設有限公司","臺中市清水區西社里中華路399號1樓","","3600000","1000131","1040226"
"424","53310588","天韻健康事業股份有限公司","臺北市中正區許昌街17號4樓","","10000000","1000201","1040226"
"425","53310623","格林威股份有限公司","臺北市松山區復興北路181號7樓","","1000000","1000201","1040206"
"426","53312679","禾良有限公司","臺北市萬華區桂林路242巷19號2樓","","500000","1000217","1040216"
"427","53318694","師大五八有限公司","臺北市大安區龍泉街58號","","1000000","1000311","1040225"
"428","53319461","清景有限公司","臺北市中山區中山北路2段128巷6弄5號3樓之9","","2000000","1000314","1040202"
"429","53333631","典真有限公司","臺北市內湖區成功路2段498巷8號","","5000000","1000427","1040216"
"430","53345778","金廣國際餐飲有限公司","臺北市中山區北安路621巷49號1樓","","4300000","1000603","1040209"
"431","53347608","瑞茶堂有限公司","臺北市大安區和平東路1段202號4樓","","1000000","1000610","1040204"
"432","53349872","阮氏塗佈科學有限公司","臺北市中山區北安路621巷30號4樓","","15000000","1000617","1040202"
"433","53351519","立翔貿易有限公司","臺北市大安區延吉街70巷5弄2之1號","","2000000","1000623","1040211"
"434","53359580","春信資源回收有限公司","彰化縣鹿港鎮溝墘里溝尾巷17號1樓","","1000000","1000301","1040225"
"435","53363091","上鼎精密有限公司","桃園市桃園區龍祥里大慶街480巷13號","","250000","1000307","1040204"
"436","53363753","鴻輪興業有限公司","桃園市中壢區忠義里中園路32號11樓","","1000000","1000307","1040204"
"437","53370760","米粧有限公司","臺中市大雅區文雅里中山北路470巷10號","","1000000","1000321","1040206"
"438","53371655","丞淳股份有限公司","南投縣埔里鎮枇杷里樹人一街127號","","500000","1000322","1040203"
"439","53372280","宜家不動產開發有限公司","桃園市大園區大園里中山南路132號","","1000000","1000323","1040217"
"440","53373128","源鴻不動產仲介經紀有限公司","臺南市安南區梅花里安中路1段499號","","1000000","1000324","1040204"
"441","53380541","台立全有限公司","臺中市潭子區潭興路一段17巷12之2號","","5000000","1000408","1040202"
"442","53383385","世勇有限公司","臺南市永康區復國里復華六街109號","","10000000","1000413","1040216"
"443","53390132","奧立夫有限公司","基隆市七堵區百五街53號3樓","","300000","1000425","1040226"
"444","53391630","實盈事業有限公司","新北市新店區中興路3段205巷8弄6號2樓","","1000000","1000427","1040209"
"445","53396419","雅旭光電股份有限公司","","","0","1000506","1040206"
"446","53408772","正一資源回收有限公司","臺中市太平區東平路187-1號1樓","","300000","1000530","1040209"
"447","53418510","勝達冷氣空調有限公司","新北市板橋區仁翠里四維路339巷12號4樓","","5000000","1000627","1040206"
"448","53421803","愛旺國際有限公司","新北市土城區裕民路214巷2號","","100000","1000711","1040226"
"449","53425414","雄寶股份有限公司","新北市泰山區山腳里泰林路2段234號1樓","","5500000","1000726","1040211"
"450","53427010","節寶綠能股份有限公司","新北市中和區安樂路245號","","19343500","1000802","1040213"
"451","53435264","毅達通國際有限公司","臺北市中山區南京東路3段201號3樓","","200000","1000906","1040211"
"452","53452262","巨恆生技開發有限公司","臺北市信義區永吉路180巷30弄14號7樓","","500000","1001013","1040213"
"453","53452636","益祺團購科技股份有限公司","臺北市松山區光復北路11巷35號5樓","","10000000","1001013","1040204"
"454","53457225","致銓資訊有限公司","新北市三峽區學成路222號(1樓)","","500000","1001104","1040216"
"455","53470640","翊辰科技有限公司","臺中市北屯區三和里東光路884巷45號1樓","","100000","1000601","1040226"
"456","53476356","集購邦網路科技有限公司","臺中市北屯區三光里三光北一街68號1樓","","100000","1000614","1040209"
"457","53491498","致眾自動化機械有限公司","桃園市桃園區自強里經國路336巷30號2樓","","1000000","1000712","1040224"
"458","53502164","明望建設有限公司","屏東縣屏東市豐田里瑞光路2段56號1樓","","500000","1000801","1040225"
"459","53515800","冠福工業有限公司","臺中市大里區仁愛路160巷137號2樓","","4500000","1000829","1040210"
"460","53516478","承巨貿易有限公司","彰化縣員林鎮仁美里和平東街46號2樓","","5000000","1000830","1040206"
"461","53517722","域樂天有限公司","桃園市八德區和平路28號、30號1樓","","500000","1000901","1040205"
"462","53531338","欣鋒國際有限公司","臺北市大安區敦化南路2段57號15樓之1","","200000","1000826","1040216"
"463","53531371","德邑股份有限公司","臺北市信義區東興路45號10樓","","10000000","1000826","1040204"
"464","53531386","欣鋐國際有限公司","臺北市大安區敦化南路2段57號15樓之1","","200000","1000826","1040216"
"465","53534905","華哲科技股份有限公司","臺北市中山區林森北路627號5樓之4","","5000000","1000908","1040226"
"466","53539346","老饕蘇生活美食有限公司","新北市蘆洲區集賢路209號","","1000000","1000926","1040226"
"467","53539845","佳世得實業有限公司","臺北市中山區中山北路1段83巷13號4樓之17","","1000000","1000928","1040202"
"468","53543593","富必達國際事業有限公司","臺北市萬華區內江街51號8樓之1","","7000000","1001011","1040211"
"469","53554872","正鴻投資有限公司","臺北市信義區信義路4段450巷9號9樓","","1000000","1001116","1040206"
"470","53555020","保綠金國際開發股份有限公司","臺北市內湖區新湖二路228號4樓","","20000000","1001116","1040226"
"471","53568860","里洋食品有限公司","臺北市中正區館前路65號11樓","","250000","1010105","1040216"
"472","53575692","饗宴美食有限公司","高雄市阿蓮區中山路72巷22號9樓之1","","51000","1001108","1040224"
"473","53578895","銳錁貿易有限公司","高雄市大寮區仁勇路23號","","300000","1001207","1040225"
"474","53580029","尚立投資股份有限公司","高雄市鼓山區明華路７５號２樓","","39160000","1001219","1040202"
"475","53584313","騰田建設股份有限公司","高雄市三民區熱河二街１５號３樓","","6000000","1010206","1040210"
"476","53588205","麥香魚水產有限公司","高雄市前鎮區佛中路66號10樓","","5000000","1010313","1040202"
"477","53597112","謙謙文化創意有限公司","高雄市鼓山區河西一路1351號7樓","","1000000","1010524","1040224"
"478","53597210","豪十七有限公司","高雄市三民區鼎山街353號2樓","","1000000","1010524","1040211"
"479","53597247","和展食品有限公司","高雄市三民區應安街86號12樓","","500000","1010524","1040205"
"480","53597561","廣騏投資顧問有限公司","高雄市三民區鼎華路191號1樓","","70000000","1010528","1040210"
"481","53600432","韓尚鋼鐵有限公司","桃園市桃園區大興西路二段3號9樓之2","","3000000","1000907","1040205"
"482","53610728","穎川堂藝創行銷有限公司","苗栗縣公館鄉館南村仁愛路1段135號一樓","","1000000","1000929","1040224"
"483","53612205","頂嵂房屋仲介有限公司","臺中市南區忠明南路788號1樓","","300000","1001003","1040205"
"484","53615168","威利達國際有限公司","桃園市桃園區三元里大有路152號11樓之5","","300000","1001007","1040202"
"485","53616602","奈妍企業有限公司","嘉義縣義竹鄉東過村16鄰5號","","1000000","1001012","1040210"
"486","53625671","永安展業有限公司","桃園市桃園區守法路40巷5之3號","","10000000","1001031","1040212"
"487","53627143","廣豐文創有限公司","桃園市中壢區永福路1122號14樓","","2000000","1001102","1040204"
"488","53629727","岩誠居建材有限公司","桃園市平鎮區北興里正義路157號1樓","","1000000","1001108","1040205"
"489","53631104","永樂醫療器材股份有限公司","彰化縣員林鎮新生里至平街50巷39號1樓","","2000000","1001110","1040204"
"490","53631511","智耀國際有限公司","新竹縣竹北市竹仁里四維街207號1樓","","250000","1001111","1040217"
"491","53637304","富暘開發建設有限公司","桃園市中壢區忠義里中園路28之16號15樓","","5000000","1001124","1040210"
"492","53641399","樂比有限公司","臺中市北屯區北興里國強街218巷17號1樓","","3000000","1001202","1040222"
"493","53683860","筑砌設計工程有限公司","新北市新店區忠誠里北新路2段139巷17號1樓","","5000000","1010214","1040225"
"494","53684679","水王水素有限公司","新北市土城區頂新里中央路4段281之7號15樓之3","","500000","1010216","1040202"
"495","53687351","天揚實業有限公司","新北市新莊區中平路6巷31號","","1000000","1010301","1040226"
"496","53694775","廣鉅貿易有限公司","新北市蘆洲區信義路361巷7號1樓","","1000000","1010330","1040202"
"497","53700072","東瑞國際有限公司","新北市板橋區民有街54號(1樓)","","500000","1010425","1040210"
"498","53703155","巧芳食品有限公司","臺北市文山區木新路3段310巷12弄12號4樓","","500000","1010509","1040202"
"499","53705983","愛斯奎爾有限公司","新北市中和區平和里新生街217號","","1100000","1010522","1040211"
"500","53707201","翔和不動產有限公司","新北市汐止區信望里大同路2段540號(1、2樓)","","500000","1010528","1040204"
"501","53708166","翔準工程有限公司","新北市中和區自立路99巷18號","","5000000","1010531","1040205"
"502","53710000","活石國際有限公司","新北市永和區永和路2段121號10樓之2","","250000","1010611","1040210"
"503","53720020","巨楊有限公司","新北市板橋區僑中一街124巷20弄27之2號","","300000","1010727","1040205"
"504","53721652","宗欣有限公司","新北市板橋區雙十路3段10巷1弄8號3樓","","1000000","1010807","1040226"
"505","53723791","昱昇企管顧問有限公司","新北市板橋區中山路2段359號2樓","","500000","1010816","1040209"
"506","53732433","默克禮創作工坊有限公司","臺北市內湖區星雲街47號","","2000000","1010118","1040204"
"507","53738491","小南國有限公司","臺北市中山區龍江路106巷1號1樓、龍江路108號1樓、2樓、2樓之1","","2000000","1010220","1040202"
"508","53738823","榮昭企業有限公司","臺北市松山區復興南路1段1號8樓之3","","500000","1010220","1040210"
"509","53740594","維懿企業有限公司","臺北市北投區光明路223號9樓","","5000000","1010224","1040225"
"510","53769830","跳動體能有限公司","臺北市中正區博愛路53號10樓","","350000","1010529","1040206"
"511","53773145","匯聖國際投資顧問有限公司","臺北市中山區建國北路2段147號4樓之3","","1000000","1010608","1040217"
"512","53811598","核心有限公司","苗栗縣卓蘭鎮坪林里雙連12之1號","","386190","1010307","1040204"
"513","53813532","永杉豐有限公司","彰化縣田中鎮西路里大社路1段111號1樓","","500000","1010312","1040206"
"514","53815406","能量水生物科技有限公司","新竹市北區金華里光華東街67巷7號1樓","","1000000","1010315","1040203"
"515","53819450","威鴻開發股份有限公司","桃園市中壢區東興里中北路二段119號5樓之1","","1000000","1010322","1040206"
"516","53827178","嘉錡興業有限公司","嘉義縣中埔鄉和興村中華路739巷4弄10號1樓","","3000000","1010403","1040206"
"517","53834277","科篁環保科技股份有限公司","新北市中和區中山路2段299號5樓之1","","1000000","1010417","1040203"
"518","53834749","盈碩國際發展有限公司","桃園市大園區橫峰里平安路143號","","2500000","1010418","1040205"
"519","53837801","台大華科技實業有限公司","嘉義市東區長竹里大雅路二段228號1樓","","2000000","1010424","1040224"
"520","53841973","東峰雲端有限公司","臺中市南區愛國街37號","","100000","1010502","1040216"
"521","53848032","富綠意有限公司","宜蘭縣冬山鄉香和村香和路123號1樓","","500000","1010514","1040217"
"522","53852400","仁華國際企業有限公司","基隆市安樂區基金三路46巷14號6樓","","3000000","1010522","1040224"
"523","53858354","百莊鋼鐵有限公司","桃園市觀音區中山路一段1171巷16弄6號","","1500000","1010601","1040213"
"524","53861956","永宥廣告企業有限公司","桃園市大溪區瑞源里石園路680巷30號1樓","","300000","1010608","1040209"
"525","53864742","宸詰企業有限公司","臺中市西屯區中工二路192號6樓","","350000","1010615","1040130"
"526","53872460","源豐園開發股份有限公司","臺中市西屯區文心路三段167-7號2樓","","20000000","1010629","1040203"
"527","53884212","立豐生技有限公司","高雄市三民區新民路83巷23號","","1600000","1010725","1040217"
"528","53884249","大僖廣告有限公司","高雄市鹽埕區大公路121巷9號5樓之2","","100000","1010726","1040212"
"529","53886696","九潤生技股份有限公司","高雄市三民區德山街35巷7號","","400000","1010816","1040210"
"530","53889589","呈龍企業有限公司","高雄市楠梓區右昌街143巷92弄25之5號","","300000","1010917","1040130"
"531","53891184","元鑫系統傢俱有限公司","高雄市大寮區仁忠路250號","","100000","1011003","1040217"
"532","53905286","萬龍車業有限公司","高雄市鳳山區中山東路127號1樓","","1000000","1020205","1040217"
"533","53910529","喜聚文創開發顧問股份有限公司","臺北市大安區延吉街120號3樓","","10000000","1010704","1040217"
"534","53916967","湧志有限公司","桃園市桃園區大林里大原路16巷30弄2號1樓","","2500000","1010724","1040216"
"535","53918607","皇鑫股份有限公司","臺北市松山區民生東路5段148號5樓之1","","5000000","1010730","1040216"
"536","53922010","朗瑞環球投資顧問股份有限公司","臺北市中山區建國北路2段120號3樓","","50000000","1010813","1040203"
"537","53922601","堃宏國際有限公司","臺北市中山區林森北路119巷88號7樓","","1200000","1010814","1040202"
"538","53926917","啄木鳥實業有限公司","臺北市內湖區港墘路187號1樓","","2000000","1010828","1040203"
"539","53942249","易步科技有限公司","臺北市松山區八德路4段650號7樓之9","","1000000","1011018","1040205"
"540","53945203","創健來股份有限公司","臺北市中正區林森北路5巷12號3樓","","3580000","1011025","1040206"
"541","53955953","萬商資產管理顧問有限公司","臺北市中山區中山北路2段75之1號","","1000000","1011204","1040226"
"542","53963617","樂維塔廚房有限公司","臺中市龍井區竹坑里中華路一段176號","","100000","1010725","1040202"
"543","53967938","久川食府股份有限公司","新北市中和區秀峰里景德街29號","","5000000","1010806","1040224"
"544","53970510","旭磊建設股份有限公司","臺中市沙鹿區六路里南陽路163號","","5000000","1010810","1040204"
"545","53987940","最自然生物科技股份有限公司","臺中市北屯區廍子里廍子巷5-11號3樓","","20000000","1010921","1040204"
"546","54004382","舜鴻貿易有限公司","雲林縣斗六市鎮西里同德街56號1樓","","500000","1011101","1040226"
"547","54009669","菱永電梯股份有限公司","新北市三重區重新路4段85巷12號","","6000000","1010914","1040205"
"548","54010672","萩屋餐飲有限公司","新北市三峽區龍學里學成路398號4樓","","1000000","1010920","1040205"
"549","54014706","福客臨餐飲企業有限公司","新北市土城區員福里中華路1段208號","","1800000","1011011","1040216"
"550","54015439","楓創意設計有限公司","新北市新莊區中華路2段231號(1樓)","","1000000","1011015","1040216"
"551","54024155","利昌生物科技有限公司","新北市樹林區太元街2巷1號12樓","","100000","1011126","1040213"
"552","54033458","連一國際股份有限公司","新北市新莊區新北大道3段5號4樓之5","","10000000","1020111","1040225"
"553","54036552","凱依娛樂有限公司","新北市永和區環河西路2段209巷7號4樓之1","","20000","1020125","1040217"
"554","54036716","大陽有機肥料有限公司","新北市三芝區中正路3段7號8樓","","1000000","1020128","1040224"
"555","54055121","台灣莊村有限公司","新北市三重區仁愛街731號11樓","","1000000","1020424","1040226"
"556","54057021","澄暄企業有限公司","新北市永和區福和路5號3樓之5","","5000000","1020503","1040202"
"557","54070707","璽裕建設開發有限公司","臺南市南區新建路33巷1號4樓","","1000000","1020131","1040211"
"558","54074197","聚恆實業有限公司","臺南市安南區溪心里安吉路2段75號1樓","","3000000","1020410","1040225"
"559","54079432","祐宗工業有限公司","臺南市永康區中正二街215號1樓","","5000000","1020628","1040211"
"560","54081649","廣鑫建設有限公司","臺南市永康區富強路1段168巷8號","","10000000","1020802","1040226"
"561","54095741","宬暘工程有限公司","雲林縣麥寮鄉麥豐村自由路222巷8號1樓","","3000000","1011129","1040203"
"562","54097065","天夏有限公司","桃園市楊梅區永寧里老莊路505巷63弄3號1樓","","100000","1011203","1040130"
"563","54100322","伯利恆投資有限公司","臺中市西區英才路530號9樓之3","","100000","1011211","1040213"
"564","54104903","虹嶺茶葉有限公司","臺中市西屯區廣福里廣福路163巷75號1樓","","1000000","1011220","1040205"
"565","54108746","鴻發健康管理顧問有限公司","苗栗縣通霄鎮通西里5鄰和平路38號","","300000","1011227","1040225"
"566","54128378","昌祐有限公司","桃園市桃園區西埔里富國路651巷5弄6號1樓","","100000","1020220","1040212"
"567","54131845","楙豐展藝有限公司","臺中市霧峰區南柳里福新路280號1樓","","500000","1020301","1040204"
"568","54132942","宏揚影音科技有限公司","桃園市大溪區仁德一街107號1樓","","1000000","1020305","1040211"
"569","54133323","允昌資訊有限公司","桃園市桃園區福林里陽明九街51號2樓","","500000","1020306","1040210"
"570","54136291","立邦國際企業有限公司","屏東縣新園鄉共和村光復路166之1號1樓","","300000","1020312","1040216"
"571","54150928","香布有限公司","臺北市中山區農安街20號7樓之11","","250000","1011222","1040204"
"572","54153278","華霞投資有限公司","桃園市桃園區中正路1071號17樓之3","","250000","1011228","1040130"
"573","54158040","怡合股份有限公司","臺北市大安區金華街207號","","1000000","1020118","1040203"
"574","54158479","京鑫國際開發股份有限公司","臺北市士林區福國路38號1樓","","3000000","1020118","1040217"
"575","54159809","台灣遠邁有限公司","臺北市大安區復興南路2段27號9樓之10","","50000","1020123","1040202"
"576","54160117","泰來國際有限公司","臺北市中山區中山北路2段115巷43號5樓之4","","3000000","1020124","1040202"
"577","54161306","妍燕有限公司","臺北市信義區基隆路2段145號9樓之1","","150000","1020129","1040216"
"578","54161586","匠玩科技有限公司","臺北市信義區光復南路417號2樓之3","","700000","1020130","1040213"
"579","54162564","君碩有限公司","臺北市松山區新東街41之5號3樓","","250000","1020201","1040225"
"580","54176379","諾貝霖有限公司","臺北市萬華區昆明街201巷20弄4號","","1000000","1020326","1040224"
"581","54176808","舒凡國際貿易有限公司","臺北市南港區玉成街25巷5弄13號","","200000","1020327","1040212"
"582","54177362","詩蜜涵有限公司","臺北市中正區信義路2段33號5樓之1","","1000000","1020328","1040204"
"583","54178377","豪銘工程有限公司","臺北市中正區南昌路2段31號2樓","","1000000","1020401","1040216"
"584","54186263","震宇通信有限公司","桃園市桃園區大興路172號（1樓）","","1000000","1020426","1040203"
"585","54188375","大元設計有限公司","臺北市大安區復興南路2段237號8樓之3","","500000","1020503","1040202"
"586","54211278","季有漁業有限公司","高雄市苓雅區自強三路3號30樓之1","","3000000","1020913","1040211"
"587","54214970","三利雙翼股份有限公司","高雄市新興區和平一路215號5樓之7","","8000000","1021016","1040203"
"588","54215507","瀚納權鑫有限公司","高雄市苓雅區自強三路5號20樓之2","","150000","1021021","1040212"
"589","54228215","艾樂斯國際有限公司","新竹縣新豐鄉松林村松柏林82號1樓","","100000","1020403","1040202"
"590","54228411","寶亮貿易有限公司","臺中市大雅區民生路一段91號1樓","","1000000","1020403","1040212"
"591","54231984","遠亦產品開發設計有限公司","臺中市太平區中興里永平路2段360號","","1000000","1020412","1040204"
"592","54237185","寶盛昌興業有限公司","雲林縣褒忠鄉中民村中正路22-1號1樓","","1000000","1020423","1040225"
"593","54239389","佳姿美生物科技有限公司","臺中市南區國光里興大路82號1樓","","400000","1020426","1040206"
"594","54240007","翔正綠能科技有限公司","桃園市龜山區萬壽路二段889號","","500000","1020426","1040212"
"595","54240040","炳榮綠能科技有限公司","桃園市龜山區大同路3號2樓","","1500000","1020426","1040212"
"596","54240317","豪駿實業有限公司","桃園市大園區田心里華中街71號1樓","","500000","1020429","1040206"
"597","54242265","萬達全球地產有限公司","雲林縣斗六市虎溪里西平路424號1樓","","1000000","1020503","1040211"
"598","54243068","保利興工程行有限公司","臺中市西屯區何南里精明路48之1號2樓","","800000","1020506","1040216"
"599","54243790","川曜建設有限公司","新竹縣竹北市復興三路一段2號","","5000000","1020507","1040206"
"600","54251159","台通益有限公司","臺中市北屯區同榮里同榮一街221號7樓","","200000","1020521","1040216"
"601","54254727","潔能動力科技股份有限公司","臺中市南屯區永春東三路41之1號2樓","","1000000","1020528","1040226"
"602","54256387","鈺盛工業有限公司","臺中市大肚區大東里自由路222巷26號1樓","","1000000","1020530","1040211"
"603","54267336","尚昌開發有限公司","桃園市桃園區大興里經國路9號16樓之2","","100000","1020621","1040202"
"604","54276004","尚騰管理顧問有限公司","新北市永和區永和路2段218號","","200000","1020610","1040217"
"605","54280680","了了文化有限公司","新北市板橋區新海路72巷64號3樓","","500000","1020701","1040210"
"606","54281597","武清工程有限公司","新北市新店區安康路2段58巷7號4樓","","1000000","1020703","1040206"
"607","54282723","今澤科技有限公司","新北市新店區忠誠里北新路2段97巷6號5樓","","250000","1020709","1040225"
"608","54284905","燃燈實業有限公司","新北市新店區復興里建國路257號5樓之21","","300000","1020718","1040203"
"609","54286002","藝麗欣實業有限公司","新北市樹林區柑園街1段365巷6號","","10000000","1020723","1040210"
"610","54286468","馨啟有限公司","新北市新店區公崙里安忠路57巷3之8號6樓之1","","500000","1020724","1040211"
"611","54287620","勝通不動產有限公司","新北市板橋區溪北里篤行路2段142號","","1000000","1020730","1040212"
"612","54289606","永鑫國際實業有限公司","新北市林口區湖南里中山路556號7樓","","500000","1020808","1040212"
"613","54293518","晟發不動產經紀有限公司","新北市板橋區和平路178號","","1000000","1020828","1040213"
"614","54293806","嘉舍國際有限公司","新北市淡水區新民街1段95號5樓","","500000","1020829","1040216"
